Title,Price,Area,Location,type
"Cho thuê mặt bằng phố Trần Đăng Ninh, Cầu Giấy",Giá: 11 triệu / tháng,"Diện tích: 25 m
2","Phố Trần Đăng Ninh, Phường Dịch Vọng, Quận Cầu Giấy, Hà Nội",cho_thue_cua_hang
Cho thuê mặt bằng phố nghĩa tân giá 8 triệu. LH A Minh,Giá: 8 triệu / tháng,"Diện tích: 30 m
2","Đường Nghĩa Tân, Phường Nghĩa Tân, Quận Cầu Giấy, Hà Nội",cho_thue_cua_hang
"Cho thuê cửa hàng tầng 1 mặt phố Trần Quý Kiên, LH An Minh",Giá: 15 triệu / tháng,"Diện tích: 30 m
2","Phố Trần Quý Kiên, Phường Dịch Vọng, Quận Cầu Giấy, Hà Nội",cho_thue_cua_hang
Cho thuê cửa hàng phố Nghĩa Tân giá 12 triệu. LH A Minh,Giá: 12 triệu / tháng,"Diện tích: 25 m
2","Đường Nghĩa Tân, Phường Nghĩa Tân, Quận Cầu Giấy, Hà Nội",cho_thue_cua_hang
Thuê mặt bằng kinh doanh gần Trường Cao Đẳng Du Lịch giá 12 triệu,Giá: 12 triệu / tháng,"Diện tích: 30 m
2","Đường Hoàng Quốc Việt, Phường Cổ Nhuế 1, Quận Bắc Từ Liêm, Hà Nội",cho_thue_cua_hang
"Cho thuê kiot tầng 1 đến chung cư N11 phố Trần Quý Kiên, Cầu Giấy",Giá: 11 triệu / tháng,"Diện tích: 25 m
2","Phố Trần Quý Kiên, Phường Dịch Vọng, Quận Cầu Giấy, Hà Nội",cho_thue_cua_hang
Cho thuê SHOP đế chung cư phố Trần Quý Kiên. LH An Minh,Giá: 11 triệu / tháng,"Diện tích: 45 m
2","Phố Trần Quý Kiên, Phường Dịch Vọng, Quận Cầu Giấy, Hà Nội",cho_thue_cua_hang
Cho thuê mặt bằng Kinh doanh - Thương mại tại ngã tư Trần Bình Phạm Hùng,Giá: 459 ngàn / m2  / tháng,"Diện tích: 485 m
2","Đường Trần Bình, Phường Mỹ Đình 2, Quận Nam Từ Liêm, Hà Nội",cho_thue_cua_hang
"Cho thuê sàn TM Ngoại giao đoàn, 270m Cafe, Siêu thị, tóc, nhà hàng, phòng khám",Giá: 60 triệu / tháng,"Diện tích: 270 m
2","Phường Xuân Tảo, Quận Bắc Từ Liêm, Hà Nội",cho_thue_cua_hang
"Cho thuê mặt phố Khâm Thiên, 50 m2, riêng biệt mt 5m, giá 17 triệu",Giá: 17 triệu / tháng,"Diện tích: 50 m
2","Phố Khâm Thiên, Phường Khâm Thiên, Quận Đống Đa, Hà Nội",cho_thue_cua_hang
"Cho thuê chân đế chung cư Dương Nội, CT8, dt 132 m2, giá 25 triệu bao thuế",Giá: 25 triệu / tháng,"Diện tích: 132 m
2","Đường Tố Hữu, Phường Dương Nội, Quận Hà Đông, Hà Nội",cho_thue_cua_hang
"Cho thuê cửa hàng 222 Khâm Thiên, 50 m2 giá 17 triệu",Giá: 17 triệu / tháng,"Diện tích: 50 m
2","Phố Khâm Thiên, Phường Thổ Quan, Quận Đống Đa, Hà Nội",cho_thue_cua_hang
Cần sang gấp 2 Kiost liền kề Khu Harbour Vinpearl Nha Trang,Giá: 110 triệu / tháng,"Diện tích: 32 m
2","Phường Vĩnh Nguyên, Thành phố Nha Trang, Khánh Hòa",cho_thue_cua_hang
Cho thuê mặt đường Shophouse K7 StarLake Tây Hồ Tây Hà Nội - Giá từ 100 triệu,Giá: 100 triệu / tháng,"Diện tích: 200 m
2","Đường Nguyễn Văn Huyên, Phường Xuân La, Quận Tây Hồ, Hà Nội",cho_thue_cua_hang
"Kiot 55m2 gần Hồng Hà Eco City- BV Nội Tiết, 5tr/th",Giá: 5 triệu / tháng,"Diện tích: 55 m
2","Đường Cổ Điển A, Xã Tứ Hiệp, Huyện Thanh Trì, Hà Nội",cho_thue_cua_hang
"Cho thuê cửa hàng kinh doanh đầu ngõ 99 đường Cầu Diễn, diện tích 26m2 giá thuê: 5tr/tháng",Giá: 5 triệu / tháng,"Diện tích: 26 m
2","Đường Cầu Diễn, Phường Phúc Diễn, Quận Bắc Từ Liêm, Hà Nội",cho_thue_cua_hang
Dành cho anh chị kinh doanh giặt sấy,"Giá: 3,5 triệu / tháng","Diện tích: 37 m
2","Đường Nguyễn Văn Cừ, Phường An Hòa, Quận Ninh Kiều, Cần Thơ",cho_thue_cua_hang
"Cần cho thuê nhanh chân đế lô góc chung cư Ngoại Giao Đoàn, xuân Tảo, dt 270m2",Giá: 60 triệu / tháng,"Diện tích: 270 m
2","Phố Minh Tảo, Phường Xuân Tảo, Quận Bắc Từ Liêm, Hà Nội",cho_thue_cua_hang
"Cho Thuê MẶT BẰNG 60m2 Mọi Hình Kinh Doanh - Đường Số 4, P5, Gò Vấp",Giá: 18 triệu / tháng,"Diện tích: 60 m
2","Đường Số 4, Phường 5, Quận Gò Vấp, Hồ Chí Minh",cho_thue_cua_hang
"Cho thuê sàn thương mại tầng 1 diện tích 630m2 chung cư Nghĩa Đô, Cầu Giấy, Hà Nội. Vị",Giá: 180 triệu / tháng,"Diện tích: 630 m
2","Phố Nghĩa Đô, Phường Nghĩa Đô, Quận Cầu Giấy, Hà Nội",cho_thue_cua_hang
Gia chủ gửi cho thuê tầng 1 kinh doanh ngay cột đồng hồ mặt đường Lê Thái Tổ,Giá: 70 triệu / tháng,"Diện tích: 165 m
2","Đường Lý Thái Tổ, Phường Võ Cường, Thành phố Bắc Ninh, Bắc Ninh",cho_thue_cua_hang
Cho thuê nguyên tòa 4 tầng mặt tiền gần ĐẠI HỌC ĐÔNG Á,Giá: 60 triệu / tháng,"Diện tích: 71 m
2","Đường Núi Thành, Phường Hòa Cường Nam, Quận Hải Châu, Đà Nẵng",cho_thue_cua_hang
"Q. Tân Phú ! SANG RẺ QUÁN NHÀ HÀNG – BEER DJ QUY MÔ – Múp food & beer, DTSD gần 600 m2,",Giá: 730 triệu / tháng,"Diện tích: 600 m
2","Đường Kênh Tân Hóa, Phường Hiệp Tân, Quận Tân Phú, Hồ Chí Minh",cho_thue_cua_hang
"Cho thuê Shoroom oto mặt Đường Lê Văn Lương, 2000m2 x 1 tầng, mặt tiền 50m, 200tr/th",Giá: 200 triệu / tháng,"Diện tích: 2.000 m
2","Đường Lê Văn Lương, Phường Nhân Chính, Quận Thanh Xuân, Hà Nội",cho_thue_cua_hang
"Cho thuê Shoroom oto mặt Đường Lê Trọng Tấn, 1000m2 x 1 tầng, mặt tiền 30m, 100tr/th",Giá: 100 triệu / tháng,"Diện tích: 1.000 m
2","Đường Lê Trọng Tấn, Phường Định Công, Quận Hoàng Mai, Hà Nội",cho_thue_cua_hang
Chính chủ cần sang gấp quán Cafe kinh doanh đang ổn đinh,Giá: 100 triệu / tháng,"Diện tích: 80 m
2","Đường Lê Văn Phan, Phường Phú Thọ Hòa, Quận Tân Phú, Hồ Chí Minh",cho_thue_cua_hang
"Cần sang lại quán cafe sân vườn hồ cá koi đang kinh doanh, gần ngã 3 Cầu Đồng Khởi",Giá: 15 triệu / tháng,"Diện tích: 1.500 m
2","Đường Đồng Khởi, Phường Trảng Dài, Thành phố Biên Hoà, Đồng Nai",cho_thue_cua_hang
Cho Thuê Căn Shophouse Lam Kinh - KĐT Bình Minh - FULL đồ cao cấp,Giá: 30 triệu / tháng,"Diện tích: 120 m
2","Đường Đại Lộ Lê Lợi, Phường Đông Hương, Thành phố Thanh Hóa, Thanh Hóa",cho_thue_cua_hang
"Cho thuê mặt bằng tầng 1 giá 8 triệu phố Trần Tử Bình, Nghĩa Tân",Giá: 8 triệu / tháng,"Diện tích: 15 m
2","Phố Trần Tử Bình, Phường Nghĩa Tân, Quận Cầu Giấy, Hà Nội",cho_thue_cua_hang
Cho thuê văn phòng quận Nam Từ Liêm tòa nhà Dolphin Plaza giá hấp dẫn,Giá: 360 ngàn / m2  / tháng,"Diện tích: 610 m
2","Đường Nguyễn Hoàng, Phường Mỹ Đình 1, Quận Nam Từ Liêm, Hà Nội",cho_thue_cua_hang
Cho thuê cửa hàng lô góc phố Trung Kính to 50m2 giá 28tr/th. Lì xì 2tr khai xuân,Giá: 28 triệu / tháng,"Diện tích: 55 m
2","Phố Trung Kính, Phường Yên Hòa, Quận Cầu Giấy, Hà Nội",cho_thue_cua_hang
Cần sang quán cà phê Buôn Ma Thuột,Giá: Thỏa thuận,"Diện tích: 200 m
2","Đường Tuệ Tĩnh, Phường Ea Tam, Thành phố Buôn Ma Thuột, Đắk Lắk",cho_thue_cua_hang
"Mặt bằng kinh doanh mặt phố Lạc Long Quân Tây Hồ, 53.4m² mặt tiền 4.1m","Giá: 17,5 triệu / tháng","Diện tích: 54 m
2","Đường Lạc Long Quân, Phường Nghĩa Đô, Quận Cầu Giấy, Hà Nội",cho_thue_cua_hang
"Nhà mặt phố Nguyễn Khánh Toàn, Diện tích 50m2 x 2 tầng riêng biệt, măt tiền 7m",Giá: 35 triệu / tháng,"Diện tích: 100 m
2","Đường Nguyễn Khánh Toàn, Phường Quan Hoa, Quận Cầu Giấy, Hà Nội",cho_thue_cua_hang
"Cho thuê văn phòng, 185m2 - 300m2 , Đường Bạch Đằng, Quận Tân Bình",Giá: 87 triệu / tháng,"Diện tích: 185 m
2","Đường Bạch Đằng, Phường 2, Quận Tân Bình, Hồ Chí Minh",cho_thue_cua_hang
"CỬA HÀNG MẶT PHỐ 52M2, SỞ HỮU 2 VỈA HÈ RỘNG. RIÊNG BIỆT",Giá: 14 triệu / tháng,"Diện tích: 52 m
2","Đường Sông Sét, Phường Tương Mai, Quận Hoàng Mai, Hà Nội",cho_thue_cua_hang
🍒🍍NHÀ NGUYÊN CĂN - LÊ VĂN SỸ Q3 ( CHDV/SHOP/SPA ),Giá: 60 triệu / tháng,"Diện tích: 150 m
2","Đường Lê Văn Sỹ, Phường 12, Quận 3, Hồ Chí Minh",cho_thue_cua_hang
Sang quán cà phê góc 2 mặt tiền ngay thiên đường CF quận Tân Phú đắc địa 13tr/th,Giá: 13 triệu / tháng,"Diện tích: 60 m
2","Đường Nguyễn Hậu, Phường Tân Thành, Quận Tân Phú, Hồ Chí Minh",cho_thue_cua_hang
CHÍNH CHỦ CẦN CHO THUÊ MẶT BẰNG MẶT TIỀN ĐƯỜNG ĐỊNH CƯ – PHƯỜNG TÂN LẬP – TP NHA TRANG,Giá: 5 triệu / tháng,"Diện tích: 60 m
2","Đường Định Cư, Phường Tân Lập, Thành phố Nha Trang, Khánh Hòa",cho_thue_cua_hang
"CHO THUÊ MẶT BẰNG KINH DOANH Ở PHỐ NGÔ QUYỀN, PHƯỜNG HÀNG BÀI, QUẬN HOÀN KIẾM, HÀ NỘI",Giá: 18 triệu / tháng,"Diện tích: 14 m
2","Phố Ngô Quyền, Phường Hàng Bài, Quận Hoàn Kiếm, Hà Nội",cho_thue_cua_hang
"Chính chủ cần sang nhượng quán trà sữa + Địa chỉ: 84 Âu Cơ, Hòa Khánh Bắc, Liên Chiểu, Đà",Giá: 17 triệu / tháng,Diện tích: KXĐ,"Đường Âu Cơ, Phường Hòa Khánh Bắc, Quận Liên Chiểu, Đà Nẵng",cho_thue_cua_hang
Cho thuê mặt bằng Kinh doanh tại Thành phố Hải Dương,Giá: 42 triệu / tháng,"Diện tích: 300 m
2","Đường Nguyễn Lương Bằng, Phường Thanh Bình, Thành phố Hải Dương, Hải Dương",cho_thue_cua_hang
Cần sang lại mặt bằng kinh doanh thời trang gấp,Giá: 8 triệu / tháng,"Diện tích: 25 m
2","Đường Ông Ích Khiêm, Phường 10, Quận 11, Hồ Chí Minh",cho_thue_cua_hang
"Cửa hàng kinh doanh mặt phố Xuân Thủy. Diện tích 70m2 x 2 tầng, mặt tiền rộng 4m",Giá: 35 triệu / tháng,"Diện tích: 70 m
2","Đường Xuân Thủy, Phường Dịch Vọng Hậu, Quận Cầu Giấy, Hà Nội",cho_thue_cua_hang
"chủ cần cho thuê mặt bằng KD, cửa hàng tầng 1 70m2 tại mặt phố Quan Hoa",Giá: 25 triệu / tháng,"Diện tích: 70 m
2","Phố Quan Hoa, Phường Quan Hoa, Quận Cầu Giấy, Hà Nội",cho_thue_cua_hang
Cho thuê cửa hàng mặt ngõ 112 Ngọc Khánh để kinh doanh buôn bán. Giá 2 tr/th,Giá: 2 triệu / tháng,"Diện tích: 15 m
2","Phố Ngọc Khánh, Phường Giảng Võ, Quận Ba Đình, Hà Nội",cho_thue_cua_hang
"CHO THUÊ ỐT KINH DOANH ở mặt đường Ngô Đức Mai, Xóm Phúc Hoà, Hưng Tây, Hưng Nguyên, Nghệ",Giá: 3 triệu / tháng,Diện tích: KXĐ,"Đường Lê Xuân Đào, Xã Hưng Tây, Huyện Hưng Nguyên, Nghệ An",cho_thue_cua_hang
Cho thuê cửa hàng tại Hoàng Minh Thảo,"Giá: 7,5 triệu / tháng","Diện tích: 32 m
2","Đường Hoàng Minh Thảo, Phường Nghĩa Xá, Quận Lê Chân, Hải Phòng",cho_thue_cua_hang
"Cho thuê cửa hàng 107A3 Thanh Xuân Bắc 45m khép kín có chỗ ở, đường 2 oto 9,5tr","Giá: 9,5 triệu / tháng","Diện tích: 45 m
2","Đường Khuất Duy Tiến, Phường Thanh Xuân Bắc, Quận Thanh Xuân, Hà Nội",cho_thue_cua_hang
cho thuê cửa hàng tầng 1 + lửng riêng biệt 30m² tại Triều Khúc,Giá: 7 triệu / tháng,"Diện tích: 30 m
2","Đường Triều Khúc, Phường Thanh Xuân Nam, Quận Thanh Xuân, Hà Nội",cho_thue_cua_hang
"Cần cho thuê gấp mặt bằng mặt tiền Nguyễn Trãi, P.Thanh Bình, Biên Hoà",Giá: 40 triệu / tháng,"Diện tích: 180 m
2","Đường Nguyễn Trãi, Phường Thanh Bình, Thành phố Biên Hoà, Đồng Nai",cho_thue_cua_hang
CHO THUÊ MẶT BẰNG KINH DOANH TẠI BỬU LONG 600M,Giá: 30 triệu / tháng,"Diện tích: 600 m
2","Đường Huỳnh Văn Nghệ, Phường Bửu Long, Thành phố Biên Hoà, Đồng Nai",cho_thue_cua_hang
Kiosk MẶT TIỀN – GẦN CẦU ÔNG BỐ - 1.8 triệu /////////////////,"Giá: 1,8 triệu / tháng","Diện tích: 24 m
2","Phường Bình Hòa, Thành phố Thuận An, Bình Dương",cho_thue_cua_hang
"Cho thuê sàn thương mại, văn phòng quận Nam Từ Liêm tòa nhà Dolphin Plaza giá hấp dẫn",Giá: 470 ngàn / m2  / tháng,"Diện tích: 2.300 m
2","Đường Trần Bình, Phường Mỹ Đình 1, Quận Nam Từ Liêm, Hà Nội",cho_thue_cua_hang
"Cho thuê sàn thương mại, văn phòng quận Nam Từ Liêm tòa nhà Golden Palace giá hấp dẫn",Giá: 280 triệu / tháng,"Diện tích: 620 m
2","Đường Mễ Trì, Phường Mễ Trì, Quận Nam Từ Liêm, Hà Nội",cho_thue_cua_hang
"CẦN CHO THUÊ MẶT BẰNG THÔ 2 TẦNG Ở 264 VĂN CHƯƠNG, PHƯỜNG KHÂM THIÊN, QUẬN ĐỐNG ĐA, HÀ NỘI",Giá: 24 triệu / tháng,"Diện tích: 70 m
2","Phường Khâm Thiên, Quận Đống Đa, Hà Nội",cho_thue_cua_hang
Cho thuê quán Bar mặt tiền gần BẠCH ĐẰNG - 2,"Giá: 99,999 triệu / tháng","Diện tích: 230 m
2","Đường Trần Phú, Phường Phước Ninh, Quận Hải Châu, Đà Nẵng",cho_thue_cua_hang
Cho thuê văn phòng và sàn thương mại quận Nam Từ Liêm tòa nhà Golden Palace giá rẻ,Giá: 180 ngàn / m2  / tháng,"Diện tích: 370 m
2","Đường Mễ Trì, Phường Mễ Trì, Quận Nam Từ Liêm, Hà Nội",cho_thue_cua_hang
Cho thuê sàn thương mại văn phòng quận Đống Đa tòa nhà Diamond Park Plaza giá hấp dẫn,Giá: 550 ngàn / m2  / tháng,"Diện tích: 747 m
2","Phố Láng Hạ, Phường Thành Công, Quận Ba Đình, Hà Nội",cho_thue_cua_hang
Sang quán ăn đắc địa đường Mạc Thiên Tích,Giá: 16 triệu / tháng,"Diện tích: 207 m
2","Đường Mạc Thiên Tích, Phường Xuân Khánh, Quận Ninh Kiều, Cần Thơ",cho_thue_cua_hang
"Cho thuê 600m2 HXH đường lê văn sỹ, P14,Q3. DT 8x25m, trệt 2 lầu. Gía 70tr",Giá: 70 triệu / tháng,"Diện tích: 600 m
2","Đường Lê Văn Sỹ, Phường 14, Quận 3, Hồ Chí Minh",cho_thue_cua_hang
"CHO THUÊ NHÀ MẶT PHỐ HUẾ, HAI BÀ TRƯNG, 55m2 x 4 TẦNG, VỈA HÈ RỘNG, KINH DOANH ĐỈNH",Giá: 32 triệu / tháng,"Diện tích: 55 m
2","Phố Huế, Phường Phố Huế, Quận Hai Bà Trưng, Hà Nội",cho_thue_cua_hang
Cho Thuê Quán Cafe Sân Vườn rộng rãi TT Phú Mỹ BRVT,Giá: 15 triệu / tháng,"Diện tích: 300 m
2","Phường Phú Mỹ, Thị Xã Phú Mỹ, Bà Rịa Vũng Tàu",cho_thue_cua_hang
Cho thuê mặt bằng kinh doanh tại TP Hải Dương,Giá: 55 triệu / tháng,"Diện tích: 690 m
2","Đường Đỗ Ngọc Du, Phường Phạm Ngũ Lão, Thành phố Hải Dương, Hải Dương",cho_thue_cua_hang
Cho thuê Mặt bằng 60m2 + lửng MT Phạm Thế Hiển P4Q8-16 triệu/ tháng TL,Giá: 16 triệu / tháng,"Diện tích: 60 m
2","Đường Phạm Thế Hiển, Phường 4, Quận 8, Hồ Chí Minh",cho_thue_cua_hang
"CẦN SANG TIỆM – NAIL Mi – GỘI ĐANG HOẠT ĐỘNG, ĐỊA CHỈ 441/27 NGUYỄN ĐÌNH CHIỂU, PHƯỜNG 5",Giá: 12 triệu / tháng,"Diện tích: 40 m
2","Đường Nguyễn Đình Chiểu, Phường 5, Quận 3, Hồ Chí Minh",cho_thue_cua_hang
Han Square - Nơi thoả mãn đam mê mua sắm thời thượng,Giá: 7 triệu / tháng,"Diện tích: 04 m
2","Đường Nguyễn Thái Học, Phường Hải Châu I, Quận Hải Châu, Đà Nẵng",cho_thue_cua_hang
"Cho thuê shop góc 2 mặt tiền đẹp nhất Phú Mỹ Hưng, Quận 7",Giá: 100 triệu / tháng,"Diện tích: 400 m
2","Đường Nguyễn Văn Linh, Phường Tân Phong, Quận 7, Hồ Chí Minh",cho_thue_cua_hang
"cho thuê shop kinh doanh sky garden, 180m2, trệt lửng, căn góc đường phạm văn nghị, Q.7",Giá: 80 triệu / tháng,"Diện tích: 180 m
2","Đường Phạm Văn Nghị, Phường Tân Phong, Quận 7, Hồ Chí Minh",cho_thue_cua_hang
cho thuê shop Cảnh viên 2 ngay mặt tiền đường C kế căn góc vị trí đẹp,Giá: 72 triệu / tháng,"Diện tích: 168 m
2","Đường C, Phường Tân Phú, Quận 7, Hồ Chí Minh",cho_thue_cua_hang
"cho thuê mặt bằng kinh doanh shop sky garden, 180m2, trệt lửng, căn góc phạm văn nghị, Q.7",Giá: 80 triệu / tháng,"Diện tích: 180 m
2","Đường Phạm Văn Nghị, Phường Tân Phong, Quận 7, Hồ Chí Minh",cho_thue_cua_hang
"Kiosk rộng MẶT TIỀN – GẦN CẦU ÔNG BỐ - 2,8 triệu /////////////////","Giá: 2,8 triệu / tháng","Diện tích: 48 m
2","Phường Bình Hòa, Thành phố Thuận An, Bình Dương",cho_thue_cua_hang
Cho thuê mặt bằng kinh doanh tại Thành phố Hải Dương,Giá: 6 triệu / tháng,"Diện tích: 100 m
2","Đường Nguyễn Lương Bằng, Phường Thanh Bình, Thành phố Hải Dương, Hải Dương",cho_thue_cua_hang
Cho thuê shophouse thương mại tại chung cư Belleza,Giá: 10 triệu / tháng,"Diện tích: 100 m
2","Đường Phạm Hữu Lầu, Phường Phú Mỹ, Quận 7, Hồ Chí Minh",cho_thue_cua_hang
❌ CHO THUÊ MẶT BẰNG 2 TẦNG TẠI ĐÔNG HÀ- QUẢNG TRỊ,Giá: 6 triệu / tháng,"Diện tích: 120 m
2","Đường Lê Thế Hiếu, Phường 1, Thành phố Đông Hà, Quảng Trị",cho_thue_cua_hang
"BQL tòa nhà cho thuê làm văn phòng, kinh doanh, trục Kim Đồng, Tân Mai",Giá: 8 triệu / tháng,"Diện tích: 90 m
2","Phố Tân Mai, Phường Tân Mai, Quận Hoàng Mai, Hà Nội",cho_thue_cua_hang
[18 TRIỆU] CHO THUÊ NGUYÊN CĂN MẶT TIỀN PHAN TỨ - THUẬN TIỆN KINH DOANH DU LỊCH,Giá: 18 triệu / tháng,"Diện tích: 125 m
2","Đường Phan Tứ, Phường Phước Mỹ, Quận Sơn Trà, Đà Nẵng",cho_thue_cua_hang
CHỈ 25 TRIỆU THUÊ NGAY MẶT TIỀN PHAN ĐĂNG LƯU - NGUYÊN CĂN 188 M2,Giá: 25 triệu / tháng,"Diện tích: 188 m
2","Đường Phan Đăng Lưu, Phường Hòa Cường Bắc, Quận Hải Châu, Đà Nẵng",cho_thue_cua_hang
"CHO THUÊ MẶT BẰNG TẦNG 5 LÀM VĂN PHÒNG Ở ĐƯỜNG DUY TÂN, PHƯỜNG DỊCH VỌNG HẬU, QUẬN CẦU","Giá: 10,5 triệu / tháng","Diện tích: 80 m
2","Phố Duy Tân, Phường Dịch Vọng Hậu, Quận Cầu Giấy, Hà Nội",cho_thue_cua_hang
Cho thuê mặt bằng mặt tiền Bùi Thị Xuân Đà Lạt,Giá: 50 triệu / tháng,"Diện tích: 264 m
2","Đường Bùi Thị Xuân, Phường 2, Thành phố Đà Lạt, Lâm Đồng",cho_thue_cua_hang
NHÀ NGANG 6M - DECOR SẴN VÀO KD NGAY - HỒ HẢO HỚN Q1 - 6X7m - 25 triệu,Giá: 25 triệu / tháng,"Diện tích: 42 m
2","Đường Hồ Hảo Hớn, Phường Cô Giang, Quận 1, Hồ Chí Minh",cho_thue_cua_hang
CHO THUÊ KI-ỐT THƯƠNG XÁ CHỢ HÀN ĐÀ NẴNG,Giá: 10 triệu / tháng,"Diện tích: 05 m
2","Đường Nguyễn Thái Học, Phường Hải Châu I, Quận Hải Châu, Đà Nẵng",cho_thue_cua_hang
CHO THUÊ QUÁN MẶT TIỀN LƯƠNG THẾ VINH TP.BMT 1000M2 - 12TR,Giá: 12 triệu / tháng,"Diện tích: 1.000 m
2","Đường Lương Thế Vinh, Phường Tân Tiến, Thành phố Buôn Ma Thuột, Đắk Lắk",cho_thue_cua_hang
"Cửa hàng, MBKD nhà mặt đường Hoàng Quốc Việt, Dt 150m2 x 1 Tầng, Mt 5m",Giá: 50 triệu / tháng,"Diện tích: 150 m
2","Đường Hoàng Quốc Việt, Phường Nghĩa Tân, Quận Cầu Giấy, Hà Nội",cho_thue_cua_hang
