Title,Price,Area,Location,type
"CC sang quán nhậu mặt tiền đường 30 Tháng 4, Hòa Cường Bắc, Hải Châu, Đà Nẵng",75 triệu/tháng,600 m²,"Hải Châu, Đà Nẵng",cho-thue-sang-nhuong-cua-hang-ki-ot
Cho thuê mặt bằng kinh doanh mua bán,20 triệu/tháng,300 m²,"Đức Hòa, Long An",cho-thue-sang-nhuong-cua-hang-ki-ot
"MB TT60 - Cho thuê mặt bằng làm spa, salon, văn phòng siêu xịn nhà mặt phố Vạn Phúc, ô tô đỗ cửa","7,45 triệu/tháng",70 m²,"Hà Đông, Hà Nội",cho-thue-sang-nhuong-cua-hang-ki-ot
Cho thuê MBKD tại Hoàng Ngân. 70m2 giá 25 triệu. Có thỏa thuận,25 triệu/tháng,70 m²,"Thanh Xuân, Hà Nội",cho-thue-sang-nhuong-cua-hang-ki-ot
Cho thuê tầng 1 và 2 làm kinh doanh - spa tại Hoàng Ngân. 91m2x2 tầng (nhà 8 tầng),33 triệu/tháng,91 m²,"Thanh Xuân, Hà Nội",cho-thue-sang-nhuong-cua-hang-ki-ot
Cho thuê MBKD phố Hoàng Ngân. 91m2 x 3 tầng. Giá thỏa thuận,Giá thỏa thuận,91 m²,"Thanh Xuân, Hà Nội",cho-thue-sang-nhuong-cua-hang-ki-ot
Cho thuê mặt bằng 90m2 giá 19 triệu/tháng tại Thái Hà - Đống Đa,19 triệu/tháng,90 m²,"Đống Đa, Hà Nội",cho-thue-sang-nhuong-cua-hang-ki-ot
Mặt bằng trệt ngang 10m dt 72m2 ngay khu K300 Tân Bình,"16,9 triệu/tháng",72 m²,"Tân Bình, Hồ Chí Minh",cho-thue-sang-nhuong-cua-hang-ki-ot
"Cho thuê mặt bằng quận Bình Thạnh chỉ 10tr ốp kính đẹp sang trọng hầm để xe, máy lạnh, lối đi riêng",10 triệu/tháng,40 m²,"Bình Thạnh, Hồ Chí Minh",cho-thue-sang-nhuong-cua-hang-ki-ot
Quán nhậu tiềm năng rộng rãi 400m2 cần sang nhượng cho chủ mới giá cực tốt,35 triệu/tháng,400 m²,"Cẩm Lệ, Đà Nẵng",cho-thue-sang-nhuong-cua-hang-ki-ot
"Nhượng lại mặt bằng nhà phố Nguyễn Trãi, 3 tầng, chỉ việc vào kinh doanh và ở",20 triệu/tháng,30 m²,"Thanh Xuân, Hà Nội",cho-thue-sang-nhuong-cua-hang-ki-ot
Chính chủ cho thuê MB 100m2 sân thượng (rooftop) P28 Bình Thạnh,10 triệu/tháng,100 m²,"Bình Thạnh, Hồ Chí Minh",cho-thue-sang-nhuong-cua-hang-ki-ot
"Cho thuê tầng trệt nhà riêng biệt, giá 5 triệu/tháng",5 triệu/tháng,40 m²,"Tân Bình, Hồ Chí Minh",cho-thue-sang-nhuong-cua-hang-ki-ot
Cho thuê gian hàng và kiot chợ Vực Kinh doanh dịp tết,317 nghìn/m²,6 m²,"Hoằng Hóa, Thanh Hóa",cho-thue-sang-nhuong-cua-hang-ki-ot
Cho thuê tầng lửng làm MBKD hoặc văn phòng tại Giảng Võ,9 triệu/tháng,60 m²,"Đống Đa, Hà Nội",cho-thue-sang-nhuong-cua-hang-ki-ot
Cho thuê mặt bằng 10x20m khu Cityland P10 Gò Vấp. Kinh doanh tự do đa ngành nghề,35 triệu/tháng,200 m²,"Gò Vấp, Hồ Chí Minh",cho-thue-sang-nhuong-cua-hang-ki-ot
Mặt bằng góc 2 mặt tiền đẹp phù hợp mô hình cafe quán ăn nhà hàng cung đường đắc địa Phan Trung,30 triệu/tháng,450 m²,"Biên Hòa, Đồng Nai",cho-thue-sang-nhuong-cua-hang-ki-ot
"Showroom, cafe ngang 32m, mặt tiền QL91B, giá chỉ 15 triệu/tháng",15 triệu/tháng,220 m²,"Bình Thủy, Cần Thơ",cho-thue-sang-nhuong-cua-hang-ki-ot
Cần cho thuê mặt bằng kiot trung tâm Oriental quận Tân Phú giá 1.2tr,Giá thỏa thuận,25 m²,"Tân Phú, Hồ Chí Minh",cho-thue-sang-nhuong-cua-hang-ki-ot
Nhà mặt phố Láng Hạ 800m2 x 2 tầng mặt tiền 12m cho thuê ngay,350 nghìn/m²,1.200 m²,"Ba Đình, Hà Nội",cho-thue-sang-nhuong-cua-hang-ki-ot
"Tôi cần bán 1 MBKD: 1trệt, 1 lầu, 1sân thượng, tổng DT sàn 702m2, ngay trường cấp 3. Giá cắt lỗ 50%",Giá thỏa thuận,"234,6 m²","Chơn Thành, Bình Phước",cho-thue-sang-nhuong-cua-hang-ki-ot
Sang nhượng quán cơm - Bùi Đình Túy - Bình Thạnh,12 triệu/tháng,50 m²,"Bình Thạnh, Hồ Chí Minh",cho-thue-sang-nhuong-cua-hang-ki-ot
MB trệt Thảo Điền 6x15m kd tự do giá chỉ 30tr,30 triệu/tháng,90 m²,"Quận 2, Hồ Chí Minh",cho-thue-sang-nhuong-cua-hang-ki-ot
Top mặt bằng kinh doanh giá tốt dưới 20tr Phường An Phú - An Khánh - Quận 2,10 triệu/tháng,80 m²,"Quận 2, Hồ Chí Minh",cho-thue-sang-nhuong-cua-hang-ki-ot
Vila mặt tiền Song Hành cực hiếm hầm 3 lầu 450m2,100 triệu/tháng,150 m²,"Quận 2, Hồ Chí Minh",cho-thue-sang-nhuong-cua-hang-ki-ot
"Cho thuê mặt bằng kinh doanh Xuân Thủy, Thảo Điền, Quận 2 vị trí đẹp",180 triệu/tháng,320 m²,"Quận 2, Hồ Chí Minh",cho-thue-sang-nhuong-cua-hang-ki-ot
Cho thuê mặt bằng kinh doanh hay văn phòng 60m đường lớn gần ngã tư quán đôi,4 triệu/tháng,60 m²,"Củ Chi, Hồ Chí Minh",cho-thue-sang-nhuong-cua-hang-ki-ot
"Cho thuê sàn thương mại tòa nhà mặt phố Thái Hà: Diện tích 355m2, mặt tiền 15m, thông sàn, KD đỉnh",415 triệu/tháng,355 m²,"Đống Đa, Hà Nội",cho-thue-sang-nhuong-cua-hang-ki-ot
"Cho thuê mặt bằng ngay Hồ Nghinh - Võ Văn Kiệt gần biển, 300m2 đất, diện tích sử dụng: 400m2",40 triệu/tháng,300 m²,"Sơn Trà, Đà Nẵng",cho-thue-sang-nhuong-cua-hang-ki-ot
Cho thuê mặt bằng 15x15m mặt tiền Nguyễn Công Trứ quận 1 LH: 0938 202 ***,80 triệu/tháng,120 m²,"Quận 1, Hồ Chí Minh",cho-thue-sang-nhuong-cua-hang-ki-ot
"Cho thuê mặt bằng kinh doanh siêu đẹp diện tích 440m2 mặt tiền Cách Mạng Tháng 8, Q3 LH: 0938 202 ***",260 triệu/tháng,440 m²,"Quận 3, Hồ Chí Minh",cho-thue-sang-nhuong-cua-hang-ki-ot
Tự do sáng tạo tại khu vực đắc địa - cho thuê 300m2 chân đế đẹp nhất Lê Đức Thọ. LH 0906 218 ***,160 triệu/tháng,300 m²,"Cầu Giấy, Hà Nội",cho-thue-sang-nhuong-cua-hang-ki-ot
"Cần cho thuê shop, MBKD, trung tâm phố, bàn giao ngay, hợp đồng dài hạn. LH 0906 218 ***",250 triệu/tháng,350 m²,"Hai Bà Trưng, Hà Nội",cho-thue-sang-nhuong-cua-hang-ki-ot
"Cho thuê mặt bằng đường Lê Hồng Phong, TP Long Khánh, Đồng Nai",5 triệu/tháng,800 m²,"Long Khánh, Đồng Nai",cho-thue-sang-nhuong-cua-hang-ki-ot
"Cho thuê mặt bằng rộng thuận tiện, trung tâm Giảng Võ, 1300m2, LH 0906 218 ***",500 triệu/tháng,1.300 m²,"Ba Đình, Hà Nội",cho-thue-sang-nhuong-cua-hang-ki-ot
Cho thuê mặt bằng KD diện tích lớn mặt phố Trịnh Văn Bô - Nam Từ Liêm - HN. LH 0906 218 ***,200 nghìn/m²,13.260 m²,"Nam Từ Liêm, Hà Nội",cho-thue-sang-nhuong-cua-hang-ki-ot
"Cho thuê 350m2 mặt tiền đường Hoàng Đạo Thúy, LH 0906 218 ***",99 triệu/tháng,350 m²,"Cầu Giấy, Hà Nội",cho-thue-sang-nhuong-cua-hang-ki-ot
"Cho thuê phòng kiot diện tích lớn, kinh doanh được tại xã Diên Phước, Diên Khánh","1,5 triệu/tháng",40 m²,"Diên Khánh, Khánh Hòa",cho-thue-sang-nhuong-cua-hang-ki-ot
"Cho thuê mặt tiền đường Liên Huyện, P. Tân Bình, TP. Dĩ An giá 15 triệu TL",15 triệu/tháng,144 m²,"Dĩ An, Bình Dương",cho-thue-sang-nhuong-cua-hang-ki-ot
Cho thuê mặt bằng kinh doanh spa văn phòng Thảo Điền giá cực tốt,45 triệu/tháng,160 m²,"Quận 2, Hồ Chí Minh",cho-thue-sang-nhuong-cua-hang-ki-ot
Cho thuê MBKD - mặt tiền 24m - nhà 2 tầng Trần Cung/ Phạm Văn Đồng,45 triệu/tháng,100 m²,"Bắc Từ Liêm, Hà Nội",cho-thue-sang-nhuong-cua-hang-ki-ot
Cho thuê mặt bằng kinh doanh góc 2MT Thảo Điền 240m2,35 triệu/tháng,240 m²,"Quận 2, Hồ Chí Minh",cho-thue-sang-nhuong-cua-hang-ki-ot
"Cho thuê mặt sàn T1 mặt phố Hoàng Hoa Thám, KD sầm uất DT 360m2 MT 40m, đầy đủ PCCC, ĐH âm trần",156 triệu/tháng,360 m²,"Ba Đình, Hà Nội",cho-thue-sang-nhuong-cua-hang-ki-ot
"Chính chủ cho thuê MBKD Phú Diễn, Nam Từ Liêm",21 triệu/tháng,150 m²,"Nam Từ Liêm, Hà Nội",cho-thue-sang-nhuong-cua-hang-ki-ot
"Cho thuê mặt bằng đường Nguyễn Văn Linh Phú Mỹ Hưng 90m2 giá 25tr/tháng, mặt tiền đường trước - sau",25 triệu/tháng,90 m²,"Quận 7, Hồ Chí Minh",cho-thue-sang-nhuong-cua-hang-ki-ot
Chính chủ cho thuê sảnh thương mại T1 W1 Vinhomes,18 triệu/tháng,61 m²,"Nam Từ Liêm, Hà Nội",cho-thue-sang-nhuong-cua-hang-ki-ot
Cho thuê kiot riêng biệt 30m+10m gác Tân Bình Dĩ An gần đường Nguyễn Thị Tươi 1tr8/th,"1,8 triệu/tháng",40 m²,"Dĩ An, Bình Dương",cho-thue-sang-nhuong-cua-hang-ki-ot
"Chính chủ cho thuê MT Võ Văn Kiệt, Quận 5, gần 80m2, xe cộ lưu thông rất đông",15 triệu/tháng,60 m²,"Quận 5, Hồ Chí Minh",cho-thue-sang-nhuong-cua-hang-ki-ot
"Cho thuê mặt bằng 1 tầng Đ. Ngô Văn Sở, P. Hòa Khánh Bắc, Q. Liên Chiểu",45 triệu/tháng,357 m²,"Liên Chiểu, Đà Nẵng",cho-thue-sang-nhuong-cua-hang-ki-ot
Cần cho thuê 60m2 tầng trệt khách sạn mặt tiền đường Pasteur Phường Võ Thị Sáu Quận 3 giá 44 triệu,44 triệu/tháng,60 m²,"Quận 3, Hồ Chí Minh",cho-thue-sang-nhuong-cua-hang-ki-ot
Cho thuê Shop kinh doanh 79m2 Giá rẻ mặt sảnh tòa A Masteri dự án Vinhomes Smart City 0904 992 ***,800 nghìn/m²,79 m²,"Nam Từ Liêm, Hà Nội",cho-thue-sang-nhuong-cua-hang-ki-ot
Cho thuê cửa hàng mặt ngõ 40 Tạ Quang Bửu - Bách Khoa,10 triệu/tháng,30 m²,"Hai Bà Trưng, Hà Nội",cho-thue-sang-nhuong-cua-hang-ki-ot
Cho thuê kiôt số 5 B10 Phạm Ngọc Thạch,22 triệu/tháng,27 m²,"Đống Đa, Hà Nội",cho-thue-sang-nhuong-cua-hang-ki-ot
"Cho thuê mặt bằng mặt tiền CMT8, P15, Q10, TPHCM 3.35x16m giá 18trđ/tháng",18 triệu/tháng,54 m²,"Quận 10, Hồ Chí Minh",cho-thue-sang-nhuong-cua-hang-ki-ot
"Cho thuê MBKD Hoàng Ngân: DT 80m2, MT 5m. Mặt phố 2 chiều, gần nhiều chung cư, VP KD đa dạng",20 triệu/tháng,80 m²,"Thanh Xuân, Hà Nội",cho-thue-sang-nhuong-cua-hang-ki-ot
Cho thuê shop chân đế 70m2 vị trí trung tâm S1 giá chỉ 20tr/ tháng,20 triệu/tháng,70 m²,"Gia Lâm, Hà Nội",cho-thue-sang-nhuong-cua-hang-ki-ot
Mặt bằng hẻm lớn 45m2 (Giữa 2 trường học),15 triệu/tháng,45 m²,"Quận 3, Hồ Chí Minh",cho-thue-sang-nhuong-cua-hang-ki-ot
Cho thuê mặt bằng kinh doanh mặt tiền đường Nguyễn Hữu Thọ,12 triệu/tháng,60 m²,"Nhà Bè, Hồ Chí Minh",cho-thue-sang-nhuong-cua-hang-ki-ot
"Cho thuê mặt bằng trung tâm Quận 1 giá mềm. Tiện kinh doanh, hoặc làm văn phòng",12 triệu/tháng,32 m²,"Quận 1, Hồ Chí Minh",cho-thue-sang-nhuong-cua-hang-ki-ot
Cho thuê tầng 1 DT 30m2 ngõ 63 Vũ Ngọc Phan,7 triệu/tháng,30 m²,"Đống Đa, Hà Nội",cho-thue-sang-nhuong-cua-hang-ki-ot
MB cafe đẹp khủng khiếp góc TĐ chỉ 25tr mà thôi,25 triệu/tháng,70 m²,"Quận 2, Hồ Chí Minh",cho-thue-sang-nhuong-cua-hang-ki-ot
