Title,Price,Area,Location,type
"Cho thuê shophouse văn phòng Lake View Thủ Thiêm diện tích 1.022m2 giá cho thuê 242.650đ/m2, 10x19m","242,65 nghìn/m²",190 m²,"Quận 2, Hồ Chí Minh",cho-thue-shophouse-nha-pho-thuong-mai
"Shophouse Pegasuite 2 cho thuê giá 28tr/th, 120m2, căn góc, 2 tầng, mới bàn giao. 0907 701 ***",28 triệu/tháng,120 m²,"Quận 8, Hồ Chí Minh",cho-thue-shophouse-nha-pho-thuong-mai
"Cần cho thuê cặp shophouse Sala giá tốt nhất thị trường 242,65 triệu/tháng","242,65 triệu/tháng",220 m²,"Quận 2, Hồ Chí Minh",cho-thue-shophouse-nha-pho-thuong-mai
"Cho thuê làm shophouse, rộng rãi, phù hợp loại hình kinh doanh buôn bán, nail, cà phê bánh ngọt",50 triệu/tháng,70 m²,"Quận 2, Hồ Chí Minh",cho-thue-shophouse-nha-pho-thuong-mai
"Cho thuê căn góc shophouse khối đế N05 - Golden Time, mặt đường Tân Xuân, Bắc Từ Liêm, Hà Nội",27 triệu/tháng,115 m²,"Bắc Từ Liêm, Hà Nội",cho-thue-shophouse-nha-pho-thuong-mai
Cần cho thuê nhanh shophouse Sarina Sala đảm bảo giá rẻ nhất Sala,80 triệu/tháng,280 m²,"Quận 2, Hồ Chí Minh",cho-thue-shophouse-nha-pho-thuong-mai
Cho thuê shophouse Sala trục chính Nguyễn Cơ Thạch 5 tầng diện tích 700m2 giá tốt trong tuần,140 triệu/tháng,700 m²,"Quận 2, Hồ Chí Minh",cho-thue-shophouse-nha-pho-thuong-mai
Cho thuê gấp nhà nguyên căn shophouse Sala Đại Quang Minh nhà thô giá rẻ nhất Sala,65 triệu/tháng,520 m²,"Quận 2, Hồ Chí Minh",cho-thue-shophouse-nha-pho-thuong-mai
"Cho thuê nhiều shophouse Sala Đại Quang Minh, diện tích: 300m2, 500m2, 1000m2 nhà hoàn thiện",85 triệu/tháng,520 m²,"Quận 2, Hồ Chí Minh",cho-thue-shophouse-nha-pho-thuong-mai
Cho thuê gấp 2 căn đôi shophouse Nguyễn Cơ Thạch khu Sala đẹp nhất khu Thủ Thiêm DT 1500m2,320 triệu/tháng,"350,4 m²","Quận 2, Hồ Chí Minh",cho-thue-shophouse-nha-pho-thuong-mai
"Cần cho thuê lại 2 tầng căn shophouse tại khu đô thị Sala, đã hoàn thiện. Có kèm tầng trệt",68 triệu/tháng,220 m²,"Quận 2, Hồ Chí Minh",cho-thue-shophouse-nha-pho-thuong-mai
"Cho thuê shophouse căn góc Phú Mỹ Hưng, diện tích 422m2 giá 150tr/tháng",150 triệu/tháng,422 m²,"Quận 7, Hồ Chí Minh",cho-thue-shophouse-nha-pho-thuong-mai
Chỉ 5tr/tháng/căn liền kề - biệt thự hoàn thiện 2 tầng - full đồ tại VH OCP 2 The Empire,5 triệu/tháng,70 m²,"Văn Giang, Hưng Yên",cho-thue-shophouse-nha-pho-thuong-mai
"Cho thuê shophouse chung cư 9 View, 160m2, 14tr - Tăng Nhơn Phú - Quận 9. LH: 0903 333 *** Mr Viên",14 triệu/tháng,160 m²,"Quận 9, Hồ Chí Minh",cho-thue-shophouse-nha-pho-thuong-mai
"Cho thuê mặt bằng kinh doanh T1 Thống Nhất Complex số 82 Nguyễn Tuân. Dt 90m2, MT 6m giá 40tr/th",40 triệu/tháng,90 m²,"Thanh Xuân, Hà Nội",cho-thue-shophouse-nha-pho-thuong-mai
Cho thuê nhà mặt tiền 300m2 + 1 trệt + 3 tầng + 4PN + 4 toilet - ban công rộng,36 triệu/tháng,300 m²,"Gò Vấp, Hồ Chí Minh",cho-thue-shophouse-nha-pho-thuong-mai
"Cho thuê tòa nhà văn phòng Lakeview vị trí đắc địa ngay trung tâm Thủ Thiêm ở đường Tố Hữu, Quận 2",65 triệu/tháng,860 m²,"Quận 2, Hồ Chí Minh",cho-thue-shophouse-nha-pho-thuong-mai
"Chuyên cho thuê shophouse Midtown. Giá tốt, hỗ trợ 24/7","42,52 triệu/tháng",91 m²,"Quận 7, Hồ Chí Minh",cho-thue-shophouse-nha-pho-thuong-mai
"Cho thuê shophouse Hải Âu. DT 150m2, 4T, đã hoàn thiện đẹp các tầng. Giá 18 triệu/tháng",18 triệu/tháng,150 m²,"Gia Lâm, Hà Nội",cho-thue-shophouse-nha-pho-thuong-mai
"Cho thuê shophouse chân đế, chia sẻ mặt bằng tại Vinhomes Smart City, cập nhật giá rẻ tháng 1/2024",20 triệu/tháng,30 m²,"Nam Từ Liêm, Hà Nội",cho-thue-shophouse-nha-pho-thuong-mai
Cho thuê mặt bằng khu đô thị louis ciy đại mỗ tầng 1 + 2 nhà 5 tầng có thang máy LH: 0363 912 ***,15 triệu/tháng,80 m²,"Nam Từ Liêm, Hà Nội",cho-thue-shophouse-nha-pho-thuong-mai
"Cho thuê shophouse, đường Thạnh Lộc 08, căn hộ Happy One Premier, trệt, 1 lầu, giá: 16tr/tháng",16 triệu/tháng,42 m²,"Quận 12, Hồ Chí Minh",cho-thue-shophouse-nha-pho-thuong-mai
Tôi chính chủ cho thuê shophouse vip nhất Royal City. View trực diện quảng trường. Giá thương lượng,120 triệu/tháng,155 m²,"Thanh Xuân, Hà Nội",cho-thue-shophouse-nha-pho-thuong-mai
"Cho thuê shophouse, Q7 Boulevard căn góc 215 m2 1 trệt 1 lầu có sẵn 2 phòng ngủ giá thuê 30 tr/th",30 triệu/tháng,215 m²,"Quận 7, Hồ Chí Minh",cho-thue-shophouse-nha-pho-thuong-mai
"Chính chủ cho thuê HA1 OCP1, liên hệ: 0817 505 ***",70 triệu/tháng,280 m²,"Gia Lâm, Hà Nội",cho-thue-shophouse-nha-pho-thuong-mai
Cho thuê shophouse Gateway giá 20 triệu/tháng,20 triệu/tháng,125 m²,"Vũng Tàu, Bà Rịa Vũng Tàu",cho-thue-shophouse-nha-pho-thuong-mai
Tòa nhà văn phòng Lakewiew vị trí đắc địa ngay trung tâm Thủ Thêm Q2,80 triệu/tháng,109 m²,"Quận 2, Hồ Chí Minh",cho-thue-shophouse-nha-pho-thuong-mai
"Cho thuê shophouse căn hộ KDC hiện hữu đông dân tiện kinh doanh siêu thị Winmart, bách hoá xanh",Giá thỏa thuận,100 m²,"Gò Vấp, Hồ Chí Minh",cho-thue-shophouse-nha-pho-thuong-mai
Cho thuê nhà phố Thảo Nguyên Ecopark kinh doanh và ở tốt hợp đồng lâu dài mời LH 0941 195 ***,23 triệu/tháng,100 m²,"Văn Giang, Hưng Yên",cho-thue-shophouse-nha-pho-thuong-mai
"Shops mặt đường 30m đường đại dương giá 8tr/th, đầy đủ 4 điều hoà, 2 nóng lạnh",8 triệu/tháng,75 m²,"Văn Giang, Hưng Yên",cho-thue-shophouse-nha-pho-thuong-mai
Cho thuê mặt bằng shophouse ki ốt kinh doanh Vinhomes Smart City Tây Mỗ T1/2024 Lh em 0896 688 ***,20 triệu/tháng,32 m²,"Nam Từ Liêm, Hà Nội",cho-thue-shophouse-nha-pho-thuong-mai
"Cho thuê shop chân đế căn góc 2 mặt thoáng giá chủ 30tr/ tháng phù hợp cà phê, nhà hàng",30 triệu/tháng,64 m²,"Gia Lâm, Hà Nội",cho-thue-shophouse-nha-pho-thuong-mai
Cho thuê shop 2 tầng 120m2 mặt sảnh. Mặt đường 30m giá 50tr khu vực đông dân cư qua lại,50 triệu/tháng,120 m²,"Gia Lâm, Hà Nội",cho-thue-shophouse-nha-pho-thuong-mai
"Mặt bằng tầng trệt 158m2 chung cư Bình An, Phường 10, TP. Vũng Tàu",12 triệu/tháng,158 m²,"Vũng Tàu, Bà Rịa Vũng Tàu",cho-thue-shophouse-nha-pho-thuong-mai
"Cho thuê shophouse Vinhome Gardenia - Hàm Nghi 93m2 5 tầng, MT 6m thông sàn, thang máy giá 60tr",60 triệu/tháng,93 m²,"Nam Từ Liêm, Hà Nội",cho-thue-shophouse-nha-pho-thuong-mai
Chính chủ cho thuê hơn 1000m2 làm gym độc quyền tại Ecolife Tố Hữu giá siêu rẻ chỉ 169.855/m2/th,"169,85 nghìn/m²",1.200 m²,"Nam Từ Liêm, Hà Nội",cho-thue-shophouse-nha-pho-thuong-mai
Công ty tôi có 322m2 mặt tiền 10m lô góc tại tòa nhà Việt Tower lô góc Thái Hà Chùa Bộc cực đẹp,Giá thỏa thuận,322 m²,"Đống Đa, Hà Nội",cho-thue-shophouse-nha-pho-thuong-mai
"Cho thuê ngay 620m2 mặt tiền 12m kinh doanh mọi mô hình tại mặt phố Nguyễn Cơ Thạch, Mỹ Đình",Giá thỏa thuận,620 m²,"Nam Từ Liêm, Hà Nội",cho-thue-shophouse-nha-pho-thuong-mai
Mặt bằng kinh doanh siêu hot - tầng 1 lô góc diện tích 332m2 MT 10m tòa nhà Viet Tower số 1 Thái Hà,Giá thỏa thuận,332 m²,"Đống Đa, Hà Nội",cho-thue-shophouse-nha-pho-thuong-mai
Tổng hợp căn diện tích lớn tại Sala 500m2 - 1.500m2 - giá từ 100tr - 245tr/tháng - hoàn thiện,245 triệu/tháng,"245,1 m²","Quận 2, Hồ Chí Minh",cho-thue-shophouse-nha-pho-thuong-mai
Cho thuê sàn thương mại tầng 1 và tầng 2 toà chung cư The Golden Armor B6 Giảng Võ Quận Ba Đình,Giá thỏa thuận,660 m²,"Ba Đình, Hà Nội",cho-thue-shophouse-nha-pho-thuong-mai
Cho thuê shophouse dự án C14 (The Diamond Point) cạnh trường học Vinschool Long Biên,Giá thỏa thuận,200 m²,"Long Biên, Hà Nội",cho-thue-shophouse-nha-pho-thuong-mai
Chính chủ cho thuê 1000m2 văn phòng hoàn thiện Sari Town Sala Đại Quang Minh giá 245.000đ/m2,245 triệu/tháng,1.000 m²,"Quận 2, Hồ Chí Minh",cho-thue-shophouse-nha-pho-thuong-mai
Cho thuê mặt bằng Saigon Pearl 95m2 giá 64 triệu LH 0932 069 *** Huy,64 triệu/tháng,95 m²,"Bình Thạnh, Hồ Chí Minh",cho-thue-shophouse-nha-pho-thuong-mai
"Cần cho thuê shophouse Masteri Thảo Điền, Quận 2, giá 50 tr/th nhà hoàn thiện LH: 0932 069 ***",50 triệu/tháng,140 m²,"Quận 2, Hồ Chí Minh",cho-thue-shophouse-nha-pho-thuong-mai
"Chính chủ cần cho thuê shop MT số 20 Nguyễn Cơ Thạch, P.An Lợi Đông, Quận 2* 7x24m, 1 hầm, 1T + lầu",155 triệu/tháng,168 m²,"Quận 2, Hồ Chí Minh",cho-thue-shophouse-nha-pho-thuong-mai
"Cho thuê nhà phố shophouse PRV, MRA, THU, THA, Oasis, phố trúc Ecopark",Giá thỏa thuận,320 m²,"Văn Giang, Hưng Yên",cho-thue-shophouse-nha-pho-thuong-mai
"Cho thuê mặt bằng kinh doanh hoàn thiện 51m2, chỉ 25tr",25 triệu/tháng,51 m²,"Quận 9, Hồ Chí Minh",cho-thue-shophouse-nha-pho-thuong-mai
Cho thuê shop TMDV sầm uất nhất tại Vinhomes Quận 9 vị trí đắc địa,40 triệu/tháng,90 m²,"Quận 9, Hồ Chí Minh",cho-thue-shophouse-nha-pho-thuong-mai
"Căn góc 2 mặt tiền 3 tầng chỉ 37 triệu tại Vinhomes Quận 9, kinh doanh tốt",37 triệu/tháng,230 m²,"Quận 9, Hồ Chí Minh",cho-thue-shophouse-nha-pho-thuong-mai
"Cho thuê Shophouse, Boutique tại Vinhomes Quận 9 mặt tiền siêu đẹp chỉ 40 triệu",40 triệu/tháng,230 m²,"Quận 9, Hồ Chí Minh",cho-thue-shophouse-nha-pho-thuong-mai
Cho thuê tầng nhà phố hoàn thiện có thang máy chỉ 7 triệu/tháng,7 triệu/tháng,84 m²,"Quận 9, Hồ Chí Minh",cho-thue-shophouse-nha-pho-thuong-mai
Cho thuê shophouse thuận tiện KD mọi nghành nghề giá 14tr/tháng. LH 0938 256 ***,14 triệu/tháng,100 m²,"Quận 9, Hồ Chí Minh",cho-thue-shophouse-nha-pho-thuong-mai
Cho thuê shophouse sổ hồng lâu dài 1 trệt 1 lầu 115m2 Park 4 giá 15 tr/tháng vừa kinh doanh vừa ở,15 triệu/tháng,115 m²,"Quận 12, Hồ Chí Minh",cho-thue-shophouse-nha-pho-thuong-mai
Từ 2 triệu/thuê shophouse miễn phí 24 tháng/hoàn thiện tầng 1/tặng voucher 30 triệu/ Grand World HN,2 triệu/tháng,60 m²,"Văn Giang, Hưng Yên",cho-thue-shophouse-nha-pho-thuong-mai
Cho thuê 100-200-500m- 1000m2Shophouse thương mại tầng 1-2-3-4 Chung cư Green Diamond 93 Láng Hạ.,Giá thỏa thuận,200 m²,"Đống Đa, Hà Nội",cho-thue-shophouse-nha-pho-thuong-mai
"Cho thuê nhà nguyên căn mặt tiền Nguyễn Cơ Thạch giá 125 triệu/ căn 1 hầm 1 trệt 3,5 lầu",125 triệu/tháng,168 m²,"Quận 2, Hồ Chí Minh",cho-thue-shophouse-nha-pho-thuong-mai
Hàng hiếm shophouse Sari town Sala hoàn thiện giá tốt gọi ngay 0917 345 ***,85 triệu/tháng,500 m²,"Quận 2, Hồ Chí Minh",cho-thue-shophouse-nha-pho-thuong-mai
"Cho thuê 50m2 - 100m - 200m - 500m2. Sàn thương mại tầng 1 - 2. Chung cư Hoàng Thành Peal, Mỹ Đình",500 nghìn/m²,50 m²,"Nam Từ Liêm, Hà Nội",cho-thue-shophouse-nha-pho-thuong-mai
Cho thuê shophouse khối đế tầng 1 - 2. Chung cư Moonlight An Lạc Green Symphony. DT 50-100-200m2,350 nghìn/m²,100 m²,"Hoài Đức, Hà Nội",cho-thue-shophouse-nha-pho-thuong-mai
Cập nhập mb cho thuê tại TTTM The Garden Mễ Trì T9 - 2023 DT 100-200m-300m-500m2 giá từ 267.132đ,267 nghìn/m²,150 m²,"Nam Từ Liêm, Hà Nội",cho-thue-shophouse-nha-pho-thuong-mai
Cho thuê shophouse tầng G-1-2-3. Tòa The Manor Mễ Trì. Diện tích 60-80m-100m-500m2. Giá cực rẻ,350 nghìn/m²,100 m²,"Nam Từ Liêm, Hà Nội",cho-thue-shophouse-nha-pho-thuong-mai
Cho thuê sàn thương mại tầng 1-2-3. Diện tích 100m-200-500-1000m. Chung cư 282 Nguyễn Huy Tưởng,"222,6 nghìn/m²",200 m²,"Thanh Xuân, Hà Nội",cho-thue-shophouse-nha-pho-thuong-mai
