Title,Price,Area,Location,type
Chính chủ cần cho thuê kiot tại khu đô thị Thanh Hà Cienco 5,5 triệu/tháng,40 m²,"Hà Đông, Hà Nội",cho-thue-sang-nhuong-cua-hang-ki-ot
Cho thuê ngay gần 400m2 shop mặt phố Thái Hà 2 tầng mặt tiền hơn 10m,800 nghìn/m²,380 m²,"Đống Đa, Hà Nội",cho-thue-sang-nhuong-cua-hang-ki-ot
"Cho thuê ngay 1.200 đến 10.000m2 ở Mễ Trì làm garage showroom ôtô, xưởng độ xe",Giá thỏa thuận,6.000 m²,"Nam Từ Liêm, Hà Nội",cho-thue-sang-nhuong-cua-hang-ki-ot
Chính chủ cho thuê MBKD 120m2 mặt phố Hoàng Ngân - Nguyễn Thị Định - MT rộng 12m,Giá thỏa thuận,120 m²,"Cầu Giấy, Hà Nội",cho-thue-sang-nhuong-cua-hang-ki-ot
Cho thuê rẻ 400m2 và 600m2 mặt đường Tố Hữu mặt tiền 30m,465 nghìn/m²,600 m²,"Thanh Xuân, Hà Nội",cho-thue-sang-nhuong-cua-hang-ki-ot
"Cho thuê mặt bằng kinh doanh 230 m2, 2 tầng tại đường Máng Nước - An Đồng",40 triệu/tháng,230 m²,"An Dương, Hải Phòng",cho-thue-sang-nhuong-cua-hang-ki-ot
"Mặt bằng kinh doanh Thảo Điền cực hiếm, cực đẹp, 50m2, giá 10 triệu/tháng",10 triệu/tháng,50 m²,"Quận 2, Hồ Chí Minh",cho-thue-sang-nhuong-cua-hang-ki-ot
Chuyên cho thuê mặt bằng Vinhomes Central Park giá từ 30 triệu/tháng. LH: 0904 320 ***Mr. Nguyên),30 triệu/tháng,62 m²,"Bình Thạnh, Hồ Chí Minh",cho-thue-sang-nhuong-cua-hang-ki-ot
Cho thuê mặt bằng mặt tiền đường Ngô Gia Tự - Gọi Đàm Tiến,6 triệu/tháng,"23,1 m²","Hải Châu, Đà Nẵng",cho-thue-sang-nhuong-cua-hang-ki-ot
"Cho thuê mặt bằng kinh doanh đẹp phố Cầu Bươu, Kiến Hưng, Hà Đông 3 triệu",5 triệu/tháng,30 m²,"Hà Đông, Hà Nội",cho-thue-sang-nhuong-cua-hang-ki-ot
MBKD Nguyễn Văn Công - 60m2 - mới 100% - giá chỉ 12 tr/tháng,12 triệu/tháng,60 m²,"Gò Vấp, Hồ Chí Minh",cho-thue-sang-nhuong-cua-hang-ki-ot
Sang nhượng tiệm tóc Barber Nam nhà nguyên căn,20 triệu/tháng,80 m²,"Gò Vấp, Hồ Chí Minh",cho-thue-sang-nhuong-cua-hang-ki-ot
"Cho thuê MBKD tầng 1, 22m2, 44m2, 55m2, 70m2, 90m2, 150m2, dự án Imperia Sky Garden, 0913 484 ***",17 triệu/tháng,22 m²,"Hai Bà Trưng, Hà Nội",cho-thue-sang-nhuong-cua-hang-ki-ot
"Cho thuê cửa hàng độc lập - khép kín 102 ngõ 140/2 Giảng Võ ngõ oto tránh vỉa hè 3m 55m2. 9,9tr/th","9,9 triệu/tháng",55 m²,"Ba Đình, Hà Nội",cho-thue-sang-nhuong-cua-hang-ki-ot
"Góc 2MT Đồng Nai ngang 10m, 2 lầu (Cư Xá Bắc Hải) Q10",60 triệu/tháng,200 m²,"Quận 10, Hồ Chí Minh",cho-thue-sang-nhuong-cua-hang-ki-ot
"Cho thuê 1600m2 mặt bằng làm nhà hàng tại mặt đường Minh Khai, mặt tiền 120m, LH 0976 717 ***","219,19 nghìn/m²",1.600 m²,"Hai Bà Trưng, Hà Nội",cho-thue-sang-nhuong-cua-hang-ki-ot
Sang nhượng quán CF tranh view Hồ Tây có hoàng hôn,50 triệu/tháng,130 m²,"Tây Hồ, Hà Nội",cho-thue-sang-nhuong-cua-hang-ki-ot
"Cho thuê nhà mặt bằng 116 Nguyễn Thái Bình, P. NTB Quận 1 giá 25 triệu",25 triệu/tháng,40 m²,"Quận 1, Hồ Chí Minh",cho-thue-sang-nhuong-cua-hang-ki-ot
Sang nhượng nhà hàng Buffet Lẩu nướng mặt đường Hồ Sen,30 triệu/tháng,160 m²,"Lê Chân, Hải Phòng",cho-thue-sang-nhuong-cua-hang-ki-ot
Chính chủ cho thuê kiot 2 - tòa chung cư VP6 Linh Đàm - 40m2 x gác xép - kinh doanh đa dạng - 10tr,10 triệu/tháng,40 m²,"Hoàng Mai, Hà Nội",cho-thue-sang-nhuong-cua-hang-ki-ot
Cần cho thuê mặt bằng Phú Mỹ Hưng Q7 mặt tiền đường lớn,20 triệu/tháng,96 m²,"Quận 7, Hồ Chí Minh",cho-thue-sang-nhuong-cua-hang-ki-ot
(352) Cho thuê tầng 1 căn nhà Vinhomes Marina,13 triệu/tháng,85 m²,"Lê Chân, Hải Phòng",cho-thue-sang-nhuong-cua-hang-ki-ot
(465) Cho mặt bằng kinh doanh 2 mặt đường Thiên Lôi và Quán Nam,35 triệu/tháng,350 m²,"Lê Chân, Hải Phòng",cho-thue-sang-nhuong-cua-hang-ki-ot
Chính chủ cho thuê MB 1.400m2 Bình Thạnh,130 triệu/tháng,1.400 m²,"Bình Thạnh, Hồ Chí Minh",cho-thue-sang-nhuong-cua-hang-ki-ot
(459) Cho thuê mặt bằng kinh doanh mặt đường Hồ Sen,30 triệu/tháng,100 m²,"Lê Chân, Hải Phòng",cho-thue-sang-nhuong-cua-hang-ki-ot
"Sang nhượng tòa nhà KD KS + CHDV 16 phòng + 2MB bar Phạm Ngũ Lão, Q1, giá 1.2tỷ doanh thu 300 tr/th",110 triệu/tháng,100 m²,"Quận 1, Hồ Chí Minh",cho-thue-sang-nhuong-cua-hang-ki-ot
"Góc mặt bằng kinh doanh cà phê, nhà hàng",50 triệu/tháng,200 m²,"Quận 7, Hồ Chí Minh",cho-thue-sang-nhuong-cua-hang-ki-ot
Cho thuê shop chân đế 80m2 căn góc 2 mặt tiền diện tích lớn 80m2 giá chỉ 35 tr vị trí trung tâm S1,35 triệu/tháng,80 m²,"Gia Lâm, Hà Nội",cho-thue-sang-nhuong-cua-hang-ki-ot
Giảm giá 30% thuê MBKD cửa hàng 38m2 mặt tiền 6m cực đẹp tại Hoàng Ngân phù hợp mọi loại hình KD,"23,9 triệu/tháng",38 m²,"Cầu Giấy, Hà Nội",cho-thue-sang-nhuong-cua-hang-ki-ot
Giảm giá 30% thuê MBKD cửa hàng 39m2 mặt tiền 6m cực đẹp tại Hoàng Ngân phù hợp mọi loại hình KD,"19,9 triệu/tháng",39 m²,"Cầu Giấy, Hà Nội",cho-thue-sang-nhuong-cua-hang-ki-ot
"Chính chủ cho thuê mặt bằng 60m2 Phường Cầu Ông Lãnh, Quận 1, thích hợp mở cửa hàng, hiệu thuốc",20 triệu/tháng,60 m²,"Quận 1, Hồ Chí Minh",cho-thue-sang-nhuong-cua-hang-ki-ot
"Cho thuê mặt bằng trống 3 tầng từ 300m2 - 700m2 làm spa, khách sạn. Tại KĐT Golden Bay Hưng Thịnh",20 triệu/tháng,300 m²,"Cam Lâm, Khánh Hòa",cho-thue-sang-nhuong-cua-hang-ki-ot
"Cho thuê mặt bằng mở văn phòng/kinh doanh, 29 Hòa Hưng, Phường 12, Quận 10, HCM",10 triệu/tháng,32 m²,"Quận 10, Hồ Chí Minh",cho-thue-sang-nhuong-cua-hang-ki-ot
"Cho thuê cửa hàng spa, thẩm mỹ phố Thái Phiên 130m2 x 3 tầng, MT 8m, 100 triệu / tháng",100 triệu/tháng,130 m²,"Hai Bà Trưng, Hà Nội",cho-thue-sang-nhuong-cua-hang-ki-ot
"Cần cho thuê cửa hàng Phố Huế - Diện tích: 70m2, mt 5m, 55 triệu / tháng",55 triệu/tháng,70 m²,"Hai Bà Trưng, Hà Nội",cho-thue-sang-nhuong-cua-hang-ki-ot
"Cho thuê sàn thương mại 250 m2 / sàn (tổng 6 sàn - có cho thuê lẻ từng sàn) phố Xuân Diệu, Tây Hồ",Giá thỏa thuận,250 m²,"Tây Hồ, Hà Nội",cho-thue-sang-nhuong-cua-hang-ki-ot
"Cho thuê mặt bằng G5A chung cư Hà Đô - Nguyễn Văn Công, P3, Q. Gò Vấp (chợ Tân Sơn nhất)",27 triệu/tháng,30 m²,"Gò Vấp, Hồ Chí Minh",cho-thue-sang-nhuong-cua-hang-ki-ot
"Cho thuê MBKD cửa hàng 55m2-80m2 mặt tiền 8,5m mặt phố ngã 4 Nguyễn Khánh Toàn, nhà mới, SD ngay","16,9 triệu/tháng",55 m²,"Cầu Giấy, Hà Nội",cho-thue-sang-nhuong-cua-hang-ki-ot
Cho thuê mặt bằng làm nail/massage kết hợp căn hộ ở tại 95 phố Yên Phụ,15 triệu/tháng,50 m²,"Tây Hồ, Hà Nội",cho-thue-sang-nhuong-cua-hang-ki-ot
Cho thuê MBKD 120m2 tại phố Bạch Mai - HBT,40 triệu/tháng,180 m²,"Hai Bà Trưng, Hà Nội",cho-thue-sang-nhuong-cua-hang-ki-ot
Cho thuê MB kinh doanh MT Âu Cơ Tân Phú DTSD 950m2 ngang lớn giá chỉ 99tr/th LH 0931 580 ***,99 triệu/tháng,336 m²,"Tân Phú, Hồ Chí Minh",cho-thue-sang-nhuong-cua-hang-ki-ot
"Cho thuê MBKD gần góc ngã 3 đường D Bình Thạnh ngang 10m DTSD 650m2 giá 95tr/th, lh 0931 580 ***",95 triệu/tháng,650 m²,"Bình Thạnh, Hồ Chí Minh",cho-thue-sang-nhuong-cua-hang-ki-ot
Cho thuê mặt bằng tầng trệt Nguyễn Thị Thập,250 triệu/tháng,444 m²,"Quận 7, Hồ Chí Minh",cho-thue-sang-nhuong-cua-hang-ki-ot
"Cho thuê MBKD siêu khủng gần góc ngã tư D2 sầm uất DT 14*40m MB suốt giá 190tr, LH 0931 580 ***",190 triệu/tháng,550 m²,"Bình Thạnh, Hồ Chí Minh",cho-thue-sang-nhuong-cua-hang-ki-ot
"Kiếm người hợp tác bán đồ ăn sáng, ăn trưa 3tr/tháng",3 triệu/tháng,80 m²,"Thủ Đức, Hồ Chí Minh",cho-thue-sang-nhuong-cua-hang-ki-ot
"Cho thuê căn shop góc phố đi bộ trên Sky Garden 3 Phú Mỹ Hưng Q7 giá 34,062 triệu/tháng","34,06 triệu/tháng",105 m²,"Quận 7, Hồ Chí Minh",cho-thue-sang-nhuong-cua-hang-ki-ot
Chính chủ cho thuê cửa hàng kinh doanh mặt đường Trương Định,16 triệu/tháng,40 m²,"Hoàng Mai, Hà Nội",cho-thue-sang-nhuong-cua-hang-ki-ot
"Cho thuê mặt bằng Thống Nhất mới (ngang 12m dài 20m), Phường 8, Vũng Tàu. LH 0911 767 ***",25 triệu/tháng,240 m²,"Vũng Tàu, Bà Rịa Vũng Tàu",cho-thue-sang-nhuong-cua-hang-ki-ot
"Cho thuê MBKD MT Đồng Nai, p15, Quận 10 DT 10*32m vỉa hè 10m KD tự do chỉ 55tr/th LH 0931 580 ***",55 triệu/tháng,320 m²,"Quận 10, Hồ Chí Minh",cho-thue-sang-nhuong-cua-hang-ki-ot
"Cho thuê ki ốt, shophouse, biệt thự Ngoại Giao Đoàn diện tích 60m2 đến 3000m2: 0986 666 ***",Giá thỏa thuận,60 m²,"Bắc Từ Liêm, Hà Nội",cho-thue-sang-nhuong-cua-hang-ki-ot
"Cho thuê MB 25 Hưng Hoá gần CV Lê Thị Riêng, P6, Tân Bình, DT 30m2, giá 3 triệu",3 triệu/tháng,30 m²,"Tân Bình, Hồ Chí Minh",cho-thue-sang-nhuong-cua-hang-ki-ot
"Hot hot! Cho thuê mặt bằng tầng trệt ngay KDC Nam Long, trung tâm Quận 7",18 triệu/tháng,48 m²,"Quận 7, Hồ Chí Minh",cho-thue-sang-nhuong-cua-hang-ki-ot
"Cho thuê cửa hàng 220 Khâm Thiên 60 m2, giá ưu đãi sập sàn 17 triệu lh 0389 930 ***",17 triệu/tháng,60 m²,"Đống Đa, Hà Nội",cho-thue-sang-nhuong-cua-hang-ki-ot
"Chính chủ cho thuê mặt bằng Cafe - Phòng trà 155m2 tại mặt phố số 131 Hoàng Cầu, View hồ Hoàng Cầu",28 triệu/tháng,155 m²,"Đống Đa, Hà Nội",cho-thue-sang-nhuong-cua-hang-ki-ot
Cho thuê kiot garden mặt tiền Tạ Quang Bửu giá thuê: 12 triệu/tháng. Diện tích: 100m2,12 triệu/tháng,100 m²,"Bình Chánh, Hồ Chí Minh",cho-thue-sang-nhuong-cua-hang-ki-ot
Cho thuê mặt bằng kinh doanh 700m2 đối diện Siêu Thị Coopmart Biên Hòa,50 triệu/tháng,700 m²,"Biên Hòa, Đồng Nai",cho-thue-sang-nhuong-cua-hang-ki-ot
"Cho thuê tầng 01 liền kề Mon City Mỹ Đình làm kinh doanh, văn phòng, cửa hàng, 17 - 20 triệu/tháng",17 triệu/tháng,100 m²,"Nam Từ Liêm, Hà Nội",cho-thue-sang-nhuong-cua-hang-ki-ot
Cho thuê mặt bằng kinh doanh 300m2 gần PMH - Quận 7,50 triệu/tháng,300 m²,"Quận 7, Hồ Chí Minh",cho-thue-sang-nhuong-cua-hang-ki-ot
Cho thuê ki - ốt thương xá đối diện chợ Hàn tại Đà Nẵng giá siêu hời,Giá thỏa thuận,"3,25 m²","Hải Châu, Đà Nẵng",cho-thue-sang-nhuong-cua-hang-ki-ot
"Chính chủ cho thuê MBKD tại phố Hoàng Ngân, mặt tiền rộng phù hợp làm: Cafe, salon, VP đại diện",Giá thỏa thuận,120 m²,"Cầu Giấy, Hà Nội",cho-thue-sang-nhuong-cua-hang-ki-ot
"New! Cho thuê mặt bằng kinh doanh mặt tiền 75m, tổng diện tích 1500m2 đường Hoàng Quốc Việt",Giá thỏa thuận,1.500 m²,"Cầu Giấy, Hà Nội",cho-thue-sang-nhuong-cua-hang-ki-ot
Chính chủ cần cho thuê mặt bằng kinh doanh 100 m2 làm văn phòng tầng 1 tiện nghi khang trang giá rẻ,Giá thỏa thuận,100 m²,"Bình Tân, Hồ Chí Minh",cho-thue-sang-nhuong-cua-hang-ki-ot
Mặt bằng riêng biệt - có sân để xe - đường Đề Thám - Quận 1,14 triệu/tháng,32 m²,"Quận 1, Hồ Chí Minh",cho-thue-sang-nhuong-cua-hang-ki-ot
"Cho thuê mặt bằng KD cửa hàng 30m2 - 50m2 - 100m2 đa dạng diện tích tại Hoàng Quốc Việt, Cầu Giấy",14 triệu/tháng,45 m²,"Cầu Giấy, Hà Nội",cho-thue-sang-nhuong-cua-hang-ki-ot
Cho thuê mặt bằng kinh doanh 700m2 đường Phạm Văn Thuận đối diện coopmart Biên Hòa,50 triệu/tháng,700 m²,"Biên Hòa, Đồng Nai",cho-thue-sang-nhuong-cua-hang-ki-ot
Chính chủ cho thuê tầng 1 DT 40m2 tại Ngõ 26 Nguyên Hồng vị trí cực đẹp giá rẻ nhất quận Đống Đa,11 triệu/tháng,40 m²,"Đống Đa, Hà Nội",cho-thue-sang-nhuong-cua-hang-ki-ot
"Hàng hiếm. Mặt bằng kinh doanh đường Xuân Thủy cực đẹp 110m2, giá 70tr",70 triệu/tháng,110 m²,"Quận 2, Hồ Chí Minh",cho-thue-sang-nhuong-cua-hang-ki-ot
Cho thuê kios mặt tiền số 3 đường 27,"5,5 triệu/tháng",18 m²,"Thủ Đức, Hồ Chí Minh",cho-thue-sang-nhuong-cua-hang-ki-ot
"Tôi cần cho thuê sàn MP 86 Nguyễn Xiển S600m2 thông sàn KD bi a, game, cafe, vp giá 25tr 0934 406 ***",25 triệu/tháng,600 m²,"Thanh Xuân, Hà Nội",cho-thue-sang-nhuong-cua-hang-ki-ot
Cho thuê mặt bằng - CHDV - phòng trọ ở CityLand Park Hills,5 triệu/tháng,35 m²,"Gò Vấp, Hồ Chí Minh",cho-thue-sang-nhuong-cua-hang-ki-ot
"Sang cửa hàng hải sản, đang hoạt động, khu dân cư đông đúc",18 triệu/tháng,180 m²,"Thủ Đức, Hồ Chí Minh",cho-thue-sang-nhuong-cua-hang-ki-ot
"Cho thuê tầng 1 có S= 65m2: Mới 100%, vệ sinh + nóng lạnh - làm văn phòng, showroom, cửa hàng",12 triệu/tháng,65 m²,"Hoàng Mai, Hà Nội",cho-thue-sang-nhuong-cua-hang-ki-ot
"Cho thuê phòng làm dịch vụ, cửa hàng. Hẻm rộng, cách đường Nguyễn Văn Thủ 20m",Giá thỏa thuận,25 m²,"Quận 1, Hồ Chí Minh",cho-thue-sang-nhuong-cua-hang-ki-ot
"Chính chủ cho thuê mặt bằng kinh doanh ngõ ô tô tránh, đông người giá 5.5 triệu/tháng","5,5 triệu/tháng",50 m²,"Nam Từ Liêm, Hà Nội",cho-thue-sang-nhuong-cua-hang-ki-ot
"Cho thuê mặt bằng kinh doanh Ngoại Giao Đoàn 1000m2 MT 25m, từ 291.960đ/m2/tháng",295 triệu/tháng,1.000 m²,"Bắc Từ Liêm, Hà Nội",cho-thue-sang-nhuong-cua-hang-ki-ot
Cho thuê biệt thự mở trường mầm non - thành phố mới Ocean Park,Giá thỏa thuận,45 m²,"Gia Lâm, Hà Nội",cho-thue-sang-nhuong-cua-hang-ki-ot
"Shop chân đế toàn chung cư đông dân, 45m2, hoàn thiện, cho thuê chỉ có 12tr/th",12 triệu/tháng,124 m²,"Gia Lâm, Hà Nội",cho-thue-sang-nhuong-cua-hang-ki-ot
Cho thuê mặt bằng shophouse kinh doanh văn phòng 124m2 giá 10 triệu,10 triệu/tháng,15.000 m²,"Quận 12, Hồ Chí Minh",cho-thue-sang-nhuong-cua-hang-ki-ot
Mặt bằng cực hiếm 5.000m2 x 3 tầng khu Mỹ Đình 2 - Nam Từ Liêm cho thuê dài hạn,Giá thỏa thuận,90 m²,"Nam Từ Liêm, Hà Nội",cho-thue-sang-nhuong-cua-hang-ki-ot
Cho thuê mặt bằng kinh doanh Phố Quan Hoa,26 triệu/tháng,,"Cầu Giấy, Hà Nội",cho-thue-sang-nhuong-cua-hang-ki-ot
Cho thuê tầng 1 kiot Hoàn Sơn Tiên Du giá 5 triệu/tháng - Diện tích 70m2 - Ngay Chân Cầu Đồng Xép,5 triệu/tháng,50 m²,"Tiên Du, Bắc Ninh",cho-thue-sang-nhuong-cua-hang-ki-ot
Chính chủ nhượng hoặc cho thuê cửa hàng Hoàng Quốc Việt DT 60m2 MT 5m vỉa hè rộng giá 15 tr/th,15 triệu/tháng,60 m²,"Cầu Giấy, Hà Nội",cho-thue-sang-nhuong-cua-hang-ki-ot
"Cho thuê MBKD cửa hàng 30m2 50m2 90m2 mặt tiền 8,5m tại mặt phố Hoàng Quốc Việt, SD ngay, chính chủ","18,9 triệu/tháng",55 m²,"Cầu Giấy, Hà Nội",cho-thue-sang-nhuong-cua-hang-ki-ot
"Tặng quà 2 triệu - Cho thuê mặt bằng KD cửa hàng tầng 1, 50m2 tại Trung Kính, vị trí đẹp, chính chủ","25,9 triệu/tháng",50 m²,"Cầu Giấy, Hà Nội",cho-thue-sang-nhuong-cua-hang-ki-ot
"Cho thuê mặt bằng KD - 35m2 45m2 95m2 mặt tiền 8m gần ngã 4 Hoàng Quốc Việt, tòa nhà mới","16,9 triệu/tháng",45 m²,"Cầu Giấy, Hà Nội",cho-thue-sang-nhuong-cua-hang-ki-ot
"Cho thuê mặt bằng kinh doanh Trần Quý Kiên DT 15x20m, trệt 2 lầu. Giá 80tr/th. Quân 0901 380 ***",80 triệu/tháng,300 m²,"Quận 2, Hồ Chí Minh",cho-thue-sang-nhuong-cua-hang-ki-ot
"Cho thuê mặt bằng gốc ngã tư Nguyễn Văn Linh - Nguyễn Hữu Thọ, Q7. DT 600m2 - 200 triệu/tháng",200 triệu/tháng,600 m²,"Quận 7, Hồ Chí Minh",cho-thue-sang-nhuong-cua-hang-ki-ot
"Thuê nhà mặt phố 50m mặt tiền, rộng 2000m2, 2 tầng chỉ 70tr/tháng tại thành phố Từ Sơn, Bắc Ninh",70 triệu/tháng,2.000 m²,"Từ Sơn, Bắc Ninh",cho-thue-sang-nhuong-cua-hang-ki-ot
"Cho thuê mặt bằng KDC Him Lam Q7, (Ngang 5m dài 20m) giá: 17 triệu/tháng, hầm để xe, cửa kính",26 triệu/tháng,100 m²,"Quận 7, Hồ Chí Minh",cho-thue-sang-nhuong-cua-hang-ki-ot
"Mặt bằng đẹp cho thuê đường Tân Sơn Nhì, Q. Tân Phú (ở lại được, KD tự do hoặc mở Văn Phòng)",5 triệu/tháng,30 m²,"Tân Phú, Hồ Chí Minh",cho-thue-sang-nhuong-cua-hang-ki-ot
Cho thuê cửa hàng 185m2 mặt phố Nguyễn Văn Tuyết,60 triệu/tháng,185 m²,"Đống Đa, Hà Nội",cho-thue-sang-nhuong-cua-hang-ki-ot
"Cần sang quán Cafe gần chung cư Belleza, Phú Mỹ, Q7",9 triệu/tháng,40 m²,"Quận 7, Hồ Chí Minh",cho-thue-sang-nhuong-cua-hang-ki-ot
Sang nhượng tiệm spa tâm huyết trang bị đầy đủ đồ nghề trệt 4 lầu 7PN 6WC giá 350 triệu,35 triệu/tháng,84 m²,"Tân Phú, Hồ Chí Minh",cho-thue-sang-nhuong-cua-hang-ki-ot
"Chính chủ cần sang nhượng lại quán cafe đang hoạt động tại CC Ehome S Phú Hữu. Quán đẹp, vị trí đẹp","8,2 triệu/tháng",60 m²,"Quận 9, Hồ Chí Minh",cho-thue-sang-nhuong-cua-hang-ki-ot
Sang mặt bằng trà sữa 45m2 gần ĐH công thương và thanh lý đồ dùng,13 triệu/tháng,45 m²,"Tân Phú, Hồ Chí Minh",cho-thue-sang-nhuong-cua-hang-ki-ot
"Cho thuê mặt tiền Q1 Võ Thị Sáu, 15tr đẹp như hình, spa nail làm đẹp",15 triệu/tháng,45 m²,"Quận 3, Hồ Chí Minh",cho-thue-sang-nhuong-cua-hang-ki-ot
"Cho thuê mặt bằng 40m2, Nguyễn Đăng Giai, Thảo Điền, Q2",18 triệu/tháng,40 m²,"Quận 2, Hồ Chí Minh",cho-thue-sang-nhuong-cua-hang-ki-ot
Cho thuê cửa hàng kinh doanh tầng 1 DT 56m2. Vừa ở vừa kinh doanh cực đỉnh. Chỉ 8 tr,8 triệu/tháng,56 m²,"Ba Đình, Hà Nội",cho-thue-sang-nhuong-cua-hang-ki-ot
"Cho thuê mặt bằng Võ Thị Sáu (đường 5 nối dài) 7,6 x 15m trống suốt 15tr",15 triệu/tháng,102 m²,"Biên Hòa, Đồng Nai",cho-thue-sang-nhuong-cua-hang-ki-ot
"Cho thuê cửa hàng kinh doanh ngay khu Midtown, Phú Mỹ Hưng, Quận 7 giá rẻ chỉ 40 triệu/tháng",40 triệu/tháng,80 m²,"Quận 7, Hồ Chí Minh",cho-thue-sang-nhuong-cua-hang-ki-ot
"Cho thuê cửa hàng mặt phố Ngô Quyền 70m2, MT4m, thông sàn, riêng biệt",28 triệu/tháng,70 m²,"Hoàn Kiếm, Hà Nội",cho-thue-sang-nhuong-cua-hang-ki-ot
Flex mặt bằng mới coong xinh ngất tại Thảo Điền 80m2,25 triệu/tháng,81 m²,"Quận 2, Hồ Chí Minh",cho-thue-sang-nhuong-cua-hang-ki-ot
"Cho thuê showroom 3s, tiệc cưới,... Vị trí đắc địa, bàn giao ngay. LH 0906 218 ***",2 tỷ/tháng,6.000 m²,"Cầu Giấy, Hà Nội",cho-thue-sang-nhuong-cua-hang-ki-ot
"Cho thuê mặt bằng kinh doanh tầng 1, DT 35m2, MT 5m tại Hoàng Quốc Việt, vị trí đẹp, giá tốt","23,9 triệu/tháng",35 m²,"Cầu Giấy, Hà Nội",cho-thue-sang-nhuong-cua-hang-ki-ot
"Cho thuê mặt bằng kinh doanh làm showroom, cafe rất đẹp Khu sân bay, đường Sông Đà, 10x20m, 40triệu",40 triệu/tháng,200 m²,"Tân Bình, Hồ Chí Minh",cho-thue-sang-nhuong-cua-hang-ki-ot
"Cho thuê cửa hàng chung cư Mỹ Phước, đường Phạm Thái Bường, Phú Mỹ Hưng, Quận 7 giá rẻ chỉ 25tr/th",25 triệu/tháng,86 m²,"Quận 7, Hồ Chí Minh",cho-thue-sang-nhuong-cua-hang-ki-ot
"Cho thuê kho, cửa hàng, S - 166m2, MT 6.7m, giá 10 tr/tháng mặt đường Quốc lộ 3 Mai Lâm - Đông Anh",10 triệu/tháng,166 m²,"Đông Anh, Hà Nội",cho-thue-sang-nhuong-cua-hang-ki-ot
Cho thuê mặt bằng kinh doanh hoặc làm kho kế chợ phú an bến cát bình dương,15 triệu/tháng,600 m²,"Bến Cát, Bình Dương",cho-thue-sang-nhuong-cua-hang-ki-ot
Chính chủ cần cho thuê mặt kinh doanh bằng trung tâm thành phố đường Lê Thanh Nghị,Giá thỏa thuận,250 m²,"Hải Châu, Đà Nẵng",cho-thue-sang-nhuong-cua-hang-ki-ot
"Cần sang gấp quán nhậu đường 30 Tháng 4, Hòa Cường Bắc Hải Châu, Đà Nẵng",75 triệu/tháng,600 m²,"Hải Châu, Đà Nẵng",cho-thue-sang-nhuong-cua-hang-ki-ot
Cho thuê kho hoặc mặt bằng kinh doan h tại phú hòa thủ dầu một bình dương,10 triệu/tháng,265 m²,"Thủ Dầu Một, Bình Dương",cho-thue-sang-nhuong-cua-hang-ki-ot
"Cho thuê shophouse 100m2. 2 tầng lối đi riêng đường ô tô tránh, đỗ xe ô tô thoải mái",25 triệu/tháng,100 m²,"Tây Hồ, Hà Nội",cho-thue-sang-nhuong-cua-hang-ki-ot
"Cho thuê, cửa hàng Cầu Giấy. DT: 30m2 riêng biệt. Giá: 5.5tr","5,5 triệu/tháng",30 m²,"Cầu Giấy, Hà Nội",cho-thue-sang-nhuong-cua-hang-ki-ot
"Cho thuê, cửa hàng Hoàng Quốc Việt DT: 55m2 giá: 10tr/th",10 triệu/tháng,55 m²,"Cầu Giấy, Hà Nội",cho-thue-sang-nhuong-cua-hang-ki-ot
Hiếm! Cho thuê nhà hàng vị trí đắc địa cách biển Nha Trang chỉ 80m,150 triệu/tháng,462 m²,"Nha Trang, Khánh Hòa",cho-thue-sang-nhuong-cua-hang-ki-ot
"Chính chủ cho thuê mặt bằng kinh doanh văn phòng 60m2 tại Văn Phú, Hà Đông 0937 936 ***",8 triệu/tháng,60 m²,"Hà Đông, Hà Nội",cho-thue-sang-nhuong-cua-hang-ki-ot
"Cho thuê kiot 04 mặt bờ kè Mường Thanh Khánh Hòa số 4 Trần Phú, chỉ 13 triệu/tháng",10 triệu/tháng,50 m²,"Nha Trang, Khánh Hòa",cho-thue-sang-nhuong-cua-hang-ki-ot
Cho thuê mặt bằng kinh doanh mặt tiền đường Xuân Thủy khu vực sầm uất Q2. Giá thuê 180 triệu/ tháng,180 triệu/tháng,320 m²,"Quận 2, Hồ Chí Minh",cho-thue-sang-nhuong-cua-hang-ki-ot
Chính chủ cho thuê MBKD 120m2 mặt phố Hoàng Ngân - Nguyễn Thị Định - MT rộng 12m,Giá thỏa thuận,120 m²,"Cầu Giấy, Hà Nội",cho-thue-sang-nhuong-cua-hang-ki-ot
"Cho thuê mặt bằng kinh doanh nhà hàng, spa Thảo Điền vị trí cực đẹp",75 triệu/tháng,"89,6 m²","Quận 2, Hồ Chí Minh",cho-thue-sang-nhuong-cua-hang-ki-ot
"Cho thuê mặt bằng 8x8m giá 20tr/th khu Hưng phước, Phú Mỹ Hưng, Quận 7",20 triệu/tháng,64 m²,"Quận 7, Hồ Chí Minh",cho-thue-sang-nhuong-cua-hang-ki-ot
"MBKD 12x46m trống suốt - MT Âu Cơ, phường Phú Thạnh, quận Tân Phú",180 triệu/tháng,500 m²,"Tân Phú, Hồ Chí Minh",cho-thue-sang-nhuong-cua-hang-ki-ot
Cho thuê nhà nguyên căn Thảo Điền Quận 2 giá cực tốt,55 triệu/tháng,400 m²,"Quận 2, Hồ Chí Minh",cho-thue-sang-nhuong-cua-hang-ki-ot
"Siêu phẩm ngay vòng xoay ngã 6 An Phú, TP Dĩ An, tỉnh Bình Dương. DT 17x35m",35 triệu/tháng,595 m²,"Dĩ An, Bình Dương",cho-thue-sang-nhuong-cua-hang-ki-ot
"Sang nhà hàng DT 10x19m Sông Đà 650 triệu P2, Tân Bình",35 triệu/tháng,190 m²,"Tân Bình, Hồ Chí Minh",cho-thue-sang-nhuong-cua-hang-ki-ot
"Cần sang gấp quán nhậu đường Xô Viết Nghệ Tĩnh, Hải Châu, Đà Nẵng",30 triệu/tháng,300 m²,"Hải Châu, Đà Nẵng",cho-thue-sang-nhuong-cua-hang-ki-ot
"Mặt bằng đẹp - giá tốt - cho thuê lại mặt bằng phường Hiệp Thành Q12, Tp Hồ Chí Minh",11 triệu/tháng,100 m²,"Quận 12, Hồ Chí Minh",cho-thue-sang-nhuong-cua-hang-ki-ot
"Cho thuê mặt bằng kinh doanh 500m2 góc 2 MT, mặt tiền lớn 24m",50 triệu/tháng,500 m²,"Quận 2, Hồ Chí Minh",cho-thue-sang-nhuong-cua-hang-ki-ot
Cho thuê sàn trung tâm thương mại BRG 25 Lê Văn Lương liên hệ trực tiếp CĐT: 0822 238 ***,30 triệu/tháng,"164,2 m²","Thanh Xuân, Hà Nội",cho-thue-sang-nhuong-cua-hang-ki-ot
"Cho thuê mặt bằng kinh doanh nhà hàng, bi-a, cafe 480m2 mặt phố Lê Đức Thọ, Mỹ Đình giá thoả thuận",Giá thỏa thuận,480 m²,"Nam Từ Liêm, Hà Nội",cho-thue-sang-nhuong-cua-hang-ki-ot
"Cho thuê shophouse dự án 423 Minh Khai, dt: 22m2, 50m2, 70m2, mặt phố Minh Khai. LH 0965 180 ***",28 triệu/tháng,70 m²,"Hai Bà Trưng, Hà Nội",cho-thue-sang-nhuong-cua-hang-ki-ot
"Cho thuê TT tầng 1 riêng biệt 45m2 có xép MT 4,5m KD hàng ăn ở tóc nail Lương Đình Của ĐĐ 6,5tr/th","6,5 triệu/tháng",45 m²,"Đống Đa, Hà Nội",cho-thue-sang-nhuong-cua-hang-ki-ot
"Cho thuê nhà, mặt bằng kinh doanh 641m2/sàn TP Lào Cai (chính chủ)",Giá thỏa thuận,641 m²,"Lào Cai, Lào Cai",cho-thue-sang-nhuong-cua-hang-ki-ot
Sang nhượng mặt bằng shop tại Chùa Bộc tháng 3/2024,8 triệu/tháng,30 m²,"Đống Đa, Hà Nội",cho-thue-sang-nhuong-cua-hang-ki-ot
"Cho thuê mặt bằng kinh doanh 200m2 ngay TT Thủ Đức, thích hợp kinh doanh nhà hàng, cf,...",19 triệu/tháng,200 m²,"Thủ Đức, Hồ Chí Minh",cho-thue-sang-nhuong-cua-hang-ki-ot
"Sang nhượng quán lươn niêu tại Kiot 09 đường Quang Lai, Tứ Hiệp Thanh Trì",10 triệu/tháng,50 m²,"Thanh Trì, Hà Nội",cho-thue-sang-nhuong-cua-hang-ki-ot
Chính chủ cho thuê nhà nhà kinh doanh mặt đường 420 Tân Xã,Giá thỏa thuận,100 m²,"Thạch Thất, Hà Nội",cho-thue-sang-nhuong-cua-hang-ki-ot
"Nhà mặt tiền còn trống lầu 2 cần cho thuê lại, thích hợp làm spa, dạy yoga, nối mi",10 triệu/tháng,50 m²,"Quận 8, Hồ Chí Minh",cho-thue-sang-nhuong-cua-hang-ki-ot
Cần sang quán lô góc 2 MT 300m2 - Thống Nhất D2D. Trung tâm Biên Hoà,22 triệu/tháng,300 m²,"Biên Hòa, Đồng Nai",cho-thue-sang-nhuong-cua-hang-ki-ot
