Title,Price,Area,Location,type
Cho thuê kho xưởng DT 4000m2 kho/tổng 7000m2 - giá 220tr/th. Đường Nguyễn Văn Quá - Quang Trung,220 triệu/tháng,4.000 m²,"Quận 12, Hồ Chí Minh",cho-thue-kho-nha-xuong-dat
Kho trống 800m2 và 1200m2 tại KCN Tân Bình mặt tiền đường CN5 - Q. Tân Phú,80 nghìn/m²,2.000 m²,"Tân Phú, Hồ Chí Minh",cho-thue-kho-nha-xuong-dat
"Cho thuê kho 2000m2 mặt tiền đường QL1A, Tân Thới Nhất, Quận 12",80 nghìn/m²,2.000 m²,"Quận 12, Hồ Chí Minh",cho-thue-kho-nha-xuong-dat
Cho thuê nhà xưởng 3000m2 trần cao 10m tại KCN Tân Tạo - Bình Tân,230 triệu/tháng,3.000 m²,"Bình Tân, Hồ Chí Minh",cho-thue-kho-nha-xuong-dat
Kho xưởng 1800m2 gần KCN Tân Thới Hiệp ngã tư Tô Ký - Quận 12,120 triệu/tháng,1.800 m²,"Quận 12, Hồ Chí Minh",cho-thue-kho-nha-xuong-dat
"Nhà xưởng giá rẻ 55 triệu/tháng 1500m2 tại đường Quốc Lộ 1, Quận Bình Tân",55 triệu/tháng,1.500 m²,"Bình Tân, Hồ Chí Minh",cho-thue-kho-nha-xuong-dat
"Cho thuê kho xưởng 1000m2 tại đường Tây Lân, Bình Trị Đông, quận Bình Tân",70 nghìn/m²,1.000 m²,"Bình Tân, Hồ Chí Minh",cho-thue-kho-nha-xuong-dat
"Cho thuê 2500m2, 5000m2 thuộc xã Long An, gần KCN Nhơn Trạch, 40 nghìn/m2/tháng",40 nghìn/m²,2.500 m²,"Long Thành, Đồng Nai",cho-thue-kho-nha-xuong-dat
Kho xưởng siêu đẹp 6000m2 mặt tiền đường Võ Trần Trí - Bình Chánh,420 triệu/tháng,6.000 m²,"Bình Chánh, Hồ Chí Minh",cho-thue-kho-nha-xuong-dat
"Cho thuê xưởng KCN An Phước và KCN Long Thành, 3000m2, 5000m2, 6000m2, 9000m2, giá 90 nghìn/m2/th",90 nghìn/m²,2.400 m²,"Long Thành, Đồng Nai",cho-thue-kho-nha-xuong-dat
"Chỉ 69 nghìn/m2/th, xưởng 2400m2, 2400m2, 3900m2, 4300m2, 8000m2, trong KCN Nhơn Trạch",69 nghìn/m²,2.400 m²,"Nhơn Trạch, Đồng Nai",cho-thue-kho-nha-xuong-dat
"Cho thuê xưởng 20000m2 trong KCN Nhơn Trạch, giá cực rẻ 64 nghìn/m2/th. LH Mr Hưng: 0918 283 ***",64 nghìn/m²,20.000 m²,"Nhơn Trạch, Đồng Nai",cho-thue-kho-nha-xuong-dat
"Cho thuê xưởng KCN Lộc An Bình Sơn 2000m2, 3000m2, 4000m2, 8000m2 và nhiều xưởng các KCN ở Đồng Nai",85 nghìn/m²,3.000 m²,"Long Thành, Đồng Nai",cho-thue-kho-nha-xuong-dat
"Nhà xưởng, nhà kho cho thuê tại KCN Yên Phong 2C, Bắc Ninh",Giá thỏa thuận,3.000 m²,"Yên Phong, Bắc Ninh",cho-thue-kho-nha-xuong-dat
BQL dự án KCN Vsip Bắc Ninh Cho thuê 1000300 050 ***ha-3ha kho xưởng sản xuất KD nhiều lĩnh vực,50 nghìn/m²,2.000 m²,"Từ Sơn, Bắc Ninh",cho-thue-kho-nha-xuong-dat
"Cho thuê kho xưởng 3500m2 đường Nguyễn Văn Quá, Đông Hưng Thuận, Quận 12",100 triệu/tháng,3.500 m²,"Quận 12, Hồ Chí Minh",cho-thue-kho-nha-xuong-dat
Cho thuê lại FarmStay đã xây dựng và hoàn thiện,15 triệu/tháng,6.000 m²,"Định Quán, Đồng Nai",cho-thue-kho-nha-xuong-dat
"Cho thuê kho đẹp 5200m2 MT Đào Trí, Phú Thuận, Q7 ngay Cao Ốc Hưng Thịnh, SHR, PCCC, contai 24/24",250 triệu/tháng,5.200 m²,"Quận 7, Hồ Chí Minh",cho-thue-kho-nha-xuong-dat
Cho thuê 450m2 kho Lò Lu giá 55 triệu/tháng 0932 069 *** Huy,55 triệu/tháng,450 m²,"Quận 9, Hồ Chí Minh",cho-thue-kho-nha-xuong-dat
Cho thuê kho bãi 1700m2 35tr/tháng chỗ sửa xe cơ giới ngay cảng Lotus Nguyễn Văn Quỳ Q7,35 triệu/tháng,1.700 m²,"Quận 7, Hồ Chí Minh",cho-thue-kho-nha-xuong-dat
"Cho thuê kho xưởng 300m2, ngang 8m, có điện 3 pha",15 triệu/tháng,300 m²,"Dĩ An, Bình Dương",cho-thue-kho-nha-xuong-dat
Cho thuê xưởng đa diện tích 100m - 200m2 đến 1000m2 tại Vân Côn và Song Phương,35 nghìn/m²,1.000 m²,"Hoài Đức, Hà Nội",cho-thue-kho-nha-xuong-dat
Cho thuê 7000m2 kho mặt tiền đường Nguyễn Thị Định Phường An Phú Quận 2 - 120k/m2,120 nghìn/m²,7.000 m²,"Quận 2, Hồ Chí Minh",cho-thue-kho-nha-xuong-dat
"Cho thuê kho xưởng 300m2, trục QL 1A, quận Bình Tân",17 triệu/tháng,300 m²,"Bình Tân, Hồ Chí Minh",cho-thue-kho-nha-xuong-dat
"Cho thuê mặt bằng làm nhà xưởng, văn phòng",30 triệu/tháng,1.200 m²,"Biên Hòa, Đồng Nai",cho-thue-kho-nha-xuong-dat
Chính chủ cho thuê 1.300m2 kho xưởng tại đường Số 17 KCX Tân Thuận Q7. Hiện trạng kho xưởng có PCCC,170 triệu/tháng,1.300 m²,"Quận 7, Hồ Chí Minh",cho-thue-kho-nha-xuong-dat
"Cho thuê gấp kho 1000m2 tại Đại Mỗ (chia nhỏ được 300m2 và 500m2). Hợp đồng lâu dài, xuất dc VAT",70 nghìn/m²,1.000 m²,"Nam Từ Liêm, Hà Nội",cho-thue-kho-nha-xuong-dat
Cho thuê kho giá rẻ diện tích 80 - 100 - 120 - 160m2 KĐT Geleximco Lê Trọng Tấn Hà Đông,6 triệu/tháng,80 m²,"Hà Đông, Hà Nội",cho-thue-kho-nha-xuong-dat
Cho thuê xưởng 500m2 điện 3 pha đường xe công,10 triệu/tháng,500 m²,"Dĩ An, Bình Dương",cho-thue-kho-nha-xuong-dat
Cho thuê xưởng 190m2 ngang 14m có điện 3 pha đường xe container,11 triệu/tháng,190 m²,"Dĩ An, Bình Dương",cho-thue-kho-nha-xuong-dat
Cho thuê xưởng 300m2 có điện 3 pha đường xe công 2 phòng ngủ,15 triệu/tháng,300 m²,"Dĩ An, Bình Dương",cho-thue-kho-nha-xuong-dat
Cho thuê xưởng 300m2 điện 3 pha đường xe công né nhau,9 triệu/tháng,300 m²,"Dĩ An, Bình Dương",cho-thue-kho-nha-xuong-dat
"Cho thuê gấp kho 500m2 - 2000m2 tại KCN Phú Thị, Gia Lâm, Hà Nội. Giá rẻ nhất thị trường",60 nghìn/m²,500 m²,"Gia Lâm, Hà Nội",cho-thue-kho-nha-xuong-dat
"Cho thuê xưởng MT Bà Thiên xe công 40 feet chạy thoải mái, điện, nước đầy đủ",35 triệu/tháng,2.500 m²,"Củ Chi, Hồ Chí Minh",cho-thue-kho-nha-xuong-dat
"Cho thuê 1500m2 nhà xưởng Hóc Môn, giá rẻ",42 triệu/tháng,1.500 m²,"Hóc Môn, Hồ Chí Minh",cho-thue-kho-nha-xuong-dat
Cho thuê kho 500m2 gần ngã tư An Sương,20 triệu/tháng,500 m²,"Quận 12, Hồ Chí Minh",cho-thue-kho-nha-xuong-dat
"Cho thuê kho, nhà xưởng, DT: 720m2, 1800m2, 3000m2, 6000m2 trong KCN Hoà Cầm, Đà Nẵng",55 nghìn/m²,1.000 m²,"Cẩm Lệ, Đà Nẵng",cho-thue-kho-nha-xuong-dat
"Cho thuê kho xưởng 1000m2, 2000m2, 7000m2 trong KCN Hoà Khánh, Tp. Đà Nẵng",50 triệu/tháng,1.000 m²,"Liên Chiểu, Đà Nẵng",cho-thue-kho-nha-xuong-dat
Cần cho thuê 550m2 giá 20tr/th bao bì hết hạn hợp đồng tại Thạnh Lộc - Quận 12. LH 0936 379 ***,20 triệu/tháng,550 m²,"Quận 12, Hồ Chí Minh",cho-thue-kho-nha-xuong-dat
"Cho thuê kho xưởng DT kho 1000m2 - 85tr/th - đường Mã Lò, cont 40F vào, có PCCC",85 triệu/tháng,1.000 m²,"Bình Tân, Hồ Chí Minh",cho-thue-kho-nha-xuong-dat
"Cho thuê kho xưởng 700m2 - 42tr/th (60k/m2/th), đường Mã Lò, mái cao thoáng",42 triệu/tháng,700 m²,"Bình Tân, Hồ Chí Minh",cho-thue-kho-nha-xuong-dat
Cho thuê tổng 800m2 - 60tr/th: Kho 800m2 + sân 300m2 đường container 40F,60 triệu/tháng,800 m²,"Bình Tân, Hồ Chí Minh",cho-thue-kho-nha-xuong-dat
Cho thuê tổng 2000m2: Kho 1500m2 + VP 200m sân 300m đường container 40F trần thạch cao nền gạch men,150 triệu/tháng,2.000 m²,"Bình Tân, Hồ Chí Minh",cho-thue-kho-nha-xuong-dat
"Cho thuê kho chứa hàng khu đường số Phạm Hữu Lầu Q7, 3.5x10m * giá thuê: 4 triệu / tháng",4 triệu/tháng,35 m²,"Quận 7, Hồ Chí Minh",cho-thue-kho-nha-xuong-dat
Chính chủ cho thuê gấp kho tại Lê Trọng Tấn Hà Đông DT 300m2 - 500 - 1000 - 5000m2. Xưởng mới dựng,65 nghìn/m²,1.000 m²,"Hà Đông, Hà Nội",cho-thue-kho-nha-xuong-dat
"Cho thuê kho xưởng 1000m2, 2000m2, 5000m2, 10.000m2, 20.000m2 KCN Sóng Thần 1, PCCC giá 80.000đ/m2",80 nghìn/m²,1.000 m²,"Dĩ An, Bình Dương",cho-thue-kho-nha-xuong-dat
"Chính chủ cần cho thuê kho mặt tiền đường Trần Thị Liền, xã Phước Kiển, Nhà Bè, giá chỉ 15tr/tháng",15 triệu/tháng,200 m²,"Nhà Bè, Hồ Chí Minh",cho-thue-kho-nha-xuong-dat
"Cho thuê kho xưởng 3800m2 trong KCN Bình Chiểu, TP. Thủ Đức",369 triệu/tháng,3.800 m²,"Thủ Đức, Hồ Chí Minh",cho-thue-kho-nha-xuong-dat
Cho thuê kho xưởng 200m2 giá thấp tại đường Phúc Diễn,Giá thỏa thuận,200 m²,"Bắc Từ Liêm, Hà Nội",cho-thue-kho-nha-xuong-dat
Cho thuê kho chứa hàng tại Phúc Diễn. Diện tích 40m - 60m2,80 nghìn/m²,4.800 m²,"Bắc Từ Liêm, Hà Nội",cho-thue-kho-nha-xuong-dat
Xưởng Tân Uyên 550m2 25 triệu/tháng điện 160kva đường tải SX nhiều ngành nghề gỗ ok,25 triệu/tháng,550 m²,"Tân Uyên, Bình Dương",cho-thue-kho-nha-xuong-dat
Cho thuê kho mới đẹp 450m2 giá chỉ 25tr/tháng gần ngã tư Bình Phước,25 triệu/tháng,450 m²,"Thuận An, Bình Dương",cho-thue-kho-nha-xuong-dat
"Cho thuê xưởng 700m2, giá chỉ 35tr/tháng tại Thuận An, Bình Dương",35 triệu/tháng,700 m²,"Thuận An, Bình Dương",cho-thue-kho-nha-xuong-dat
Cho thuê nhà xưởng 400m2 tại phường Thạnh Xuân Quận 12,15 triệu/tháng,400 m²,"Quận 12, Hồ Chí Minh",cho-thue-kho-nha-xuong-dat
Cho thuê nhà xưởng 300m2 1/ đường Vườn Lài phường An Phú Đông Quận 12,15 triệu/tháng,300 m²,"Quận 12, Hồ Chí Minh",cho-thue-kho-nha-xuong-dat
"Cho thuê kho mini 64m2 tại Lê Đức Thọ, P. 15. Giá 7 triệu/th",7 triệu/tháng,64 m²,"Gò Vấp, Hồ Chí Minh",cho-thue-kho-nha-xuong-dat
"Cần cho thuê lô đất 3 mặt tiền xây cao tầng gần cầu Nguyễn Tri Phương, Đà Nẵng",40 triệu/tháng,1.110 m²,"Cẩm Lệ, Đà Nẵng",cho-thue-kho-nha-xuong-dat
"Cho thuê tầng hầm có nội thất chỉ 11/tr tháng, có chỗ gửi xe, Sari Town KDT Sa La",11 triệu/tháng,30 m²,"Quận 2, Hồ Chí Minh",cho-thue-kho-nha-xuong-dat
Cho thuê xưởng 2000m2 - giá siêu rẻ chỉ 163 triệu/tháng - KCN Tam Phước - Biên Hòa - Đồng Nai,163 triệu/tháng,2.000 m²,"Biên Hòa, Đồng Nai",cho-thue-kho-nha-xuong-dat
"Cho thuê 2 kho 290m2 và 520m2 có PCCC Đ Lê Thánh Tôn, Q1",104 triệu/tháng,520 m²,"Quận 1, Hồ Chí Minh",cho-thue-kho-nha-xuong-dat
Nhà xưởng chính chủ diện tích 200m2,7 triệu/tháng,200 m²,"Thường Tín, Hà Nội",cho-thue-kho-nha-xuong-dat
"Cho thuê xưởng 800m², Đông Hòa, TP Dĩ An, gần QL 1K",22 triệu/tháng,800 m²,"Dĩ An, Bình Dương",cho-thue-kho-nha-xuong-dat
Cho thuê kho mặt tiền Võ Thị Sáu nối dài sát bên siêu thị Big C Go Dĩ An,10 triệu/tháng,200 m²,"Dĩ An, Bình Dương",cho-thue-kho-nha-xuong-dat
"Cho thuê kho Đình Vũ, Hải An, Hải Phòng",Giá thỏa thuận,1.000 m²,"Hải An, Hải Phòng",cho-thue-kho-nha-xuong-dat
Kho xưởng cho thuê mặt tiền đường Tô Vĩnh Diện,20 triệu/tháng,340 m²,"Tân Uyên, Bình Dương",cho-thue-kho-nha-xuong-dat
Cho thuê nhà xưởng khu vực Hóc Môn 1000m2 2000m2,90 triệu/tháng,1.800 m²,"Hóc Môn, Hồ Chí Minh",cho-thue-kho-nha-xuong-dat
"Cho thuê nhà xưởng KCN Hoàng Gia 1300m, 2000m 5000m 10000m2",200 triệu/tháng,5.700 m²,"Đức Hòa, Long An",cho-thue-kho-nha-xuong-dat
"Chính chủ cho thuê gấp kho 135m2 - 222m2, 350m2 - 500m2 đến 2000m2 tại Vạn Phúc, Hà Đông",Giá thỏa thuận,220 m²,"Hà Đông, Hà Nội",cho-thue-kho-nha-xuong-dat
"Kho bãi, nhà xưởng diện tích lớn nhỏ cho thuê tại Quận 12 TPHCM",200 triệu/tháng,4.000 m²,"Quận 12, Hồ Chí Minh",cho-thue-kho-nha-xuong-dat
"Cho thuê kho Giải Phóng - Giáp Bát diện tích 99k/1m2 xe container, ngay mặt phố Giải Phóng",10 triệu/tháng,100 m²,"Hoàng Mai, Hà Nội",cho-thue-kho-nha-xuong-dat
"Chính chủ cho thuê kho tại Nguyễn Xiển, Vành đai 3. DT 100m2-200m2-300m2-400m2-1000m2",Giá thỏa thuận,300 m²,"Thanh Xuân, Hà Nội",cho-thue-kho-nha-xuong-dat
Cho thuê kho xưởng cụm CN Lai Xá Hoài Đức đường QL32,Giá thỏa thuận,228 m²,"Hoài Đức, Hà Nội",cho-thue-kho-nha-xuong-dat
"Cho thuê kho xưởng 4600m2 KCN VSIP 1, Bình Hòa, Thuận An, Bình Dương","122,4 nghìn/m²",4.600 m²,"Thuận An, Bình Dương",cho-thue-kho-nha-xuong-dat
"Cần cho thuê kho, xưởng diện tích 100 - 300 - 600m2 tại Phú Thị - Gia Lâm",Giá thỏa thuận,600 m²,"Gia Lâm, Hà Nội",cho-thue-kho-nha-xuong-dat
"Chính chủ cần cho thuê kho, xưởng tại Tân Tây Đô - Hoài Đức. Diện tích: 800m2",70 nghìn/m²,800 m²,"Hoài Đức, Hà Nội",cho-thue-kho-nha-xuong-dat
"Chính chủ cần cho thuê kho, xưởng tại An Khánh, Hoài Đức. Diện tích đa dạng từ 200, 500,1000,2000m2",Giá thỏa thuận,500 m²,"Hoài Đức, Hà Nội",cho-thue-kho-nha-xuong-dat
"Cho thuê kho 550m2 và 1000m2 tại KĐT Đặng Xá, Gia Lâm, HN. Có hệ thống PCCC",Giá thỏa thuận,1.000 m²,"Gia Lâm, Hà Nội",cho-thue-kho-nha-xuong-dat
Cho thuê kho 100 - 200m2 tại Quang Trung - Hà Đông diện tích: 100-200m2,Giá thỏa thuận,100 m²,"Hà Đông, Hà Nội",cho-thue-kho-nha-xuong-dat
"Chính chủ cho thuê kho tại Coma Tây Mỗ, Từ Liêm, Hà Nội. DT 300m2 - 500m2 - 1000m2 đến 10.000m2",Giá thỏa thuận,1.000 m²,"Nam Từ Liêm, Hà Nội",cho-thue-kho-nha-xuong-dat
"Cho thuê kho xưởng Đặng Xuân Bảng, 3pha, xe tải lớn đỗ cửa, diện tích 100, 200, 300, 400, 600m2",70 nghìn/m²,300 m²,"Hoàng Mai, Hà Nội",cho-thue-kho-nha-xuong-dat
"Cho thuê gấp kho xưởng phường Tân Thới Nhất, Q. 12. Diện tích 2300m2, giá 150tr/tháng",150 triệu/tháng,2.300 m²,"Quận 12, Hồ Chí Minh",cho-thue-kho-nha-xuong-dat
"Cho thuê kho xưởng 500m2 Xã Vĩnh Lộc A, Huyện Bình Chánh. Giá 22 triệu",22 triệu/tháng,500 m²,"Bình Chánh, Hồ Chí Minh",cho-thue-kho-nha-xuong-dat
"Cho thuê gấp kho, xưởng đường Thanh Niên xã Phạm Văn Hai, Bình Chánh. Tổng DT 3000m2 giá cực rẻ",100 triệu/tháng,3.000 m²,"Bình Chánh, Hồ Chí Minh",cho-thue-kho-nha-xuong-dat
Cần cho thuê Gấp bãi xe DT: 2400m2. Xã Vĩnh Lộc B - huyện Bình Chánh Tp. HCM.,55 triệu/tháng,2.400 m²,"Bình Chánh, Hồ Chí Minh",cho-thue-kho-nha-xuong-dat
"Cho thuê gấp kho, xưởng sân bãi xã Thới Tam Thôn. Hóc Môn. DT 5.600 m2, giá 200tr/tháng",200 triệu/tháng,5.600 m²,"Hóc Môn, Hồ Chí Minh",cho-thue-kho-nha-xuong-dat
"Cho thuê kho nhà xưởng 700m2, Bình Hưng Hoà B, Bình Tân",35 triệu/tháng,700 m²,"Bình Tân, Hồ Chí Minh",cho-thue-kho-nha-xuong-dat
"Cho thuê kho xưởng Mt Hương lộ 2. Xã Tân Phú Trung. Huyện Củ Chi, giá 130 tr",110 triệu/tháng,2.500 m²,"Củ Chi, Hồ Chí Minh",cho-thue-kho-nha-xuong-dat
"Cần cho thuê gấp 2 kho Xã vĩnh Lộc A, Huyện Bình Chánh",40 triệu/tháng,2.100 m²,"Bình Chánh, Hồ Chí Minh",cho-thue-kho-nha-xuong-dat
"Cho thuê gấp kho 300m2 - 500m2 - 800m2 - 1000m2 đến 2000m2 tại KCN Lại Yên, Hà Nội",Giá thỏa thuận,500 m²,"Hoài Đức, Hà Nội",cho-thue-kho-nha-xuong-dat
"Cho Thuê kho, Xưởng MT Đường Trần Văn Giàu xã Phạm Văn Hai Bình Chánh.",95 triệu/tháng,1.800 m²,"Bình Chánh, Hồ Chí Minh",cho-thue-kho-nha-xuong-dat
"Cho thuê gấp kho, xưởng DT khoảng 1200m2 1xec Đường Trần Đại Nghĩa xã Phạm Văn Hai. Bình Chánh",44 triệu/tháng,1.200 m²,"Bình Chánh, Hồ Chí Minh",cho-thue-kho-nha-xuong-dat
"Cho thuê kho xưởng DT: 2600m2, 5000m2, 20.000m2 tại KCN Quế Võ 1, 2, 3, Quế Võ, Bắc Ninh",Giá thỏa thuận,20.000 m²,"Quế Võ, Bắc Ninh",cho-thue-kho-nha-xuong-dat
Cho Thuê gấp kho 7000m2 măt tiền quốc lộ 1A và đường Hương Lộ 2.,Giá thỏa thuận,7.000 m²,"Bình Tân, Hồ Chí Minh",cho-thue-kho-nha-xuong-dat
"Cho Thuê gấp kho mới, đẹp 8.000m2 đường Hương Lộ 2, Bình Tân, đường container",550 triệu/tháng,8.000 m²,"Bình Tân, Hồ Chí Minh",cho-thue-kho-nha-xuong-dat
"Cho thuê xưởng MT Phạm Văn Sáng xã Xuân Thới Thượng, Hóc Môn. DT 2000m2 giá cho thuê 115tr/th",115 triệu/tháng,2.000 m²,"Hóc Môn, Hồ Chí Minh",cho-thue-kho-nha-xuong-dat
"Cho thuê kho mới đẹp, mặt tiền Hương Lộ 2, Mã Lò, Bình Tân",Giá thỏa thuận,350 m²,"Bình Tân, Hồ Chí Minh",cho-thue-kho-nha-xuong-dat
"Cho thuê kho, xưởng ngắn hạn hay dài hạn đường Phan Văn Hớn Phường Tân Thới Nhất Q12",55 nghìn/m²,550 m²,"Quận 12, Hồ Chí Minh",cho-thue-kho-nha-xuong-dat
Chính chủ cần cho thuê kho xưởng diện tích: 300m2 tại An Thượng - Hoài Đức,Giá thỏa thuận,300 m²,"Hoài Đức, Hà Nội",cho-thue-kho-nha-xuong-dat
"Cho thuê xưởng 1200m² ở Vĩnh Lộc A, Bình Chánh. Giá thuê: 50tr/tháng còn thương lượng",50 triệu/tháng,1.200 m²,"Bình Chánh, Hồ Chí Minh",cho-thue-kho-nha-xuong-dat
Chính chủ cho thuê kho xưởng diện tích 300m2 tại Tây Mỗ - Nam Từ Liêm,Giá thỏa thuận,300 m²,"Nam Từ Liêm, Hà Nội",cho-thue-kho-nha-xuong-dat
"Cần cho thuê kho, xưởng tại Ngã tư Trạm Trôi - Hoài Đức. Diện tích: 100 - 200 - 500 - 1500m2",Giá thỏa thuận,900 m²,"Hoài Đức, Hà Nội",cho-thue-kho-nha-xuong-dat
"CHO THUÊ KHO XƯỞNG QUỐC LỘ 1a, Xã Tân Kiên H. BÌNH CHÁNH.",250 triệu/tháng,8.500 m²,"Bình Chánh, Hồ Chí Minh",cho-thue-kho-nha-xuong-dat
"Chính chủ cho thuê kho xưởng 100-300-1000m2 mặt đường QL32, ngay Ngã 4 Trôi - Hoài Đức",Giá thỏa thuận,100 m²,"Hoài Đức, Hà Nội",cho-thue-kho-nha-xuong-dat
Chính chủ cho thuê kho 120m2 tại Vạn Phúc - Hà Đông,Giá thỏa thuận,120 m²,"Hà Đông, Hà Nội",cho-thue-kho-nha-xuong-dat
"Chính chủ cần cho thuê kho, xưởng diện tích đa dạng: 200 - 600 - 1200m2 tại Nguyên Khê",Giá thỏa thuận,1.000 m²,"Đông Anh, Hà Nội",cho-thue-kho-nha-xuong-dat
"Cho thuê kho diện tích 100-200-300m2 khu vực đường 70 ngày viện K Tân Triều, Thanh Trì, HN",Giá thỏa thuận,100 m²,"Thanh Trì, Hà Nội",cho-thue-kho-nha-xuong-dat
Cho thuê gấp 3 xưởng trong KCN Vĩnh Lộc. Quận Bình Tân TP. HCM.,Giá thỏa thuận,3.800 m²,"Bình Tân, Hồ Chí Minh",cho-thue-kho-nha-xuong-dat
Chính chủ cho thuê kho xưởng 300m - 500m - 1000m - 5000m2 An Khánh - Hoài Đức - HN,Giá thỏa thuận,500 m²,"Hoài Đức, Hà Nội",cho-thue-kho-nha-xuong-dat
"Cho thuê gấp kho, xưởng. Giá rẻ bất ngờ. MT đường Trần Đại Nghĩa xã Tân Nhựt. Huyện Bình Chánh",Giá thỏa thuận,3.800 m²,"Bình Chánh, Hồ Chí Minh",cho-thue-kho-nha-xuong-dat
"Cho thuê kho đất MT Lê Ngung (1200m2), gần Quốc Lộ, ưu tiên dài hạn",30 triệu/tháng,1.200 m²,"Bình Tân, Hồ Chí Minh",cho-thue-kho-nha-xuong-dat
Cho thuê nhà xưởng 12.000m2 giá 337 triệu/tháng -Tam Phước-Biên Hoà-Đồng Nai,337 triệu/tháng,12.000 m²,"Biên Hòa, Đồng Nai",cho-thue-kho-nha-xuong-dat
"Cho thuê kho xưởng chuẩn logistics tại Hạp Lĩnh, Bắc Ninh. DT: 4500m2 - 90000m2",Giá thỏa thuận,90.000 m²,"Bắc Ninh, Bắc Ninh",cho-thue-kho-nha-xuong-dat
"Cho thuê gấp kho 1200 m2 (Ngăn được 400m2) gần nhà máy xe máy SYM ngã tư Lê trọng Tấn, Dương Nội",70 nghìn/m²,1.200 m²,"Hà Đông, Hà Nội",cho-thue-kho-nha-xuong-dat
"Cho thuê nhà xưởng tại An Lão, Hải Phòng",60 nghìn/m²,3.000 m²,"An Lão, Hải Phòng",cho-thue-kho-nha-xuong-dat
Sẵn kho diện tích 450m2 tại Gia Lâm cần cho thuê,60 nghìn/m²,650 m²,"Gia Lâm, Hà Nội",cho-thue-kho-nha-xuong-dat
"Cho thuê kho xưởng tại KCN Phú Nghĩa, Chương Mỹ, Hà Nội. DT: 720m2, 1300m2, 2250m2, 10.000m2",Giá thỏa thuận,10.000 m²,"Chương Mỹ, Hà Nội",cho-thue-kho-nha-xuong-dat
"Cho thuê kho xưởng 1200m2, 2200m2, 2500m2 PCCC tự động nghiệm thu tại KCN Phú Nghĩa, Hà Nội",70 nghìn/m²,2.500 m²,"Chương Mỹ, Hà Nội",cho-thue-kho-nha-xuong-dat
"Chính chủ cho thuê xưởng 700m2 mặt tiền Quốc Lộ 1K, Dĩ An, giá hạt dẻ",40 triệu/tháng,700 m²,"Dĩ An, Bình Dương",cho-thue-kho-nha-xuong-dat
"Cho thuê kho xưởng Hương Lộ 2, DT: 1.700m2, giá: 70k/m2, Bình Tân",119 triệu/tháng,1.700 m²,"Bình Tân, Hồ Chí Minh",cho-thue-kho-nha-xuong-dat
"Cho thuê xưởng diện tích 400m2 xây dựng chắc chắn, đường contener vào tận nơi",45 nghìn/m²,400 m²,"Đan Phượng, Hà Nội",cho-thue-kho-nha-xuong-dat
"Cho thuê kho xưởng Giải Phóng, 3pha, xe tải lớn đỗ cửa, diện tích 100, 200, 300, 400, 500, 600m2",65 nghìn/m²,300 m²,"Hoàng Mai, Hà Nội",cho-thue-kho-nha-xuong-dat
"Cho thuê kho xưởng kế bên KCN Tân Bình, DT: 800m2, giá: 70tr, Q12",70 triệu/tháng,800 m²,"Quận 12, Hồ Chí Minh",cho-thue-kho-nha-xuong-dat
"Cho thuê kho xưởng tại KCN Ngọc Hồi, Thanh Trì, Hà Nội. DT: 1200m2, 1600m2, 3000m2... 7000m2",80 nghìn/m²,3.000 m²,"Thanh Trì, Hà Nội",cho-thue-kho-nha-xuong-dat
Cho thuê 5000m2 nhà xưởng trong KCN Châu Sơn giá chỉ 60k,60 nghìn/m²,5.000 m²,"Phủ Lý, Hà Nam",cho-thue-kho-nha-xuong-dat
Cho thuê 3.600 - 10.800m2 trong KCN Châu Sơn,70 nghìn/m²,3.600 m²,"Phủ Lý, Hà Nam",cho-thue-kho-nha-xuong-dat
Cho thuê 5000m2 nhà xưởng cao cấp sẵn 10 cẩu trục,"60,36 nghìn/m²",5.000 m²,"Yên Mỹ, Hưng Yên",cho-thue-kho-nha-xuong-dat
"Cho thuê 700m2 nhà xưởng xã Trung Nghĩa, TP Hưng Yên",45 nghìn/m²,700 m²,"Hưng Yên, Hưng Yên",cho-thue-kho-nha-xuong-dat
"Cho thuê kho mới góc 2 mặt tiền đường Bình Lợi, P13 Bình Thạnh. DT 10x21m. Vị trí thoáng đường 12m",28 triệu/tháng,210 m²,"Bình Thạnh, Hồ Chí Minh",cho-thue-kho-nha-xuong-dat
"Cho thuê xưởng 1500m2, 25 triệu/th đường Cầu Xây 2, P. Tân Phú, Thủ Đức",25 triệu/tháng,1.500 m²,"Quận 9, Hồ Chí Minh",cho-thue-kho-nha-xuong-dat
"Chính chủ cho thuê xưởng 3 tầng mặt đường Vành đai 4, gần QL32 Hoài Đức",Giá thỏa thuận,360 m²,"Hoài Đức, Hà Nội",cho-thue-kho-nha-xuong-dat
"Cho thuê nhà xưởng trong KCN Yên Phong DT 3200m2 độc lập, phù hợp sản xuất/showroom trưng bày",140 nghìn/m²,3.200 m²,"Yên Phong, Bắc Ninh",cho-thue-kho-nha-xuong-dat
"Cho thuê nhà xưởng tại KCN Thuận Thành, DT 3500m2, 8000m2 hoặc 15000m2, xưởng mới. LH 0988 457 ***",82 nghìn/m²,3.500 m²,"Thuận Thành, Bắc Ninh",cho-thue-kho-nha-xuong-dat
"Cho thuê nhà xưởng KCN Tiên Sơn, DT 6000m2, có sẵn cẩu trục. LH 0988 457 ***",85 nghìn/m²,6.000 m²,"Từ Sơn, Bắc Ninh",cho-thue-kho-nha-xuong-dat
"Cho thuê nhà xưởng KCN Yên Phong, DT 8000m2, độc lập đủ đk Chế xuất. LH 0988 457 ***","104,94 nghìn/m²",8.000 m²,"Yên Phong, Bắc Ninh",cho-thue-kho-nha-xuong-dat
"Cho thuê kho xưởng 1500m2, 3000m2, 6000m2, 10.000m2 tại CCN Tân Quang, Văn Lâm, Hưng Yên",Giá thỏa thuận,10.000 m²,"Văn Lâm, Hưng Yên",cho-thue-kho-nha-xuong-dat
"Cho thuê kho xưởng 2 tầng tiêu chuẩn quốc tế tại KCN Quế Võ, Bắc Ninh: DT 17600m2","93,5 nghìn/m²","17.615,96 m²","Quế Võ, Bắc Ninh",cho-thue-kho-nha-xuong-dat
Cho thuê mặt tiền đường Quốc Lộ 13 - Vĩnh Phú - Thuận An. DT: 14x60m = 840m2,Giá thỏa thuận,800 m²,"Thuận An, Bình Dương",cho-thue-kho-nha-xuong-dat
"Cho thuê kho xưởng tại Yên Mỹ, Hưng Yên (Kho Xưởng tiêu chuẩn). DT đa dạng: Từ 1000m2, 30000m2",60 nghìn/m²,30.000 m²,"Yên Mỹ, Hưng Yên",cho-thue-kho-nha-xuong-dat
Cho thuê kho - xưởng (Như Hình)DT: 11x60m=650m2 Đường nhựa rộng (Như Hình),Giá thỏa thuận,650 m²,"Thủ Đức, Hồ Chí Minh",cho-thue-kho-nha-xuong-dat
"Cho thuê kho chuẩn logistics tại QL5 Mỹ Hào, Hưng Yên. DT: 2000m2 đến 25.000m2",60 nghìn/m²,25.000 m²,"Mỹ Hào, Hưng Yên",cho-thue-kho-nha-xuong-dat
Cho thuê nhà xưởng (như hình) DT: 1.000m2 gồm trệt 670m2 + lầu 400m2 xưởng sạch sẽ,Giá thỏa thuận,1.000 m²,"Thuận An, Bình Dương",cho-thue-kho-nha-xuong-dat
Cho Thuê 3 Kho - Xưởng (Như Hình)DT: 330m2 - 450m2 và 750m2 Điện 3fa,Giá thỏa thuận,450 m²,"Thủ Đức, Hồ Chí Minh",cho-thue-kho-nha-xuong-dat
"Cho thuê kho nhà xưởng, 5000m, 10000m, 15.000m, 20000m2, 25000m2 khu công nghiệp Chu Lai Quảng Nam",200 triệu/tháng,5.000 m²,"Núi Thành, Quảng Nam",cho-thue-kho-nha-xuong-dat
"Cho thuê xưởng Dĩ An, Thuận An, Bình Dương",120 triệu/tháng,1.750 m²,"Dĩ An, Bình Dương",cho-thue-kho-nha-xuong-dat
Cho thuê xưởng TP Thuận An. 900m2-1200m2-1400m2-1700m2-1900m2-2500m2-3600m2-3800m2 Bình Dương,50 nghìn/m²,1.400 m²,"Thuận An, Bình Dương",cho-thue-kho-nha-xuong-dat
"Cho thuê nhà xưởng KCN Khánh Phú - Ninh Bình giá 35k/m2/th, DT 1000m2 - 30.000m2",35 triệu/tháng,1.000 m²,"Ninh Bình, Ninh Bình",cho-thue-kho-nha-xuong-dat
"Cho thuê kho phường Vĩnh Phú, DT 2700m2 nhà kho 900m2, TP. Thuận An, Bình Dương, LH: 0908 954 ***",65 triệu/tháng,2.700 m²,"Thuận An, Bình Dương",cho-thue-kho-nha-xuong-dat
"Cho thuê nhà máy sản xuất DT: 7500m2, 15000, EPE, tại KCN Minh Quang, Bạch Sam, Mỹ Hào, Hưng Yên",Giá thỏa thuận,7.000 m²,"Mỹ Hào, Hưng Yên",cho-thue-kho-nha-xuong-dat
"Cho thuê kho tiêu chuẩn tại Long Biên. DT 2000m2, 4.000m2. PCCC tự động",Giá thỏa thuận,4.000 m²,"Long Biên, Hà Nội",cho-thue-kho-nha-xuong-dat
