Title,Price,Area,Location,type
"Giỏ hàng cho thuê Shophouse Eco Green Q7, giá 40tr đến 110tr/tháng",40 triệu/tháng,100 m²,"Quận 7, Hồ Chí Minh",cho-thue-shophouse-nha-pho-thuong-mai
"Cho thuê căn shophouse Moonlight Park View, giá 12 triệu/tháng, diện tích 100m2, 1 trệt 1 lầu",12 triệu/tháng,100 m²,"Bình Tân, Hồ Chí Minh",cho-thue-shophouse-nha-pho-thuong-mai
"Cho thuê căn shophouse Moonlight Boulevard giá 12 triệu/tháng, diện tích 100m2, 1 trệt 1 lầu",12 triệu/tháng,100 m²,"Bình Tân, Hồ Chí Minh",cho-thue-shophouse-nha-pho-thuong-mai
"Cho thuê nhà nguyên căn VCN Phước Long 2 Nha Trang, chỉ 8tr/tháng, thuận tiện mở công ty",8 triệu/tháng,62 m²,"Nha Trang, Khánh Hòa",cho-thue-shophouse-nha-pho-thuong-mai
Cho thuê shophouse PL01-Vinhomes The Harmony - 216m2-hoàn thiện cơ bản-đường Nguyễn Lam rộng 43m,60 triệu/tháng,216 m²,"Long Biên, Hà Nội",cho-thue-shophouse-nha-pho-thuong-mai
Cho thuê shophouse hai tầng Vin Smart City,45 triệu/tháng,100 m²,"Nam Từ Liêm, Hà Nội",cho-thue-shophouse-nha-pho-thuong-mai
Cho thuê shophouse Starlake ngay Ngoại Giao Đoàn đã hoàn thiện đẹp,140 triệu/tháng,140 m²,"Tây Hồ, Hà Nội",cho-thue-shophouse-nha-pho-thuong-mai
"Cho thuê 2 căn shophouse Nguyễn Cơ Thạch liền kề giá tốt, đẹp nhất ngay khu Sala",320 triệu/tháng,336 m²,"Quận 2, Hồ Chí Minh",cho-thue-shophouse-nha-pho-thuong-mai
"Cần cho thuê mặt bằng shophouse CH Citi Esto Q2, DT: 60m2 (1WC), giá ưu đãi, dân cư đông",8 triệu/tháng,60 m²,"Quận 2, Hồ Chí Minh",cho-thue-shophouse-nha-pho-thuong-mai
Cho thuê gấp shophouse Sari Town Sala nhà có thang máy vị trí đẹp,76 triệu/tháng,116 m²,"Quận 2, Hồ Chí Minh",cho-thue-shophouse-nha-pho-thuong-mai
Cho thuê shophouse Nguyễn Cơ Thạch khu Sala tổng DT 700m2. Giá 150 triệu/tháng,150 triệu/tháng,"172,8 m²","Quận 2, Hồ Chí Minh",cho-thue-shophouse-nha-pho-thuong-mai
"Cần cho thuê lại 2 tầng căn shophouse tại khu đô thị Sala, đã hoàn thiện. Có kèm tầng trệt",70 triệu/tháng,220 m²,"Quận 2, Hồ Chí Minh",cho-thue-shophouse-nha-pho-thuong-mai
"Cần cho thuê nhà 6 tầng mặt phố kinh doanh hoặc làm VP khu Trần Thái Tông - Cầu Giấy, giá 65 triệu",65 triệu/tháng,100 m²,"Cầu Giấy, Hà Nội",cho-thue-shophouse-nha-pho-thuong-mai
"Cho thuê 2 căn đôi góc 3 mặt tiền shophouse trục đường Nguyễn Cơ Thạch khu Sala, tổng DT sàn 1500m2",350 triệu/tháng,360 m²,"Quận 2, Hồ Chí Minh",cho-thue-shophouse-nha-pho-thuong-mai
"Cho thuê gấp nhiều shophouse La Astoria, giá chỉ 4 tr/tháng",4 triệu/tháng,26 m²,"Quận 2, Hồ Chí Minh",cho-thue-shophouse-nha-pho-thuong-mai
Miễn phí tiền thuê 2 năm shophouse 5 tầng The Venice - KTown Grand World HN Vinhomes Ocean Park 2,Giá thỏa thuận,"82,5 m²","Văn Giang, Hưng Yên",cho-thue-shophouse-nha-pho-thuong-mai
Cần cho thuê gấp căn góc Hưng Phước đường Bùi Bằng Đoàn - Phú Mỹ Hưng giá tốt 180tr LH 0912 859 ***,180 triệu/tháng,"203,5 m²","Quận 7, Hồ Chí Minh",cho-thue-shophouse-nha-pho-thuong-mai
Chính chủ cho thuê 80m2 hoàn thiện nhà phố Sala Thủ Thiêm giá chỉ 25tr/tháng gọi 0917 345 ba ba hai,25 triệu/tháng,80 m²,"Quận 2, Hồ Chí Minh",cho-thue-shophouse-nha-pho-thuong-mai
"Cho thuê shophouse Dĩ An, Bình Dương chính chủ",25 triệu/tháng,173 m²,"Dĩ An, Bình Dương",cho-thue-shophouse-nha-pho-thuong-mai
Hàng hiếm được một căn Lakeview duy nhất trong giỏ hàng full nội thất xịn giá tốt cần cho thuê gấp,35 triệu/tháng,100 m²,"Quận 2, Hồ Chí Minh",cho-thue-shophouse-nha-pho-thuong-mai
Cho thuê 30m-50-100m2-250m-500m2. Tầng 1.2.3.4.5.6.Chung cư BRG Diamond Residence 25 Lê Văn Lương,300 nghìn/m²,100 m²,"Thanh Xuân, Hà Nội",cho-thue-shophouse-nha-pho-thuong-mai
"Cho thuê shophouse Sala Đại Quang Minh, 0934 072 ***",Giá thỏa thuận,120 m²,"Quận 2, Hồ Chí Minh",cho-thue-shophouse-nha-pho-thuong-mai
Shophouse Lavila cho thuê giá 24tr/tháng,24 triệu/tháng,"96,8 m²","Nhà Bè, Hồ Chí Minh",cho-thue-shophouse-nha-pho-thuong-mai
"Cho thuê chân đế thương mại BRG 25 Lê Văn Lương, ngã tư Hoàng Đạo Thúy. LH 0906 218 ***",130 triệu/tháng,240 m²,"Thanh Xuân, Hà Nội",cho-thue-shophouse-nha-pho-thuong-mai
Giỏ hàng chuyên cho thuê shophouse Vinhomes Central Park,120 triệu/tháng,200 m²,"Bình Thạnh, Hồ Chí Minh",cho-thue-shophouse-nha-pho-thuong-mai
Cho thuê shophouse tầng 1 CT18 (Happy House) - Đô Thị Việt Hưng. LH 0934 346 ***,"12,5 triệu/tháng",106 m²,"Long Biên, Hà Nội",cho-thue-shophouse-nha-pho-thuong-mai
"Cho thuê shop DT 185m2 giá 18 - 20tr/tháng gặp chủ thương lượng, tiện ích đầy đủ, 0916 651 ***",18 triệu/tháng,185 m²,"Quận 7, Hồ Chí Minh",cho-thue-shophouse-nha-pho-thuong-mai
Cho thuê shophouse góc DT rộng 80m2 tòa s3.03 VHGP,20 triệu/tháng,80 m²,"Quận 9, Hồ Chí Minh",cho-thue-shophouse-nha-pho-thuong-mai
"Cần cho thuê shophouse mặt đường Tố Hữu, Vạn Phúc, Hà Đông",Giá thỏa thuận,91 m²,"Hà Đông, Hà Nội",cho-thue-shophouse-nha-pho-thuong-mai
Chính chủ chưa dùng đến cần cho thuê shophouse BTT2 Him Lam Vạn Phúc - Hà Đông,21 triệu/tháng,95 m²,"Hà Đông, Hà Nội",cho-thue-shophouse-nha-pho-thuong-mai
"Chính chủ cho thuê shophouse D2Eight mặt tiền Đồng Văn Cống, Q2, 7x20m, hầm 7 tầng, 0938 140 ***",50 triệu/tháng,140 m²,"Quận 2, Hồ Chí Minh",cho-thue-shophouse-nha-pho-thuong-mai
CĐT dự án Hoàng Huy Commerce cho thuê shop thương mại - chân đế tòa nhà - T12 đón 4 nghìn căn hộ,"235,5 nghìn/m²",200 m²,"Lê Chân, Hải Phòng",cho-thue-shophouse-nha-pho-thuong-mai
"Cho thuê shophouse Sala Sarimi, Sarina - 230m2 - 3 tầng - 87 triệu/tháng - Hoàn thiện full",87 triệu/tháng,"76,36 m²","Quận 2, Hồ Chí Minh",cho-thue-shophouse-nha-pho-thuong-mai
"Cho thuê shophouse Star Hill đường lớn đối diện trường Đinh Thiện Lý II, giá 28tr/th: LH 0909 664 ***",28 triệu/tháng,60 m²,"Quận 7, Hồ Chí Minh",cho-thue-shophouse-nha-pho-thuong-mai
Miễn phí cho thuê shophouse K-Town Grand World Hà Nội,20 triệu/tháng,100 m²,"Văn Giang, Hưng Yên",cho-thue-shophouse-nha-pho-thuong-mai
"Shophouse Crest Metropole cho thuê, full giỏ hàng, xem nhà 24/7",150 triệu/tháng,260 m²,"Quận 2, Hồ Chí Minh",cho-thue-shophouse-nha-pho-thuong-mai
"Chủ nhà, cho thuê tầng 1 + 2 DT: 188m2 CT12 Kim Văn Kim Lũ. Giá: 72tr/tháng",72 triệu/tháng,188 m²,"Hoàng Mai, Hà Nội",cho-thue-shophouse-nha-pho-thuong-mai
Chính chủ không có nhu cầu kinh doanh cho thuê mặt bằng. Giá thuê 8 triệu. LH 0909 086 *** xem nhà,8 triệu/tháng,36 m²,"Quận 8, Hồ Chí Minh",cho-thue-shophouse-nha-pho-thuong-mai
Cho thuê shophouse ngay tại Trung tâm Thủ Thiêm - đường ven hồ trung tâm và Nguyễn Cơ Thạch,30 triệu/tháng,110 m²,"Quận 2, Hồ Chí Minh",cho-thue-shophouse-nha-pho-thuong-mai
Cho thuê căn nhà mặt đường 56m cửa ngõ đi Vinhomes Vũ Yên Hải Phòng. Giá tốt: 13tr/1 tháng,13 triệu/tháng,76 m²,"Thủy Nguyên, Hải Phòng",cho-thue-shophouse-nha-pho-thuong-mai
Cho thuê miễn phí 18-24 tháng mặt bằng kinh doanh Mega Grand World Hà Nội,Giá thỏa thuận,54 m²,"Văn Giang, Hưng Yên",cho-thue-shophouse-nha-pho-thuong-mai
"Cho thuê Shophouse 6 tầng KĐT C17 Bộ Công An khu phố Ngọc Thụy, Long Biên, Hà Nội: 0981 222 ***",50 triệu/tháng,150 m²,"Long Biên, Hà Nội",cho-thue-shophouse-nha-pho-thuong-mai
Cho thuê Shophouse The Sun Avenue thích hợp làm văn phòng kho giá 10 triệu,10 triệu/tháng,52 m²,"Quận 2, Hồ Chí Minh",cho-thue-shophouse-nha-pho-thuong-mai
Cho thuê Shophouse (Shophouse For Sale / Rent),"973,6 nghìn/m²","259,27 m²","Quận 2, Hồ Chí Minh",cho-thue-shophouse-nha-pho-thuong-mai
Cho thuê shophouse Vinhomes Tân Cảng gần Landmark 81 vị trí đẹp diện tích 210m2 cho thuê 90 tr/th,90 triệu/tháng,210 m²,"Bình Thạnh, Hồ Chí Minh",cho-thue-shophouse-nha-pho-thuong-mai
"Cho thuê shophouse Hưng Vượng 2, 130m2 giá 32tr/th, Phú Mỹ Hưng",32 triệu/tháng,130 m²,"Quận 7, Hồ Chí Minh",cho-thue-shophouse-nha-pho-thuong-mai
"Cho thuê căn shop Hưng Vương, Phú Mỹ Hưng, Q7, HCM",23 triệu/tháng,90 m²,"Quận 7, Hồ Chí Minh",cho-thue-shophouse-nha-pho-thuong-mai
"Cho thuê Shop chân đế toà A Masterise Vin Smart City, cạnh công viên trung tâm, DT 68m2, giá 70 tr",70 triệu/tháng,68 m²,"Nam Từ Liêm, Hà Nội",cho-thue-shophouse-nha-pho-thuong-mai
Cho thuê Shop House Florita Q7. Mặt ngoài cạnh sảnh 150m2. LH 0921 055 *** Giang (Zalo - Viber),25 triệu/tháng,150 m²,"Quận 7, Hồ Chí Minh",cho-thue-shophouse-nha-pho-thuong-mai
"Cho thuê shophouse 157m2 giá 25 triệu, mặt bằng đang trống sẵn",25 triệu/tháng,157 m²,"Quận 8, Hồ Chí Minh",cho-thue-shophouse-nha-pho-thuong-mai
"Cho thuê shophouse siêu đẹp mở văn phòng tại KDC Vietsing, cạnh Highland coffee",Giá thỏa thuận,40 m²,"Thuận An, Bình Dương",cho-thue-shophouse-nha-pho-thuong-mai
"Cho thuê MB kinh doanh, văn phòng làm việc từ 76m2 - 340m2. Gọi ngay 0818 999 *** để nhận ưu đãi",Giá thỏa thuận,340 m²,"Cần Giuộc, Long An",cho-thue-shophouse-nha-pho-thuong-mai
"Cho thuê shophouse khu đô thị Sala hầm 4,5 lầu",220 triệu/tháng,168 m²,"Quận 2, Hồ Chí Minh",cho-thue-shophouse-nha-pho-thuong-mai
"Chính chủ cho thuê shophouse CT4 đường 28 căn CH107 70m2 ngang 6,2m giá chỉ 15tr/tháng, 0914 201 ***",15 triệu/tháng,70 m²,"Nha Trang, Khánh Hòa",cho-thue-shophouse-nha-pho-thuong-mai
"Cho thuê shop thương mại dịch vụ 4 tầng - khai thác ngay - mặt đường lớn - giá 9,5tr/tháng","9,5 triệu/tháng",102 m²,"Văn Giang, Hưng Yên",cho-thue-shophouse-nha-pho-thuong-mai
Cho thuê nhà nguyên căn 4 tầng - mặt đường lớn - giá 13 triệu/ tháng,13 triệu/tháng,"111,7 m²","Văn Giang, Hưng Yên",cho-thue-shophouse-nha-pho-thuong-mai
"Kinh doanh 24/7, thuê miễn phí 2 năm, kinh doanh luôn tặng 30 triệu/3 tháng, K-Town Grand World",Giá thỏa thuận,"72,7 m²","Văn Giang, Hưng Yên",cho-thue-shophouse-nha-pho-thuong-mai
Cho thuê căn shophouse CT1 Vĩnh Điềm Trung đối diện siêu thị GO,15 triệu/tháng,75 m²,"Nha Trang, Khánh Hòa",cho-thue-shophouse-nha-pho-thuong-mai
"Cho thuê shop TMDV 5 tầng mặt đường đôi 40m, diện tích sử dụng 500m2, giá 80tr/tháng",80 triệu/tháng,500 m²,"Gia Lâm, Hà Nội",cho-thue-shophouse-nha-pho-thuong-mai
"Cho thuê shop TMDV Vinhomes miễn phí 18 tháng tiền thuê, hỗ trợ 50% tiền hoàn thiện. LH 0901 398 ***",44 triệu/tháng,445 m²,"Quận 9, Hồ Chí Minh",cho-thue-shophouse-nha-pho-thuong-mai
Cho thuê shophouse Lakeview City DT 5x20m 4PN 5WC nhà hoàn thiện có thang máy giá 37triệu thật 100%,37 triệu/tháng,100 m²,"Quận 2, Hồ Chí Minh",cho-thue-shophouse-nha-pho-thuong-mai
"Cho thuê tầng trệt DT 7x20m giá 10 triệu, full nội thất giá 26 tr, full nội thất cao cấp giá 35 tr",26 triệu/tháng,140 m²,"Quận 2, Hồ Chí Minh",cho-thue-shophouse-nha-pho-thuong-mai
"Cho thuê tầng trệt DT 7x20m giá 10 triệu, full nội thất giá 26 tr, full nội thất cao cấp giá 35 tr",26 triệu/tháng,140 m²,"Quận 2, Hồ Chí Minh",cho-thue-shophouse-nha-pho-thuong-mai
"Chính chủ cho thuê Shophouse tại Starlake mặt đường 40m diện tích 154m2, 5 tầng giá thuê 50tr/tháng",50 triệu/tháng,154 m²,"Tây Hồ, Hà Nội",cho-thue-shophouse-nha-pho-thuong-mai
"Cho thuê shophouse MP Nguyễn Chánh, DT 120m2, XD 5T, thông sàn, có thang máy. Giá chỉ 90 triệu",90 triệu/tháng,120 m²,"Cầu Giấy, Hà Nội",cho-thue-shophouse-nha-pho-thuong-mai
"Cho thuê Shophouse Sunshine Golden River, Quận Tây Hồ, Hà Nội giá siêu rẻ 25 triệu/tháng 0985 172 ***",25 triệu/tháng,100 m²,"Tây Hồ, Hà Nội",cho-thue-shophouse-nha-pho-thuong-mai
Cty cho thuê shophouse tầng trệt lô B 55m2 Him Lam Phú An LH trực tiếp PKD Him Lam Land 0906 388 ***,"12,1 triệu/tháng",55 m²,"Quận 9, Hồ Chí Minh",cho-thue-shophouse-nha-pho-thuong-mai
"Cho thuê mặt bằng tại Ngã Tư Sở, tòa 39 Nguyễn Trãi, diện tích 70m2, giá 35 triệu/tháng, 15/12 vào",35 triệu/tháng,70 m²,"Thanh Xuân, Hà Nội",cho-thue-shophouse-nha-pho-thuong-mai
"Cho thuê shop Happy Valley - Phú Mỹ Hưng, mặt tiền đường Nguyễn Văn Linh",74 triệu/tháng,222 m²,"Quận 7, Hồ Chí Minh",cho-thue-shophouse-nha-pho-thuong-mai
"Chính chủ cho thuê shophouse vip tại Golden Armor Nam Cao. DT: 163m2; MT 9,5m. Giá thuê: 150tr/th",150 triệu/tháng,163 m²,"Ba Đình, Hà Nội",cho-thue-shophouse-nha-pho-thuong-mai
"Shop mặt sảnh đông đúc nhất Vinhomes, 26m2 cho thuê 18 triệu",18 triệu/tháng,26 m²,"Quận 9, Hồ Chí Minh",cho-thue-shophouse-nha-pho-thuong-mai
Cho thuê nhà phố hoàn thiện tại Vinhomes Quận 9 chỉ với 25 triệu,25 triệu/tháng,84 m²,"Quận 9, Hồ Chí Minh",cho-thue-shophouse-nha-pho-thuong-mai
Cho thuê nhà phố Vinhomes quận 9 đối diện trường học chỉ 25 triệu,25 triệu/tháng,176 m²,"Quận 9, Hồ Chí Minh",cho-thue-shophouse-nha-pho-thuong-mai
"Chính chủ cho thuê Lakeview Thủ Thiêm căn A2 mặt tiền Nguyễn Cơ Thạch, Q2, 10x22m, 0938 140 ***",Giá thỏa thuận,220 m²,"Quận 2, Hồ Chí Minh",cho-thue-shophouse-nha-pho-thuong-mai
Cho thuê tầng trệt nhà mặt tiền đường Nguyễn Thị Nhung - khu vực sầm uất nhất khu đô thị Vạn Phúc,13 triệu/tháng,100 m²,"Thủ Đức, Hồ Chí Minh",cho-thue-shophouse-nha-pho-thuong-mai
Cho thuê mặt bằng kinh doanh tầng toà nhà 17 T8 Trung Hoà 415m2 siêu đẹp,Giá thỏa thuận,415 m²,"Cầu Giấy, Hà Nội",cho-thue-shophouse-nha-pho-thuong-mai
Cho thuê shophouse 3 tầng full nội thất cao cấp khu đô thị Mỹ Gia gói 8,15 triệu/tháng,100 m²,"Nha Trang, Khánh Hòa",cho-thue-shophouse-nha-pho-thuong-mai
"Tòa nhà mới toanh cần cho thuê tầng 1, tầng 2, tầng 3 ngay TTTM Chợ Mơ, Bạch Mai DT từ 100 - 1500m2",Giá thỏa thuận,1.000 m²,"Hai Bà Trưng, Hà Nội",cho-thue-shophouse-nha-pho-thuong-mai
Cho thuê shophouse kinh doanh view hồ bơi,12 triệu/tháng,84 m²,"Bình Tân, Hồ Chí Minh",cho-thue-shophouse-nha-pho-thuong-mai
"Siêu hót cho thuê giá siêu rẻ bậc nhất tại Đống Đa, Tầng 1, 2,3 Mipec Tower, Tây Sơn từ 200-5000m2",226 nghìn/m²,2.000 m²,"Đống Đa, Hà Nội",cho-thue-shophouse-nha-pho-thuong-mai
"Cho thuê mặt bằng kinh doanh, sàn thương mại CC The Zei Plaza - trung tâm Mỹ Đình",486 nghìn/m²,320 m²,"Nam Từ Liêm, Hà Nội",cho-thue-shophouse-nha-pho-thuong-mai
"Cho thuê 1400m2 làm gym tại tòa nhà Ecolfie Capital, Nam Từ Liêm",Giá thỏa thuận,1.400 m²,"Nam Từ Liêm, Hà Nội",cho-thue-shophouse-nha-pho-thuong-mai
Cho thuê shophouse tầng thương mại tại Vinhomes Golden River Ba son,46 triệu/tháng,50 m²,"Quận 1, Hồ Chí Minh",cho-thue-shophouse-nha-pho-thuong-mai
"Cặp căn Saritown mặt tiền 12 m cho thuê, giá tốt nhất tháng 1/2024",196 triệu/tháng,1.200 m²,"Quận 2, Hồ Chí Minh",cho-thue-shophouse-nha-pho-thuong-mai
Chính chủ cần cho thuê shophouse 3 tầng mặt đường Lê Quang Đạo. Số chính chủ 0983 096 ***,35 triệu/tháng,146 m²,"Hà Đông, Hà Nội",cho-thue-shophouse-nha-pho-thuong-mai
Cho thuê căn shop 60m2 tầng 1 sảnh CT1B chung cư Homeland HN,11 triệu/tháng,60 m²,"Long Biên, Hà Nội",cho-thue-shophouse-nha-pho-thuong-mai
"Cho thuê nhà phố DT 7x20m tầng trệt 10 triệu, DT 8x20m hoàn thiện giá 28 triệu thật 100% 0907 110 ***",28 triệu/tháng,160 m²,"Quận 2, Hồ Chí Minh",cho-thue-shophouse-nha-pho-thuong-mai
"Cho thuê shophouse Sala Sarimi, Sarina - 230m2 - 3 tầng - 85 triệu/tháng - hoàn thiện full",87 triệu/tháng,"76,36 m²","Quận 2, Hồ Chí Minh",cho-thue-shophouse-nha-pho-thuong-mai
"Cần cho thuê shophouse phù hợp làm văn phòng công ty, giá chỉ 3,5 triệu/tháng","3,5 triệu/tháng",30 m²,"Quận 9, Hồ Chí Minh",cho-thue-shophouse-nha-pho-thuong-mai
"Cho thuê nhà nguyên căn 3 tầng, 3 phòng ngủ ở trục shophouse FPT, nhà đẹp, thoáng mát",11 triệu/tháng,216 m²,"Ngũ Hành Sơn, Đà Nẵng",cho-thue-shophouse-nha-pho-thuong-mai
"Cho thuê nhà nguyên căn 2 tầng, 2 phòng ngủ mặt tiền trục shophouse FPT, nhà đẹp",9 triệu/tháng,90 m²,"Ngũ Hành Sơn, Đà Nẵng",cho-thue-shophouse-nha-pho-thuong-mai
"Cho thuê shop Hưng Vượng 2 - Phú Mỹ Hưng, căn góc, đường Số 6",80 triệu/tháng,323 m²,"Quận 7, Hồ Chí Minh",cho-thue-shophouse-nha-pho-thuong-mai
Cho thuê shop Mỹ Viên - Phú Mỹ Hưng,30 triệu/tháng,150 m²,"Quận 7, Hồ Chí Minh",cho-thue-shophouse-nha-pho-thuong-mai
"Cho thuê mặt bằng kinh doanh, văn phòng",14 triệu/tháng,165 m²,"Vũng Tàu, Bà Rịa Vũng Tàu",cho-thue-shophouse-nha-pho-thuong-mai
Cho thuê shophouse thương mại Udic Westlake 3 tầng mặt Võ Chí Công đối diện TTTM Lotte,75 triệu/tháng,325 m²,"Tây Hồ, Hà Nội",cho-thue-shophouse-nha-pho-thuong-mai
"Cho thuê nhà 4 tầng K - Town, căn góc 3 mặt tiền, view quảng trường, miễn phí 2 năm tiền thuê nhà",7 triệu/tháng,64 m²,"Văn Giang, Hưng Yên",cho-thue-shophouse-nha-pho-thuong-mai
Cho thuê sàn thương mại tầng 1 DT 195m2 dự án Roman Plaza giá 90tr/tháng 0989 996 ***,90 triệu/tháng,110 m²,"Nam Từ Liêm, Hà Nội",cho-thue-shophouse-nha-pho-thuong-mai
"Cho thuê rẻ gấp 1.800m2 tầng 1&2 làm mẫu giáo, nhà trẻ ở Lê Văn Lương, TX",300 nghìn/m²,1.800 m²,"Thanh Xuân, Hà Nội",cho-thue-shophouse-nha-pho-thuong-mai
Cho thuê nhà phố Lakeview City full nội thất Địa Trung Hải DT 5x20m 1trệt 3lầu hướng đông thật 100%,38 triệu/tháng,100 m²,"Quận 2, Hồ Chí Minh",cho-thue-shophouse-nha-pho-thuong-mai
"Cho thuê nhà Shophouse 2 tầng, 2 phòng ngủ, 2WC giá rẻ trong khu đô thị FPT",8 triệu/tháng,90 m²,"Ngũ Hành Sơn, Đà Nẵng",cho-thue-shophouse-nha-pho-thuong-mai
Cho thuê shop Sunrise City North,21 triệu/tháng,69 m²,"Quận 7, Hồ Chí Minh",cho-thue-shophouse-nha-pho-thuong-mai
"BQL dự án The Zei cho thuê chân đế chung cư cao cấp Mỹ Đình làm quán Cafe, Bánh Ngọt",Giá thỏa thuận,300 m²,"Nam Từ Liêm, Hà Nội",cho-thue-shophouse-nha-pho-thuong-mai
"Cho thuê tầng 1 + 2 shophouse Moncity, ngõ 2 Hàm Nghi, Mỹ Đình. LH: 0985 643 ***",30 triệu/tháng,240 m²,"Nam Từ Liêm, Hà Nội",cho-thue-shophouse-nha-pho-thuong-mai
Danh sách shophouse - biệt thự cho thuê KĐT Starlake Tây Hồ Tây - Hà Nội - K3-K5-K7-H6-H7-H10-H11,150 triệu/tháng,353 m²,"Tây Hồ, Hà Nội",cho-thue-shophouse-nha-pho-thuong-mai
"Độc quyền cho thuê shophouse Eco Green Quận 7, diện tích từ 200 - 300m2, giá từ 50 triệu/tháng",50 triệu/tháng,250 m²,"Quận 7, Hồ Chí Minh",cho-thue-shophouse-nha-pho-thuong-mai
Từ 2 triệu/thuê shophouse miễn phí 24 tháng/hoàn thiện tầng 1/tặng voucher 30 triệu/ Grand World HN,Giá thỏa thuận,60 m²,"Văn Giang, Hưng Yên",cho-thue-shophouse-nha-pho-thuong-mai
"Cho thuê lẻ tầng 3,4 căn shophouse khu The Manor, The Matrix One Mễ Trì DT sử dụng 160m2 giá 30tr",30 triệu/tháng,160 m²,"Nam Từ Liêm, Hà Nội",cho-thue-shophouse-nha-pho-thuong-mai
Cho thuê Shophouse Nguyễn Cơ Thạch Sala giá siêu hấp dẫn chỉ 173 triệu/tháng,173 triệu/tháng,225 m²,"Quận 2, Hồ Chí Minh",cho-thue-shophouse-nha-pho-thuong-mai
"Cho thuê Shophouse Nguyễn Cơ Thạch Sala giá tốt nhất thị trường, chỉ 165 triệu/tháng",165 triệu/tháng,670 m²,"Quận 2, Hồ Chí Minh",cho-thue-shophouse-nha-pho-thuong-mai
"Cho thuê shophouse căn góc 4 mặt tiền, góc Nguyễn Văn Linh, đã hoàn thiện full NT, 505m2,95tr/tháng",95 triệu/tháng,505 m²,"Quận 7, Hồ Chí Minh",cho-thue-shophouse-nha-pho-thuong-mai
Cho thuê mặt bằng tầng 2 giá cực net tại Vinhomes Marina,22 triệu/tháng,180 m²,"Lê Chân, Hải Phòng",cho-thue-shophouse-nha-pho-thuong-mai
"Cho thuê shophouse khu căn hộ Eco Green, Nguyễn Văn Linh, Quận 7",55 triệu/tháng,315 m²,"Quận 7, Hồ Chí Minh",cho-thue-shophouse-nha-pho-thuong-mai
"Cho thuê nhiều ưu đãi thương mại, văn phòng hỗn hợp dự án Mipec 299 Tây Sơn. LH 0906 218 ***",200 triệu/tháng,1.000 m²,"Đống Đa, Hà Nội",cho-thue-shophouse-nha-pho-thuong-mai
"Cho thuê shop thương mại, chân đế dự án Capella số 2 Phạm Ngọc Thạch. LH 0906 218 ***",100 triệu/tháng,3.000 m²,"Đống Đa, Hà Nội",cho-thue-shophouse-nha-pho-thuong-mai
"Cần cho thuê diện tích gym trung tâm thương mại 5 sao quận Cầu Giấy, bàn giao ngay. 0906 218 ***",385 triệu/tháng,1.500 m²,"Cầu Giấy, Hà Nội",cho-thue-shophouse-nha-pho-thuong-mai
"Cho thuê mặt bằng riêng biệt tầng 2 Sky Park, liên hệ 0906 218 ***","283,3 nghìn/m²",1.800 m²,"Cầu Giấy, Hà Nội",cho-thue-shophouse-nha-pho-thuong-mai
"Cho thuê diện tích thương mại trung tâm thương mại BRG 16 Láng Hạ, chính sách ưu đãi, LH 0906 218 ***",80 triệu/tháng,100 m²,"Ba Đình, Hà Nội",cho-thue-shophouse-nha-pho-thuong-mai
Cho thuê diện tích thương mại tòa nhà Geleximco Southern Star 897 Giải Phóng. LH 0906 218 ***,99 triệu/tháng,3.000 m²,"Hoàng Mai, Hà Nội",cho-thue-shophouse-nha-pho-thuong-mai
Cho thuê thương mại và văn phòng giá ưu đãi nhất dự án Sun Grand Thụy Khuê. LH 0906 218 ***,100 triệu/tháng,500 m²,"Tây Hồ, Hà Nội",cho-thue-shophouse-nha-pho-thuong-mai
Cho thuê shophouse chân đế tại BRG 25 Lê Văn Lương. LH 0906 218 ***,130 triệu/tháng,240 m²,"Thanh Xuân, Hà Nội",cho-thue-shophouse-nha-pho-thuong-mai
Cho thuê biệt thự - shophouse Vinhomes Ocean Park (giá tốt nhất),13 triệu/tháng,"67,5 m²","Gia Lâm, Hà Nội",cho-thue-shophouse-nha-pho-thuong-mai
"Shophouse Masteri Thảo Điền - DT 153m2 - khu vực đông đúc, kinh doanh thoải mái. Giá thuê 55tr/th",55 triệu/tháng,153 m²,"Quận 2, Hồ Chí Minh",cho-thue-shophouse-nha-pho-thuong-mai
"Cho thuê shophouse 8X Plus Trường Chinh, 170m2, 1 trệt, 1 lầu, giá 15tr/th, LH: 0903 318 *** Minh",15 triệu/tháng,170 m²,"Quận 12, Hồ Chí Minh",cho-thue-shophouse-nha-pho-thuong-mai
"Cho thuê shophouse 8x plus Trường Chinh, 120m2, 1 trệt, 1 lầu, giá 10tr/th, LH: 0903 318 *** Minh",10 triệu/tháng,120 m²,"Quận 12, Hồ Chí Minh",cho-thue-shophouse-nha-pho-thuong-mai
Cho thuê Shophouse liền sảnh phân khu cao cấp Masteri kinh doanh gì cũng được. LH 0986 939 ***,50 triệu/tháng,43 m²,"Nam Từ Liêm, Hà Nội",cho-thue-shophouse-nha-pho-thuong-mai
Cho thuê shophouse chân đế mặt sảnh căn hộ toà Masteri,75 triệu/tháng,75 m²,"Nam Từ Liêm, Hà Nội",cho-thue-shophouse-nha-pho-thuong-mai
Cần cho thuê nhà phố đối diện vp Công chứng TP mới đường huỳnh Thúc Kháng nhánh.,18 triệu/tháng,110 m²,"Thủ Dầu Một, Bình Dương",cho-thue-shophouse-nha-pho-thuong-mai
Cho thuê shophouse KDC Sunrise Riverside - 70m2 - khu sầm uất - giá thuê: 28tr/ tháng,18 triệu/tháng,70 m²,"Nhà Bè, Hồ Chí Minh",cho-thue-shophouse-nha-pho-thuong-mai
Cần cho thuê nhà phố đối diện vp Công chứng TP mới đường huỳnh Thúc Kháng nhánh.,18 triệu/tháng,110 m²,"Thủ Dầu Một, Bình Dương",cho-thue-shophouse-nha-pho-thuong-mai
Lakeview City nhà phố full nội thất đẹp giá tốt nhất 25tr shophouse có thang máy 29tr LH 0902 872 ***,25 triệu/tháng,100 m²,"Quận 2, Hồ Chí Minh",cho-thue-shophouse-nha-pho-thuong-mai
Nhà phố view công viên nội thất mới đẹp KĐT Lakeview City 6x20m 1 trệt 3 lầu giá 38tr Lh 0902 872 ***,38 triệu/tháng,120 m²,"Quận 2, Hồ Chí Minh",cho-thue-shophouse-nha-pho-thuong-mai
"Cho thuê shophouse Sala Sarimi, Sarina - 230m2 - 3 tầng - 87 triệu/tháng - hoàn thiện full",87 triệu/tháng,"76,36 m²","Quận 2, Hồ Chí Minh",cho-thue-shophouse-nha-pho-thuong-mai
Cho thuê 5 căn shophouse trục đường Mê Linh 33m đi Bà Nà Hill giá rẻ đã hoàn thiện đẹp,10 triệu/tháng,126 m²,"Liên Chiểu, Đà Nẵng",cho-thue-shophouse-nha-pho-thuong-mai
"Quỹ căn shophouse Swanlake, Landmark Ecopark cho thuê vị trí đẹp",30 triệu/tháng,80 m²,"Văn Giang, Hưng Yên",cho-thue-shophouse-nha-pho-thuong-mai
"Cho thuê mini hotel 17PN mặt tiền chợ đêm Sonasea, 2 mặt tiền kinh doanh cực sầm uất tại Bãi Trường",35 triệu/tháng,500 m²,"Phú Quốc, Kiên Giang",cho-thue-shophouse-nha-pho-thuong-mai
"Cần cho thuê căn shophouse thuận tiện kinh doanh văn phòng diện tích 100m2, 1 trệt, 2 lầu, giá 14tr",14 triệu/tháng,100 m²,"Quận 9, Hồ Chí Minh",cho-thue-shophouse-nha-pho-thuong-mai
"Cho thuê shop TMDV kinh doanh, hỗ trợ kinh doanh 10 triệu/tháng, phục vụ 200.000 cư dân",Giá thỏa thuận,"450,9 m²","Quận 9, Hồ Chí Minh",cho-thue-shophouse-nha-pho-thuong-mai
