Title,Price,Area,Location,type
Cho thuê xưởng trong khu công nghiệp khu vực - Biên Hòa - Đồng Nai 10.000m2,62 nghìn/m²,10.000 m²,"Biên Hòa, Đồng Nai",cho-thue-kho-nha-xuong-dat
Cho thuê nhà xưởng và đất tại khu công nghiệp Cầu Cảng Phước Đông - Long An,"80,34 nghìn/m²",19.200 m²,"Cần Đước, Long An",cho-thue-kho-nha-xuong-dat
Cho thuê kho tại 267 Quang Trung - Hà Đông (ngay gần bưu điện Hà Đông - Hà Nội),115 nghìn/m²,350 m²,"Hà Đông, Hà Nội",cho-thue-kho-nha-xuong-dat
"Cho thuê 1560m2 mặt tiền Bến Lức, Long An",25 triệu/tháng,1.560 m²,"Bến Lức, Long An",cho-thue-kho-nha-xuong-dat
Cho thuê đất mặt tiền Võ Văn Kiệt Phường 1 Quận 5 LH 0907 894 ***,450 triệu/tháng,"1.236,3 m²","Quận 5, Hồ Chí Minh",cho-thue-kho-nha-xuong-dat
"Cho thuê hơn 3000m2 đất trống làm kho, xưởng, bãi đậu xe, giá 20k/m2/tháng",60 triệu/tháng,3.000 m²,"Quận 9, Hồ Chí Minh",cho-thue-kho-nha-xuong-dat
Cho thuê kho mặt tiền đường Lương Đình Của Phường Bình An Quận 2 giá 80 triệu 0932 069 ***,80 triệu/tháng,700 m²,"Quận 2, Hồ Chí Minh",cho-thue-kho-nha-xuong-dat
Cho thuê 955m2 đất mặt tiền Song Hành Phường Thảo Điền Quận 2 giá 99 triệu /m2,99 triệu/tháng,955 m²,"Quận 2, Hồ Chí Minh",cho-thue-kho-nha-xuong-dat
Cho thuê xưởng sản xuất 850 m2 tại Kiến An có nghiệm thu phòng cháy chữa cháy,60 nghìn/m²,850 m²,"Kiến An, Hải Phòng",cho-thue-kho-nha-xuong-dat
"Cho thuê kho 250m2 tại khu Mỹ Đình, ôtô tải vào được. 15 triệu",15 triệu/tháng,250 m²,"Nam Từ Liêm, Hà Nội",cho-thue-kho-nha-xuong-dat
CHo thuê 800m2 đất ngang 20m mặt tiền Quốc Lộ 14B,5 triệu/tháng,800 m²,"Hòa Vang, Đà Nẵng",cho-thue-kho-nha-xuong-dat
"Cho thuê 3200 m2 kho xưởng (có thể chia nhỏ) tại Mông Hóa, TP Hòa Bình, tỉnh Hòa Bình",50 nghìn/m²,3.200 m²,"Hòa Bình, Hòa Bình",cho-thue-kho-nha-xuong-dat
"Cho thuê kho khu CN Hòa Khánh, 3000m2, có PCCC",100 triệu/tháng,3.000 m²,"Liên Chiểu, Đà Nẵng",cho-thue-kho-nha-xuong-dat
Cho thuê xưởng giá cực rẻ tại KCN Bàu Xéo 5000m2 - 30.000m2,77 nghìn/m²,18.000 m²,"Trảng Bom, Đồng Nai",cho-thue-kho-nha-xuong-dat
"Cho thuê kho Q7 DT 480m2 đẹp - chuẩn tiêu chuẩn PCCC, trần cao 8m có sẵn văn phòng","52,8 triệu/tháng",480 m²,"Quận 7, Hồ Chí Minh",cho-thue-kho-nha-xuong-dat
"Cho thuê kho xưởng MT Âu Cơ, DT: 720m2, giá: 100k/m2, Tân Phú",72 triệu/tháng,720 m²,"Tân Phú, Hồ Chí Minh",cho-thue-kho-nha-xuong-dat
"Cho thuê kho mặt tiền Quốc lộc 1A, Hòa Châu, DT 2000m2",150 triệu/tháng,2.000 m²,"Hòa Vang, Đà Nẵng",cho-thue-kho-nha-xuong-dat
"Cho thuê cặp đất đường An Thượng 29, sát biển cực đẹp",15 triệu/tháng,162 m²,"Ngũ Hành Sơn, Đà Nẵng",cho-thue-kho-nha-xuong-dat
Cho thuê nhà xưởng 3000m2 90tr/tháng Dĩ An,90 triệu/tháng,3.000 m²,"Dĩ An, Bình Dương",cho-thue-kho-nha-xuong-dat
Cho thuê nhà xưởng KCN Sóng Thần 3 DT 12000m2,90 nghìn/m²,12.000 m²,"Thủ Dầu Một, Bình Dương",cho-thue-kho-nha-xuong-dat
"Cần cho thuê gấp 220.000m2(22 ha) đất xã Bình Châu, Xuyên Mộc, BR - VT, đường lớn xe container chạy",Giá thỏa thuận,220.000 m²,"Xuyên Mộc, Bà Rịa Vũng Tàu",cho-thue-kho-nha-xuong-dat
"Cần cho thuê 58.000 m2 mặt tiền đường QL51 170x240, cách SB Long Thành 7km, cảng Cái Mép 15km",Giá thỏa thuận,58.000 m²,"Long Thành, Đồng Nai",cho-thue-kho-nha-xuong-dat
"Cho thuê nhà xưởng từ 300m2- 3000m2 tại cụm CN Thiện Tân, Vĩnh Cửu, Đồng Nai",Giá thỏa thuận,3.000 m²,"Vĩnh Cửu, Đồng Nai",cho-thue-kho-nha-xuong-dat
"Cho thuê xưởng 1700 m2 gần cảng, full giấy tờ",100 triệu/tháng,1.700 m²,"Hải An, Hải Phòng",cho-thue-kho-nha-xuong-dat
Cho thuê nhà xưởng trong KCN tại TP mới Bình Dương 1000m2 - 0918 533 ***,Giá thỏa thuận,1.400 m²,"Thủ Dầu Một, Bình Dương",cho-thue-kho-nha-xuong-dat
Cho thuê đất trong khu công nghiệp Chơn Thành 0918 533 ***,Giá thỏa thuận,360.000 m²,"Chơn Thành, Bình Phước",cho-thue-kho-nha-xuong-dat
"Cần cho thuê kho & bãi trên đường Đào Trí, P. Phú Thuận, Quận 7. DT 1000m2, giá chỉ 50 tr/tháng",50 triệu/tháng,1.000 m²,"Quận 7, Hồ Chí Minh",cho-thue-kho-nha-xuong-dat
"Cho thuê đất làm nhà xưởng, sân bóng, sân tennis. Diện tích 2000 - 5000m2",30 triệu/tháng,4.850 m²,"Quế Võ, Bắc Ninh",cho-thue-kho-nha-xuong-dat
Cho thuê nhà xưởng kết hợp văn phòng (Diện tích: 500m2; mặt tiền QL20),18 triệu/tháng,500 m²,"Đức Trọng, Lâm Đồng",cho-thue-kho-nha-xuong-dat
"Kho 630m2, gần cảng Khuyến Lương, 80k/m2 có VAT",80 nghìn/m²,630 m²,"Hoàng Mai, Hà Nội",cho-thue-kho-nha-xuong-dat
"Kho, xưởng SX 580m2 mới xây dựng, ngay Aeon Tân Phú",42 triệu/tháng,580 m²,"Tân Phú, Hồ Chí Minh",cho-thue-kho-nha-xuong-dat
"Cho thuê nhà xưởng trong KCN Bàu Bàng, Bình Dương",Giá thỏa thuận,3.510 m²,"Bàu Bàng, Bình Dương",cho-thue-kho-nha-xuong-dat
"Chính chủ cần cho thuê kho khung thép mái tôn 500m2 tại thôn Cầu, xã Cự Khê, Thanh Oai. 50 nghìn/m2",25 triệu/tháng,500 m²,"Thanh Oai, Hà Nội",cho-thue-kho-nha-xuong-dat
"Cho thuê kho 4.200m2 trong khu công nghiệp Vsip 2, Bình Dương",Giá thỏa thuận,4.200 m²,"Thủ Dầu Một, Bình Dương",cho-thue-kho-nha-xuong-dat
Cho thuê nhà xưởng trong KCN Bàu Bàng 2.000 - 50.000m2,Giá thỏa thuận,20.000 m²,"Bàu Bàng, Bình Dương",cho-thue-kho-nha-xuong-dat
Cho thuê nhà xưởng KCN Đồng An 2 - Bình Dương,"106,85 nghìn/m²",3.024 m²,"Thủ Dầu Một, Bình Dương",cho-thue-kho-nha-xuong-dat
Cho thuê nhà xưởng Tân Uyên - 15000m2 - giá rẻ,Giá thỏa thuận,15.000 m²,"Tân Uyên, Bình Dương",cho-thue-kho-nha-xuong-dat
Cho thuê nhà xưởng trong KCN tại TP Mới Bình Dương - 2840m2,Giá thỏa thuận,2.840 m²,"Thủ Dầu Một, Bình Dương",cho-thue-kho-nha-xuong-dat
"Cho thuê nhà xưởng trong KCN Bàu Bàng - 4500m2, 9000m2, 18.000m2",Giá thỏa thuận,18.000 m²,"Bàu Bàng, Bình Dương",cho-thue-kho-nha-xuong-dat
"Cho thuê kho trong khu công nghiệp Vsip 2 Bình Dương 2500, 3500, 6000, 15.000m2",Giá thỏa thuận,15.000 m²,"Thủ Dầu Một, Bình Dương",cho-thue-kho-nha-xuong-dat
"X610. Cho thuê kho xưởng khu vực Hải An 1500m2 có điện 3 pha, PCCC cơ bản",45 nghìn/m²,1.500 m²,"Hải An, Hải Phòng",cho-thue-kho-nha-xuong-dat
Trường kho xưởng Hưng Yên - Cho thuê 2000m2 đến 30000m2 xưởng,80 nghìn/m²,2.000 m²,"Mỹ Hào, Hưng Yên",cho-thue-kho-nha-xuong-dat
"Kho, xưởng SX 250m2 mới xây dựng sàn gạch men, đường Tân Kỳ Tân Quý",22 triệu/tháng,250 m²,"Bình Tân, Hồ Chí Minh",cho-thue-kho-nha-xuong-dat
"Cho thuê kho trong khu công nghiệp Vsip 2, tỉnh Bình Dương - 10.000m2",Giá thỏa thuận,10.000 m²,"Thủ Dầu Một, Bình Dương",cho-thue-kho-nha-xuong-dat
"Cho thuê kho, xưởng mới 100% khu CN Tiên Sơn, Hoàn Sơn DT 500m2 đến 150.000m2 giá cạnh tranh",60 nghìn/m²,10.000 m²,"Tiên Du, Bắc Ninh",cho-thue-kho-nha-xuong-dat
"Cho thuê kho, xưởng mới 100% khu CN Văn Giang, Hưng Yên, DT 1000m2, 3000m2, 5000m2, 7000m2, 10000m2",Giá thỏa thuận,1.000 m²,"Văn Giang, Hưng Yên",cho-thue-kho-nha-xuong-dat
"Cho thuê kho, xưởng, khu CN Tiên Du, DT 300m2, 600m2, 700m2, 800m2, 1000m2, 2000m2 có văn phòng",40 nghìn/m²,600 m²,"Tiên Du, Bắc Ninh",cho-thue-kho-nha-xuong-dat
Cho thuê kho xưởng mới rẻ ở Yên Mỹ Hưng Yên DT 1000m2-2000-3000-4000-5000m2 8000m2-10.000-20.000m2,45 nghìn/m²,1.000 m²,"Yên Mỹ, Hưng Yên",cho-thue-kho-nha-xuong-dat
"Cho thuê kho, xưởng mới 100% khu CN Mỹ Hào, DT 1000m,2000m,3000m,5000m, 7000m, 10.000m2 - 15.000m2",Giá thỏa thuận,5.000 m²,"Mỹ Hào, Hưng Yên",cho-thue-kho-nha-xuong-dat
"Vị trí đẹp! Cho thuê 2 lô đất gần 800m2 đường Số 1, ngay chợ Tân Mỹ",120 triệu/tháng,800 m²,"Quận 7, Hồ Chí Minh",cho-thue-kho-nha-xuong-dat
Cho thuê MB kinh doanh nằm ngay ngã tư Nguyễn Văn Linh & Nguyễn Hữu Thọ - hơn 600m2 - 200tr/tháng,200 triệu/tháng,600 m²,"Quận 7, Hồ Chí Minh",cho-thue-kho-nha-xuong-dat
Cho thuê gấp kho và bãi Quận 7 - MT đường Đào Trí - P Phú Thuận - TDT 1000m2 - đường cont 24/24,50 triệu/tháng,1.000 m²,"Quận 7, Hồ Chí Minh",cho-thue-kho-nha-xuong-dat
"Cho thuê đất mặt tiền Lê Quang Đạo diện tích 200m2, 20 triệu",20 triệu/tháng,200 m²,"Ngũ Hành Sơn, Đà Nẵng",cho-thue-kho-nha-xuong-dat
Cho thuê 600m2 mặt bằng Nguyễn Văn Thoại - Mở kinh doanh,80 triệu/tháng,600 m²,"Sơn Trà, Đà Nẵng",cho-thue-kho-nha-xuong-dat
"Cho thuê đất 2MT Lê Quang Đạo - Đỗ Bá, diện tích 300m2, giá 50 triệu/tháng",50 triệu/tháng,300 m²,"Ngũ Hành Sơn, Đà Nẵng",cho-thue-kho-nha-xuong-dat
Cho thuê 445m2 MT đường 2/9 ngang 19m có thể xây dựng nhà kiên cố,20 triệu/tháng,445 m²,"Vũng Tàu, Bà Rịa Vũng Tàu",cho-thue-kho-nha-xuong-dat
"Cho thuê lô đất 250m2 mặt tiền đường Xô Viết Nghệ Tĩnh, Đà Nẵng",25 triệu/tháng,250 m²,"Hải Châu, Đà Nẵng",cho-thue-kho-nha-xuong-dat
"Cho thuê nhà kho cấp 4 mặt tiền Nguyễn Hữu Thọ, diện tích: 250m2, ngang 10m",25 triệu/tháng,250 m²,"Cẩm Lệ, Đà Nẵng",cho-thue-kho-nha-xuong-dat
"Cho thuê kho mới xây KCN Hòa Khánh diện tích 2200m2 đầy đủ PCCC, giá tốt",55 nghìn/m²,2.200 m²,"Liên Chiểu, Đà Nẵng",cho-thue-kho-nha-xuong-dat
Cần sang lại maywj bằng kinh doanh quán bida tại trung tâm mỹ phước 3 bến cát bình dương,11 triệu/tháng,300 m²,"Bến Cát, Bình Dương",cho-thue-kho-nha-xuong-dat
Hiện cho thuê 250m2 đất mặt phố Quận Ba Đình - Khu Linh Lang - Mọi mô hình giá 35 triệu,35 triệu/tháng,250 m²,"Ba Đình, Hà Nội",cho-thue-kho-nha-xuong-dat
"Cho thuê kho xưởng Giải Phóng, 3pha xe tải lớn đỗ cửa, trần cao, diện tích 50, 100, 200, 300, 500m2",65 nghìn/m²,300 m²,"Hoàng Mai, Hà Nội",cho-thue-kho-nha-xuong-dat
Cho thuê mặt bằng kinh doanh 14000 rộng 80x180m2 có 1400m2 thổ cư,50 triệu/tháng,14.000 m²,"Bến Cát, Bình Dương",cho-thue-kho-nha-xuong-dat
"Cho thuê kho, bãi, sẵn văn phòng mặt đường 5, đảm bảo thấp hơn giá thị trường. 0936 886 ***",Giá thỏa thuận,2.000 m²,"Hồng Bàng, Hải Phòng",cho-thue-kho-nha-xuong-dat
"Mặt đường - 458D Mai Chí Thọ, Q2 - kho - phòng sạch - showroom - cho thuê",70 triệu/tháng,900 m²,"Quận 2, Hồ Chí Minh",cho-thue-kho-nha-xuong-dat
"Cho thuê 3 lô đất đẹp, ưu đãi tại thành phố Hải Phòng. LH 0906 218 ***",Giá thỏa thuận,79.000 m²,"Hải An, Hải Phòng",cho-thue-kho-nha-xuong-dat
"Cho thuê nhà máy - cơ hội đầu tư tại Phú Xuyên, Hà Nội. LH 0906 218 ***",500 triệu/tháng,28.300 m²,"Phú Xuyên, Hà Nội",cho-thue-kho-nha-xuong-dat
"Cho thuê 1500m2 kho chứa hàng tại Lai Xá, Hoài Đức. LH 0906 218 ***",Giá thỏa thuận,1.500 m²,"Hoài Đức, Hà Nội",cho-thue-kho-nha-xuong-dat
Giảm giá cho thuê kho góc 19x17 kế Đại Lộ Võ Nguyên Giáp khu Xây Dựng có sẵn cửa cuốn và điện 3 pha,20 triệu/tháng,323 m²,"Cái Răng, Cần Thơ",cho-thue-kho-nha-xuong-dat
Cho thuê xưởng Củ Chi DT 4500m giá 140 tr,140 triệu/tháng,4.500 m²,"Củ Chi, Hồ Chí Minh",cho-thue-kho-nha-xuong-dat
Cho thuê kho chứa hàng hóa + quản lý hàng hóa,70 triệu/tháng,1.000 m²,"Đức Hòa, Long An",cho-thue-kho-nha-xuong-dat
Cần cho thuê xưởng 1200m2 tại thuận giao thuận an bình dương thích hợp nhiều nghành nghề,50 triệu/tháng,1.200 m²,"Thuận An, Bình Dương",cho-thue-kho-nha-xuong-dat
"Cho thuê mặt tiền 1154 QL1A, DT: 1.000 m2, nhà xưởng mới 100%, có PCCC, đường xe cont 24/24",75 triệu/tháng,1.000 m²,"Bình Tân, Hồ Chí Minh",cho-thue-kho-nha-xuong-dat
Cho thuê 1 số kho cụm CN Diên Phú + Đắc Lộc + QL 1A và kho Kim Môn Võ Nguyên Giáp,40 nghìn/m²,1.000 m²,"Diên Khánh, Khánh Hòa",cho-thue-kho-nha-xuong-dat
Cho thuê xưởng MT QL 1A cái bè Tiền Giang 3300m2,165 triệu/tháng,3.300 m²,"Cái Bè, Tiền Giang",cho-thue-kho-nha-xuong-dat
Cho thuê xưởng 1000m2 giá 40tr,40 triệu/tháng,1.100 m²,"Hóc Môn, Hồ Chí Minh",cho-thue-kho-nha-xuong-dat
"Cho thuê xưởng Trảng Bàng DT 1700m2, giá 85tr",85 triệu/tháng,1.700 m²,"Trảng Bàng, Tây Ninh",cho-thue-kho-nha-xuong-dat
Đất lớn biển - phố (300m2 - 3.100m2) cho thuê (vị trí đắc địa nhất nhì Đà Nẵng) click xem,250 triệu/tháng,1.200 m²,"Hải Châu, Đà Nẵng",cho-thue-kho-nha-xuong-dat
"Cần cho thuê kho xưởng tại đường Trần Điền, Định Công",16 triệu/tháng,156 m²,"Hoàng Mai, Hà Nội",cho-thue-kho-nha-xuong-dat
"Cho thuê kho xưởng khu vực Đình Vũ, diện tích từ 1000m2 đến 6000m2, PCCC tự động, giá chỉ từ 50k/m2",50 nghìn/m²,6.000 m²,"Hải An, Hải Phòng",cho-thue-kho-nha-xuong-dat
"Tổng hợp cho thuê nhà và đất mặt đường Lê Hồng Phong, DTMB từ 700m2 đến 1800m2. HĐ thuê dài hạn",100 triệu/tháng,1.650 m²,"Ngô Quyền, Hải Phòng",cho-thue-kho-nha-xuong-dat
Cần cho thuê kho chứa hàng và xưởng sản xuất tại KCN Hải Sơn,65 triệu/tháng,1.000 m²,"Đức Hòa, Long An",cho-thue-kho-nha-xuong-dat
Cho thuê kho/xưởng sản xuất trong KCN Nam Đình Vũ,Giá thỏa thuận,10.000 m²,"Hải An, Hải Phòng",cho-thue-kho-nha-xuong-dat
"Cc cho thuê 250m2 kho tôn mát cao 6m, vs, điện 3p, nước SĐ, khu Tân Triều giá 25tr/th LH 0903 244 ***",25 triệu/tháng,250 m²,"Thanh Trì, Hà Nội",cho-thue-kho-nha-xuong-dat
"Cho thuê kho xưởng 1000m2, 2000m2 QL 51, Tam Phước, Biên Hoà, Đồng Nai chỉ 606.625đ/m2/th",60 nghìn/m²,1.000 m²,"Biên Hòa, Đồng Nai",cho-thue-kho-nha-xuong-dat
Cần cho thuê xưởng Thuận Giao tại thuận an bình dương,35 triệu/tháng,1.000 m²,"Thuận An, Bình Dương",cho-thue-kho-nha-xuong-dat
"Chính chủ cho thuê kho xưởng 800m2 - 1800m2 trong cụm làng nghề Bát Tràng, Gia Lâm, Hà Nội",50 nghìn/m²,1.800 m²,"Gia Lâm, Hà Nội",cho-thue-kho-nha-xuong-dat
Cho thuê sân tennis 700m2 đường Bình Quới,50 triệu/tháng,700 m²,"Bình Thạnh, Hồ Chí Minh",cho-thue-kho-nha-xuong-dat
"Cho thuê kho xưởng giá rẻ 1000m2. Ở Phường Vĩnh Tân, Tân Uyên, Bình Dương. LH: 0972 701 ***",30 triệu/tháng,1.000 m²,"Tân Uyên, Bình Dương",cho-thue-kho-nha-xuong-dat
"Cho thuê 4500m2 đất mặt tiền Long Đức - Lộc An, đối diện ttvh xã, 45m mặt tiền đường. Lh 0966 167 ***",Giá thỏa thuận,4.500 m²,"Long Thành, Đồng Nai",cho-thue-kho-nha-xuong-dat
Cho thuê kho xưởng pháp lý đầy đủ. PCCC kiểm duyệt. TP Tân Uyên 4500m2 Bình Dương. LH,"66,78 nghìn/m²",4.500 m²,"Tân Uyên, Bình Dương",cho-thue-kho-nha-xuong-dat
"Cho thuê xưởng phường Khánh Bình 1200m2, Tân Uyên, Bình Dương. LH: 0972 701 ***",50 nghìn/m²,1.200 m²,"Tân Uyên, Bình Dương",cho-thue-kho-nha-xuong-dat
"Kho xưởng 200m2 trong cụm kho đường Quốc Lộ 91B Nguyễn Văn Linh, có điện 3 pha, tải sàn 4 tấn/m2",10 triệu/tháng,200 m²,"Bình Thủy, Cần Thơ",cho-thue-kho-nha-xuong-dat
Cho thuê kho xưởng định hòa thủ dầu một bình dương đường xe container,25 triệu/tháng,500 m²,"Thủ Dầu Một, Bình Dương",cho-thue-kho-nha-xuong-dat
"Cho thuê kho xưởng 315m2 tại ngã tư La Dương, Dương Nội, Hà Đông",70 nghìn/m²,315 m²,"Hà Đông, Hà Nội",cho-thue-kho-nha-xuong-dat
"Cho thuê mặt bằng tại chân cầu Đông Trù, Long Biên, Hà Nội",Giá thỏa thuận,10.000 m²,"Long Biên, Hà Nội",cho-thue-kho-nha-xuong-dat
"Chúng tôi có kho cho thuê tại KĐT Thanh Hà với diện tích 2000m2, có thể chia nhỏ theo nhu cầu",70 nghìn/m²,2.000 m²,"Hà Đông, Hà Nội",cho-thue-kho-nha-xuong-dat
Cho thuê kho xưởng mặt tiền nguyễn văn thành hòa lợi bến cát bình dương,30 triệu/tháng,670 m²,"Bến Cát, Bình Dương",cho-thue-kho-nha-xuong-dat
Chính chủ cho thuê kho tại Tây Tựu - Bắc Từ Liêm. Có tổng diện tích 1166m2,75 nghìn/m²,1.166 m²,"Bắc Từ Liêm, Hà Nội",cho-thue-kho-nha-xuong-dat
"Kho - xưởng - văn phòng: 2400m2 Hương lộ 2, Ao Đôi, 1 hầm 6 lầu đường xe công",90 triệu/tháng,2.400 m²,"Bình Tân, Hồ Chí Minh",cho-thue-kho-nha-xuong-dat
Cần cho thuê kho Phú Hòa thủ dầu một bình dương đường tải lớn giá 15tr/tháng,15 triệu/tháng,500 m²,"Thủ Dầu Một, Bình Dương",cho-thue-kho-nha-xuong-dat
"Cho thuê kho xưởng mặt tiền Quốc lộ 1A đoạn Vĩnh Phương, Nha Trang",90 triệu/tháng,2.400 m²,"Nha Trang, Khánh Hòa",cho-thue-kho-nha-xuong-dat
"Cho thuê kho xưởng 1000m2 - 45tr đường Trần Văn Giàu - Bình Chánh, xin liên hệ: 0968 458 ***",45 triệu/tháng,1.000 m²,"Bình Chánh, Hồ Chí Minh",cho-thue-kho-nha-xuong-dat
"Cho thuê kho xưởng 500m2 - 25tr/th đường Võ Văn Vân - Bình Chánh, xin liên hệ: 0968 458 ***",25 triệu/tháng,500 m²,"Bình Chánh, Hồ Chí Minh",cho-thue-kho-nha-xuong-dat
"Cho thuê kho xưởng KCN Hiệp Phước 2 DT 3402m2 giá 90k/m2 đầy đủ PCcc, xử lý nước thải, khối VP",90 nghìn/m²,3.402 m²,"Nhà Bè, Hồ Chí Minh",cho-thue-kho-nha-xuong-dat
Cho thuê kho mới 200m2 Phạm Văn Chiêu Gò Vấp,20 triệu/tháng,200 m²,"Gò Vấp, Hồ Chí Minh",cho-thue-kho-nha-xuong-dat
"Thuê kho, mặt bằng 1400m2 chia nhỏ 800m2 Quận 7 sản xuất được, lâu dài 5 năm",132 triệu/tháng,1.400 m²,"Quận 7, Hồ Chí Minh",cho-thue-kho-nha-xuong-dat
"Cho thuê kho xưởng 4400m2 khu công nghiệp Đắc Lộc, Diên Phú",154 triệu/tháng,4.400 m²,"Diên Khánh, Khánh Hòa",cho-thue-kho-nha-xuong-dat
Cho thuê kho nhỏ Quận 7 chuẩn PCCC tự động - DT 150m2,18 triệu/tháng,150 m²,"Quận 7, Hồ Chí Minh",cho-thue-kho-nha-xuong-dat
"Cho thuê kho xưởng 2000m2, 2800m2, 3400m2 Quốc Lộ 51, Tam Phước, Biên Hoà, Đồng Nai",75 nghìn/m²,2.900 m²,"Biên Hòa, Đồng Nai",cho-thue-kho-nha-xuong-dat
"Chính chủ cho thuê kho 1200m2, 400m2 mặt tiền HQV Quận 7 giá chỉ 60tr/ tháng. Liên hệ: 0965 893 ***",60 triệu/tháng,1.200 m²,"Quận 7, Hồ Chí Minh",cho-thue-kho-nha-xuong-dat
Cần cho thuê xưởng 10.000m2 và 20.000m2 tại Tân Uyên Bình Dương,Giá thỏa thuận,20.000 m²,"Tân Uyên, Bình Dương",cho-thue-kho-nha-xuong-dat
"Cho thuê xưởng SX tại KCN Bắc Ninh, DT 5000m2 tới 20.000m2, PCCC tự động. LH 0988 457 ***",129 nghìn/m²,5.000 m²,"Bắc Ninh, Bắc Ninh",cho-thue-kho-nha-xuong-dat
"Kho xưởng 6.200m2 kho xây dựng 5.500m2 có PCCC và trạm điện 3 pha 320kVA, lộ Container",180 triệu/tháng,6.200 m²,"Châu Thành A, Hậu Giang",cho-thue-kho-nha-xuong-dat
"Cho thuê nhà xưởng KCN Quế Võ, DT 16500m2, PCCC tự động. LH 0988 457 ***","93,5 nghìn/m²",16.500 m²,"Quế Võ, Bắc Ninh",cho-thue-kho-nha-xuong-dat
"Cho thuê nhà xưởng mới xây Ấp 3B, Vĩnh Lộc B, Bình Chánh, 7.5x15m trệt lửng, giá 10tr/ tháng",10 triệu/tháng,"112,5 m²","Bình Chánh, Hồ Chí Minh",cho-thue-kho-nha-xuong-dat
"Cho thuê xưởng DT 1600m2 Vĩnh Lộc, Bình Chánh",59 triệu/tháng,1.600 m²,"Bình Chánh, Hồ Chí Minh",cho-thue-kho-nha-xuong-dat
"Cho thuê kho xưởng 2.000m2 một sẹc đường Tỉnh lộ 8, Củ Chi",60 triệu/tháng,2.000 m²,"Củ Chi, Hồ Chí Minh",cho-thue-kho-nha-xuong-dat
"Cho thuê kho xưởng Thuỵ Phương 500-1500m2, kho mới 100%, xe cont đỗ cửa. Giá 75 nghìn/m2",75 nghìn/m²,1.500 m²,"Bắc Từ Liêm, Hà Nội",cho-thue-kho-nha-xuong-dat
Cho thuê kho xưởng rẻ tại Như Quỳnh - Thị trấn Như Quỳnh- Hưng Yên,37 nghìn/m²,800 m²,"Văn Lâm, Hưng Yên",cho-thue-kho-nha-xuong-dat
"Cho thuê kho xưởng tại Hưng Yên - Thị trấn Như Quỳnh - Văn Lâm - Hưng Yên, 300-500-2.000-7000m2",25 nghìn/m²,300 m²,"Văn Lâm, Hưng Yên",cho-thue-kho-nha-xuong-dat
"Cho thuê kho MT 94 Nguyễn Văn Cự, (10x42m), 27tr/tháng",27 triệu/tháng,420 m²,"Bình Tân, Hồ Chí Minh",cho-thue-kho-nha-xuong-dat
Cho thuê mặt bằng tại Hưng Yên - Khu CN Phố Nối B- Hưng Yên,25 nghìn/m²,22.000 m²,"Yên Mỹ, Hưng Yên",cho-thue-kho-nha-xuong-dat
Cho thuê kho xưởng đẹp tại Đông Anh - Thị trấn Đông Anh - Đông Anh,60 nghìn/m²,1.800 m²,"Đông Anh, Hà Nội",cho-thue-kho-nha-xuong-dat
Cho thuê cửa hàng tại Đông Dư - Gia Lâm,80 nghìn/m²,250 m²,"Gia Lâm, Hà Nội",cho-thue-kho-nha-xuong-dat
"Cho thuê kho tại Phúc Đồng- Long Biên, giá rẻ nhất khu vực",50 nghìn/m²,1.000 m²,"Long Biên, Hà Nội",cho-thue-kho-nha-xuong-dat
Cho thuê kho xưởng đẹp tại Long Biên- p Đức Giang- Long Biên,Giá thỏa thuận,400 m²,"Long Biên, Hà Nội",cho-thue-kho-nha-xuong-dat
Cho thuê 500-1000-2000-3000-9000m2 tại Bắc Ninh - khu CN Tiên Sơn- Tân Hồng- Bắc Ninh,"69,99 nghìn/m²",9.000 m²,"Từ Sơn, Bắc Ninh",cho-thue-kho-nha-xuong-dat
"CHO THUÊ KHO LOGISTICS YÊN MỸ, HƯNG YÊN Tổng diện tích sàn 1.600-16.200m2",75 nghìn/m²,16.000 m²,"Yên Mỹ, Hưng Yên",cho-thue-kho-nha-xuong-dat
Cho thuê kho xưởng rẻ tại Đông Anh- Thị trấn Đông Anh- Đông Anh,20 triệu/tháng,700 m²,"Đông Anh, Hà Nội",cho-thue-kho-nha-xuong-dat
"Cho thuê kho, xưởng mới 100% khu Khoái Châu, Hưng Yên. DT 500m2 đến 100.000m2 (chia nhỏ DT)",38 nghìn/m²,1.000 m²,"Khoái Châu, Hưng Yên",cho-thue-kho-nha-xuong-dat
"Cho thuê kho, xưởng mới 100% khu CN Kim Động, DT 1000m2 đến 100.000m2 (chia nhỏ theo yêu cầu)",35 nghìn/m²,1.000 m²,"Kim Động, Hưng Yên",cho-thue-kho-nha-xuong-dat
"Cho thuê kho, xưởng khu Bình Giang, Hải Dương, DT 1000m2 đến 150.000m2 (chia nhỏ theo yêu cầu)",40 nghìn/m²,1.000 m²,"Bình Giang, Hải Dương",cho-thue-kho-nha-xuong-dat
Cho thuê kho xưởng tại Hưng Yên - Khu CN Tân Quang - Văn Lâm - Hưng Yên,75 nghìn/m²,2.000 m²,"Văn Lâm, Hưng Yên",cho-thue-kho-nha-xuong-dat
"Cho thuê xưởng mới trong và ngoài Khu công nghiệp Ân Thi, Hưng Yên DT đa dạng 1000m2 đến 200.000m2",Giá thỏa thuận,8.000 m²,"Ân Thi, Hưng Yên",cho-thue-kho-nha-xuong-dat
"Cho thuê nhà xưởng mới trong và ngoài KCN Thuận Thành, Bắc Ninh DT đa dạng 1000m2 đến 200.000m2",45 nghìn/m²,1.500 m²,"Thuận Thành, Bắc Ninh",cho-thue-kho-nha-xuong-dat
"Cho thuê kho xưởng khung Zamil diện tích đa dạng tại KCN Vsip, Bắc Ninh từ 1.000m2 đến 200.000m2",Giá thỏa thuận,15.000 m²,"Từ Sơn, Bắc Ninh",cho-thue-kho-nha-xuong-dat
"Cho thuê kho, xưởng giá rẻ mới 100% khu Cẩm Giàng, Hải Dương DT 1.000m2 đến 200.000m2",40 nghìn/m²,4.000 m²,"Cẩm Giàng, Hải Dương",cho-thue-kho-nha-xuong-dat
"Cho thuê kho xưởng giá rẻ trong và ngoài KCN Cẩm Giàng, Hải Dương DT 1.000m, 5.000m... 200.000m2",Giá thỏa thuận,4.000 m²,"Cẩm Giàng, Hải Dương",cho-thue-kho-nha-xuong-dat
"Cho thuê nhà xưởng mới trong và ngoài KCN Bình Giang, Hải Dương DT 1000m đến 200.000m2",45 nghìn/m²,20.000 m²,"Bình Giang, Hải Dương",cho-thue-kho-nha-xuong-dat
"Cho thuê khối đế tầng 1 - 215 m2, tiện làm kho và văn phòng",23 triệu/tháng,215 m²,"Hà Đông, Hà Nội",cho-thue-kho-nha-xuong-dat
"Cho thuê đất 462m2 (14x31m), có thể thuê một nửa, gần chợ đầu mối Thủ Đức, QL 13 cũ, P. HBP 12tr/th",12 triệu/tháng,462 m²,"Thủ Đức, Hồ Chí Minh",cho-thue-kho-nha-xuong-dat
"Cho thuê kho xưởng sản xuất, kho để hàng Thủ Đức",20 triệu/tháng,800 m²,"Thủ Đức, Hồ Chí Minh",cho-thue-kho-nha-xuong-dat
Cho thuê kho xưởng VP phố Thúy Lĩnh phường Lĩnh Nam,Giá thỏa thuận,300 m²,"Hoàng Mai, Hà Nội",cho-thue-kho-nha-xuong-dat
"Kho đẹp, thoáng Q11 (cắt diện tích theo yêu cầu)",30 triệu/tháng,300 m²,"Quận 11, Hồ Chí Minh",cho-thue-kho-nha-xuong-dat
"Cho thuê kho Quận Tân Phú (kho mới, đẹp, đạt chuẩn). LH: 0919 418 *** Tuấn",30 triệu/tháng,300 m²,"Tân Phú, Hồ Chí Minh",cho-thue-kho-nha-xuong-dat
"Cho thuê kho mặt tiền Đào Trí, Phú Thuận, Quận 7","63,8 triệu/tháng",580 m²,"Quận 7, Hồ Chí Minh",cho-thue-kho-nha-xuong-dat
Cho thuê nhà xưởng KCN Thành Thành Công An Hòa Trảng Bàng Tây Ninh,300 triệu/tháng,10.000 m²,"Trảng Bàng, Tây Ninh",cho-thue-kho-nha-xuong-dat
"Cho thuê kho 500m2, đường tải vào tới kho, kho mới đẹp",33 triệu/tháng,320 m²,"Tân Phú, Hồ Chí Minh",cho-thue-kho-nha-xuong-dat
"Cho thuê kho 200m2 - 300m2, đường Cont40F vào tới kho",110 nghìn/m²,200 m²,"Tân Phú, Hồ Chí Minh",cho-thue-kho-nha-xuong-dat
Cho thuê kho đẹp 1400m2 có PCCC trung tâm Gò Vấp,168 triệu/tháng,1.400 m²,"Gò Vấp, Hồ Chí Minh",cho-thue-kho-nha-xuong-dat
