Title,Price,Area,Location,type
"Tôi cần cho thuê nhà 51 Cô Giang Quận 1, DT 4x21m, KC: 7 lầu, giá 110tr/tháng LH Nguyên",110 triệu/tháng,84 m²,"Quận 1, Hồ Chí Minh",cho-thue-nha-mat-pho
"Cho thuê nhà MT Hùng Vương, Q10, DT 8x25m, giá 95tr/th, Nguyên",95 triệu/tháng,200 m²,"Quận 10, Hồ Chí Minh",cho-thue-nha-mat-pho
"Tin thật 100%, cho thuê mặt tiền 486 Nguyễn Thị Minh Khai, diện tích 10x25m, 3 tầng, giá 200 tr",200 triệu/tháng,250 m²,"Quận 3, Hồ Chí Minh",cho-thue-nha-mat-pho
"Em Quang nắm nhiều căn chủ thiện chí cho thuê giá tốt khu Thạnh Mỹ Lợi, Quận 2",40 triệu/tháng,100 m²,"Quận 2, Hồ Chí Minh",cho-thue-nha-mat-pho
"Cho thuê các căn nhà phố, villa khu An Phú, Trần Não - Quận 2, từ 10 - 250 tr/th",25 triệu/tháng,100 m²,"Quận 2, Hồ Chí Minh",cho-thue-nha-mat-pho
"Cho thuê mặt tiền 172-174 Lê Lai, vỉa hè rộng 10m đỗ được ô tô, đối diện công viên 30/4, giá 240tr",240 triệu/tháng,250 m²,"Quận 1, Hồ Chí Minh",cho-thue-nha-mat-pho
"Cho thuê nhà mặt phố Giảng Võ, Ba Đình 81m2 xây 5 tầng, vỉa hè rộng, kinh doanh tốt 48 triệu",48 triệu/tháng,81 m²,"Ba Đình, Hà Nội",cho-thue-nha-mat-pho
"Cho thuê nhà mặt phố Giảng Võ, Ba Đình 81m2 xây 5 tầng, vỉa hè rộng, kinh doanh tốt 48 triệu",48 triệu/tháng,81 m²,"Ba Đình, Hà Nội",cho-thue-nha-mat-pho
"Cho thuê nhà mặt phố Yên Lãng, Đống Đa, 43m2 xây 4 tầng, vỉa hè rộng tiện kinh doanh giá chỉ 20tr",20 triệu/tháng,43 m²,"Đống Đa, Hà Nội",cho-thue-nha-mat-pho
"Cho thuê toà văn phòng mặt phố Trương Định, Hà Nội, toà nhà 8 tầng có hầm xây 165m2 nhỉnh 100tr",Giá thỏa thuận,165 m²,"Hoàng Mai, Hà Nội",cho-thue-nha-mat-pho
"Cho thuê nhà mặt phố Liễu Giai, Ba Đình, 400m2 mặt tiền 20m, kinh doanh sầm uất chỉ 299tr/tháng",299 triệu/tháng,400 m²,"Ba Đình, Hà Nội",cho-thue-nha-mat-pho
"Cho thuê nhà phố Từ Hoa, Tây Hồ toà 130m2 xây mới 5,5 tầng đủ nội thất trên 60tr, mặt hồ siêu đẹp",Giá thỏa thuận,130 m²,"Tây Hồ, Hà Nội",cho-thue-nha-mat-pho
"Cho thuê nhà mặt phố Tô Ngọc Vân, Tây Hồ toà rộng 220m2 xây 5.5 tầng kinh doanh mọi mô hình 139tr",139 triệu/tháng,220 m²,"Tây Hồ, Hà Nội",cho-thue-nha-mat-pho
"Cho thuê nhà mặt phố Hoàng Hoa Thám, Thuỵ Khuê 90m2 xây 3 tầng kinh doanh mọi mô hình chỉ 35tr",35 triệu/tháng,90 m²,"Ba Đình, Hà Nội",cho-thue-nha-mat-pho
"Cho thuê nhà mặt phố Nguyễn Chí Thanh, Đống Đa 86m2 xây 4,5 tầng, mặt tiền 8m chỉ 58tr",58 triệu/tháng,86 m²,"Đống Đa, Hà Nội",cho-thue-nha-mat-pho
"Cho thuê nhà mặt phố Huỳnh Thúc Kháng, Láng Hạ rộng 350m mặt tiền 30m vỉa hè siêu rộng nhỉnh 300tr",Giá thỏa thuận,350 m²,"Đống Đa, Hà Nội",cho-thue-nha-mat-pho
Cho thuê mặt bằng kinh doanh mặt phố Hai Bà Trưng 130mx6T MT 4.8m 120tr/tháng,120 triệu/tháng,130 m²,"Hoàn Kiếm, Hà Nội",cho-thue-nha-mat-pho
"Cho thuê tòa nhà mặt phố Nguyễn Khang, Cầu Giấy 139m2 xây 10 tầng hiện đại, lô góc mặt tiền 10m",242 triệu/tháng,139 m²,"Cầu Giấy, Hà Nội",cho-thue-nha-mat-pho
"Cho thuê nhà mặt tiền 79A Huỳnh Văn Bánh Nhà mới, thiết kế dạng văn phòng, spa, nha khoa",33 triệu/tháng,121 m²,"Phú Nhuận, Hồ Chí Minh",cho-thue-nha-mat-pho
Cho thuê mặt bằng kinh doanh mặt đường Cầu Giấy 450m2 MT 20m 333 nghìn/m2/tháng,150 triệu/tháng,450 m²,"Cầu Giấy, Hà Nội",cho-thue-nha-mat-pho
"Cho thuê nhà MT Lê Văn Hiến 165m2 ngang 6,5m xuyên suôt",12 triệu/tháng,165 m²,"Ngũ Hành Sơn, Đà Nẵng",cho-thue-nha-mat-pho
"Cho thuê nhà 7 tầng mới toanh Đội Cấn, Ba Đình, diện tích 453m2/sàn, mặt tiền: 10.5m",Giá thỏa thuận,453 m²,"Ba Đình, Hà Nội",cho-thue-nha-mat-pho
Chính chủ cho thuê mặt tiền đường Tỉnh Lộ 10,18 triệu/tháng,60 m²,"Bình Tân, Hồ Chí Minh",cho-thue-nha-mat-pho
"Cho thuê nhà nguyên căn - Phù hợp ở hoặc kinh doanh, ngay Trần Khắc Chân, Quận 1",12 triệu/tháng,32 m²,"Quận 1, Hồ Chí Minh",cho-thue-nha-mat-pho
Cho thuê mặt bằng kinh doanh 180m2 đường lớn 24m gần Go Dĩ An 15tr/tháng,15 triệu/tháng,180 m²,"Dĩ An, Bình Dương",cho-thue-nha-mat-pho
"Cho thuê nhà cấp 4 trống suốt MT gần Lê Duẩn, Quận Hải Châu",16 triệu/tháng,135 m²,"Hải Châu, Đà Nẵng",cho-thue-nha-mat-pho
"Siêu hot tìm phòng khám vào mặt bằng 1000m2 Trần Thái Tông, Cầu Giấy, mặt tiền: 18m",Giá thỏa thuận,313 m²,"Cầu Giấy, Hà Nội",cho-thue-nha-mat-pho
"Cho thuê nhà 3 tầng mới keng MT Trần Đại Nghĩa, Hoà Hải, Ngũ Hành Sơn",10 triệu/tháng,125 m²,"Ngũ Hành Sơn, Đà Nẵng",cho-thue-nha-mat-pho
"Cho thuê nhà trục chính KĐT ICC Quán Mau gần đường Lạch Tray, mặt tiền 7.5m, DTSD 800m2, có PCCC",80 triệu/tháng,150 m²,"Lê Chân, Hải Phòng",cho-thue-nha-mat-pho
"Cho thuê nhà 2 tầng trống suốt, xây theo kiểu nhà hàng MT gần cầu Rồng, trung tâm quận Hải Châu",65 triệu/tháng,180 m²,"Hải Châu, Đà Nẵng",cho-thue-nha-mat-pho
Cho thuê siêu phẩm mới rẻ đẹp MT 5 tầng ngay trung tâm TP Hải Châu,20 triệu/tháng,80 m²,"Hải Châu, Đà Nẵng",cho-thue-nha-mat-pho
Cho thuê nhà cấp 4 trống suốt gần Lê Duẩn,27 triệu/tháng,165 m²,"Hải Châu, Đà Nẵng",cho-thue-nha-mat-pho
"Cho thuê nhà 5 tầng gần Lê Duẩn, Quận Hải Châu",25 triệu/tháng,80 m²,"Hải Châu, Đà Nẵng",cho-thue-nha-mat-pho
Cho thuê nhà MT Nguyễn Văn Thoại 100tr dt đất 180m2 ngang 9m 3 tầng trống suốt,100 triệu/tháng,180 m²,"Ngũ Hành Sơn, Đà Nẵng",cho-thue-nha-mat-pho
"Cho thuê tòa building sát: Nguyễn Văn Linh, TP Đà Nẵng",150 triệu/tháng,170 m²,"Hải Châu, Đà Nẵng",cho-thue-nha-mat-pho
Quốc Bảo Luxury - chuyên cho thuê khách sạn chuẩn 3 sao - 4 sao biển quận 3 Ngũ Hành Sơn,130 triệu/tháng,900 m²,"Ngũ Hành Sơn, Đà Nẵng",cho-thue-nha-mat-pho
"Cho thuê nhà MT Nguyễn Văn Thoại, gần biển khu du lịch",30 triệu/tháng,84 m²,"Ngũ Hành Sơn, Đà Nẵng",cho-thue-nha-mat-pho
"Chính chủ cho thuê nhà 2 mặt tiền 16 Quang Trung, P10, Q. Gò Vấp, 10x30m, trệt lầu ST, 0938 140 ***",Giá thỏa thuận,300 m²,"Gò Vấp, Hồ Chí Minh",cho-thue-nha-mat-pho
"Cho thuê MT 3/2, P12, Q10. Khu đẹp kinh doanh đa ngành",200 triệu/tháng,150 m²,"Quận 10, Hồ Chí Minh",cho-thue-nha-mat-pho
"Cho thuê nguyên căn Nguyễn Văn Linh, tuyến phố tài chính trung tâm Đà Nẵng",70 triệu/tháng,100 m²,"Thanh Khê, Đà Nẵng",cho-thue-nha-mat-pho
"Cho thuê mặt bằng kinh doanh mặt phố Trần Phú 6000m2 lô góc MT 50m, 850tr/tháng",850 triệu/tháng,6.000 m²,"Hà Đông, Hà Nội",cho-thue-nha-mat-pho
Cho thuê nhà 2MT quận Thanh Khê,50 triệu/tháng,450 m²,"Thanh Khê, Đà Nẵng",cho-thue-nha-mat-pho
Mặt bằng kinh doanh trung tâm TP. Đông Hà,6 triệu/tháng,120 m²,"Đông Hà, Quảng Trị",cho-thue-nha-mat-pho
"Cho thuê nhà đường Lê Văn Sỹ Q3, diện tích 8x15m, 1 lầu, giá thuê 37 triệu/tháng",37 triệu/tháng,120 m²,"Quận 3, Hồ Chí Minh",cho-thue-nha-mat-pho
"Cho thuê nhà MT đường C18 P.12 Tân Bình, DT: 7x18m gồm garaxe lửng 4 lầu, giá 35 triệu/tháng",35 triệu/tháng,125 m²,"Tân Bình, Hồ Chí Minh",cho-thue-nha-mat-pho
"Chính chủ cho thuê nhà mặt tiền 840 - 842 - 844 Âu Cơ, P14, Q. Tân Bình, 12x24m, 288m2, 0938 140 ***",Giá thỏa thuận,288 m²,"Tân Bình, Hồ Chí Minh",cho-thue-nha-mat-pho
"Cần cho thuê nhà MT Đường Nguyễn Văn Đậu BT, DT 4x30m, trệt 5 lầu, giá thuê 60 triệu",60 triệu/tháng,120 m²,"Bình Thạnh, Hồ Chí Minh",cho-thue-nha-mat-pho
"Cho thuê nhà mặt phố Phan Kế Bính 80m2 x 5 tầng, mặt tiền 4.5m. KD mọi mô hình giá 70tr/tháng",70 triệu/tháng,80 m²,"Ba Đình, Hà Nội",cho-thue-nha-mat-pho
"Cần cho thuê nhà mặt tiền Đường Nguyễn Đình Chính PN, DT 5.5x15m, Trệt 2 Lầu, Giá 25 Triệu",25 triệu/tháng,"82,5 m²","Phú Nhuận, Hồ Chí Minh",cho-thue-nha-mat-pho
"Cho thuê nhà NC góc 2 mặt tiền đường Lý Thường Kiệt, 5.5 x 14m hầm lửng 5 lầu thang máy - nhà mới",95 triệu/tháng,77 m²,"Quận 10, Hồ Chí Minh",cho-thue-nha-mat-pho
Cho thuê góc 2 mặt tiền đường 2/9 rộng 800m2,150 triệu/tháng,800 m²,"Hải Châu, Đà Nẵng",cho-thue-nha-mat-pho
Cho thuê mặt tiền Phường 1 (khuôn viên: 1300m2). Phù hợp nhà hàng ăn uống giá thuê 45tr/ tháng,45 triệu/tháng,1.300 m²,"Vũng Tàu, Bà Rịa Vũng Tàu",cho-thue-nha-mat-pho
Cho thuê nhà mê lửng ngang 6m MT khu sầm uất Thanh Khê 20tr/th,20 triệu/tháng,110 m²,"Thanh Khê, Đà Nẵng",cho-thue-nha-mat-pho
"Cho thuê nhà 4 tầng thang máy MT, Hoà Cường Nam. Quận Hải Châu",20 triệu/tháng,90 m²,"Hải Châu, Đà Nẵng",cho-thue-nha-mat-pho
"Cho thuê nhà 2 tầng MT Tôn Đức Thắng, ngang 6m",20 triệu/tháng,180 m²,"Liên Chiểu, Đà Nẵng",cho-thue-nha-mat-pho
"Cho thuê nhà MT 4 tầng 7 phòng, 7WC, gần đường Nguyễn Tri Phương, gần sân bay Đà Nẵng",14 triệu/tháng,100 m²,"Thanh Khê, Đà Nẵng",cho-thue-nha-mat-pho
"Chính chủ cho thuê nhà mặt tiền 137 Phan Đăng Lưu, P2, Q. Phú Nhuận, 17x55m, 850m2, 0938 140 ***",Giá thỏa thuận,850 m²,"Phú Nhuận, Hồ Chí Minh",cho-thue-nha-mat-pho
"Cho thuê nhà nguyên căn đường Khánh Hội, Q4: DT: 6x15m, trệt + 4 lầu, 8 phòng, nhà mới. 80 triệu/th",80 triệu/tháng,90 m²,"Quận 4, Hồ Chí Minh",cho-thue-nha-mat-pho
Cho thuê MB riêng biệt tầng trệt hoặc tầng 1 vị trí trung tâm đắc địa đường 2 Tháng 9,120 triệu/tháng,370 m²,"Hải Châu, Đà Nẵng",cho-thue-nha-mat-pho
"Cho thuê nhà mặt phố Bùi Thị Xuân 120m2 x 3 tầng, MT 6m - Đoạn đẹp KD nhà hàng, thời trang",65 triệu/tháng,120 m²,"Hai Bà Trưng, Hà Nội",cho-thue-nha-mat-pho
Cho thuê nhà mặt phố Nguyễn Đình Thi DT 80m2 MT 5m KD cafe tô tượng siêu hợp giá 20tr/th 0979 965 ***,20 triệu/tháng,80 m²,"Tây Hồ, Hà Nội",cho-thue-nha-mat-pho
"280 và 320m2 làm shop, bank, cafe mặt phố Lê Văn Lương và Hoàng Đạo Thuý cho thuê lâu dài ngay","892,6 nghìn/m²",300 m²,"Thanh Xuân, Hà Nội",cho-thue-nha-mat-pho
"Cho thuê nhà phố KDC 6B Intresco đường Phạm Hùng, có hầm - 3 lầu, giá 18 triệu, LH: 0934 933 ***",18 triệu/tháng,100 m²,"Bình Chánh, Hồ Chí Minh",cho-thue-nha-mat-pho
Hot! Cho thuê nhà mặt phố Trần Quốc Toản DT 60m2 x 4 tầng MT lô góc 10m chỉ 60tr đẹp nhất phố,60 triệu/tháng,60 m²,"Hoàn Kiếm, Hà Nội",cho-thue-nha-mat-pho
Cho thuê mặt bằng kinh doanh mặt phố Nguyễn Ngọc Vũ 65m2x4T MT 5m 40tr/tháng,40 triệu/tháng,65 m²,"Cầu Giấy, Hà Nội",cho-thue-nha-mat-pho
"Cho thuê tòa nhà mới xây mặt phố Nguyễn Khang, DT 100m2 * 7,5T + hầm, thông sàn, tiện KD. Giá 115tr",115 triệu/tháng,100 m²,"Cầu Giấy, Hà Nội",cho-thue-nha-mat-pho
"Cho thuê nhà mặt phố Trần Đại Nghĩa, 105m2 x 5 tầng, MT 7m, thông sàn, mọi mô hình, 7x triệu/tháng",70 triệu/tháng,105 m²,"Hai Bà Trưng, Hà Nội",cho-thue-nha-mat-pho
"Chính chủ cho thuê nhà mặt phố Hoàng Quốc Việt, DT 66m2 * 5T, MT 4m, vị trí đắc địa. Giá chỉ 32tr",32 triệu/tháng,66 m²,"Cầu Giấy, Hà Nội",cho-thue-nha-mat-pho
"Cho thuê mặt bằng KD - Văn phòng 35m2 - 50m2 mặt tiền 8m ngã 4 Hoàng Quốc Việt, Nguyễn Phong Sắc","16,9 triệu/tháng",45 m²,"Cầu Giấy, Hà Nội",cho-thue-nha-mat-pho
Cho thuê nhà mặt phố Thái Thịnh DT 60m2 mặt tiền 5m giá 35tr/th đoạn đẹp nhất dân qua lại ngày đêm,35 triệu/tháng,60 m²,"Đống Đa, Hà Nội",cho-thue-nha-mat-pho
"Cho thuê nhà góc 2MT Huỳnh Tấn Phát, DT: 7m x 25m, 5 lầu, Nhà Bè",55 triệu/tháng,175 m²,"Nhà Bè, Hồ Chí Minh",cho-thue-nha-mat-pho
"Chính chủ cho thuê nhà mặt phố Giang Văn Minh, DT 200m2, MT 15m giá 75tr/th",75 triệu/tháng,200 m²,"Ba Đình, Hà Nội",cho-thue-nha-mat-pho
Cho thuê nhà phố kinh doanh nguyên căn & theo tầng hoàn thiện nội thất Vinhomes Grand Park Quận 9,15 triệu/tháng,96 m²,"Quận 9, Hồ Chí Minh",cho-thue-nha-mat-pho
"Cho thuê nhà đường Trần Lựu, diện tích 4x20m, đường trước nhà 45m, giá 35 triệu, LH 0913 212 ***",35 triệu/tháng,80 m²,"Quận 2, Hồ Chí Minh",cho-thue-nha-mat-pho
Cho thuê nhà mặt phố Vũ Trọng Phụng 35m2 x 4 tầng mặt tiền 5m giá thuê 35tr KD mọi mô hình,35 triệu/tháng,35 m²,"Thanh Xuân, Hà Nội",cho-thue-nha-mat-pho
"Cho thuê cửa hàng phố Điện Biên Phủ 70m2 x 2 tầng, MT 8m, 70tr/tháng",70 triệu/tháng,140 m²,"Ba Đình, Hà Nội",cho-thue-nha-mat-pho
"Nhà Sala cho thuê - 5.7mx20m, hầm + 4 tầng, thang máy, nhà đẹp. 0931 490 ***",95 triệu/tháng,114 m²,"Quận 2, Hồ Chí Minh",cho-thue-nha-mat-pho
Cho thuê nhà 4 tầng mặt tiền Hùng Vương có thang máy sát Chợ Cồn và Big C có thang máy giá 60tr/th,60 triệu/tháng,142 m²,"Hải Châu, Đà Nẵng",cho-thue-nha-mat-pho
Cho thuê nhà mặt phố Nguyễn Chí Thanh 150m2 x 2 tầng mặt tiền lô góc 12.5m đẹp nhất phố KD siêu lộc,130 triệu/tháng,150 m²,"Đống Đa, Hà Nội",cho-thue-nha-mat-pho
Cho thuê nhà mặt phố Quang Trung 35m2x3 tầng mặt tiền 4m chỉ 33tr/th spa thẩm mỹ vào luôn siêu lộc,33 triệu/tháng,35 m²,"Hai Bà Trưng, Hà Nội",cho-thue-nha-mat-pho
Cho thuê nhà mặt phố Trương Công Giai 75m2 x 2 tầng MT 7m KD mọi mô hình 30tr/th đoạn đẹp nhất,30 triệu/tháng,75 m²,"Cầu Giấy, Hà Nội",cho-thue-nha-mat-pho
Cho thuê nhà mặt phố Vũ Tông Phan; 2 tầng x 100m,40 triệu/tháng,100 m²,"Thanh Xuân, Hà Nội",cho-thue-nha-mat-pho
"Cho thuê nhà 4 tầng mặt tiền đường Tiểu La, Hải Châu",35 triệu/tháng,140 m²,"Hải Châu, Đà Nẵng",cho-thue-nha-mat-pho
Cho thuê nhà mặt phố Vũ Trọng Phụng diện tích 35m2 mặt tiền 4.5m giá thuê chỉ 25tr tốt nhất phố,25 triệu/tháng,35 m²,"Thanh Xuân, Hà Nội",cho-thue-nha-mat-pho
"Hot! Cho thuê nhà mặt phố Thái Hà 120m2, MT 5m giá 35tr siêu đẹp KD mọi mô hình ngay trước tòa VP",35 triệu/tháng,120 m²,"Đống Đa, Hà Nội",cho-thue-nha-mat-pho
"Cho thuê mặt bằng KD hoặc văn phòng 80m2 mặt tiền 8m gần ngã 4 Nguyễn Khánh Toàn, view cực đẹp","26,9 triệu/tháng",80 m²,"Cầu Giấy, Hà Nội",cho-thue-nha-mat-pho
"Cần cho thuê gấp căn nhà phố, hướng Nam, KDC: Nam Long, P. Tân Thuận Đông, Q7. Giá 30 tr/th - 120m2",30 triệu/tháng,120 m²,"Quận 7, Hồ Chí Minh",cho-thue-nha-mat-pho
"Cho thuê nhà mặt đường 442, An Trang, An Đồng, An Dương, Hải Phòng",20 triệu/tháng,120 m²,"An Dương, Hải Phòng",cho-thue-nha-mat-pho
Tổng hợp mặt bằng cho thuê phố Hoàng Quốc Việt. Hot. Vị trí đẹp,Giá thỏa thuận,400 m²,"Cầu Giấy, Hà Nội",cho-thue-nha-mat-pho
Tổng hợp mặt bằng cho thuê mặt phố Hai Bà Trưng hot vị trí đẹp,Giá thỏa thuận,350 m²,"Hoàn Kiếm, Hà Nội",cho-thue-nha-mat-pho
"Tổng hợp các mặt bằng cho thuê nhà mặt phố Triệu Việt Vương, hot, vị trí đẹp",Giá thỏa thuận,230 m²,"Hai Bà Trưng, Hà Nội",cho-thue-nha-mat-pho
"Ngay chợ Bến Thành, mặt tiền 138 Lê Thánh Tôn, 4x20, 3 tầng",149 triệu/tháng,240 m²,"Quận 1, Hồ Chí Minh",cho-thue-nha-mat-pho
"Đi xa nên cần cho thuê gấp căn nhà phố hướng Nam, mặt tiền đường Hoàng Quốc Việt, P. Phú Mỹ, Q. 7",40 triệu/tháng,132 m²,"Quận 7, Hồ Chí Minh",cho-thue-nha-mat-pho
Cho thuê mặt bằng kinh doanh mặt phố Mạc Thái Tông 120m2x4T MT 8m 100tr/tháng,100 triệu/tháng,120 m²,"Cầu Giấy, Hà Nội",cho-thue-nha-mat-pho
"Tổng hợp mặt bằng cho thuê nhà mặt phố Bạch Mai, vị trí đẹp",Giá thỏa thuận,250 m²,"Hai Bà Trưng, Hà Nội",cho-thue-nha-mat-pho
MT Trần Quang Khải 4x12m 1T lửng 2L 5P cho KD đa ngành giá chỉ 35tr,35 triệu/tháng,48 m²,"Quận 1, Hồ Chí Minh",cho-thue-nha-mat-pho
"Tổng hợp mặt bằng cho thuê nhà mặt phố Xã Đàn, MT rộng hot vị trí đẹp hot",Giá thỏa thuận,600 m²,"Đống Đa, Hà Nội",cho-thue-nha-mat-pho
Tổng hợp MB mặt phố Thái Hà cho thuê mặt tiền rộng hot vị trí đẹp,80 triệu/tháng,70 m²,"Đống Đa, Hà Nội",cho-thue-nha-mat-pho
Cho thuê căn góc lớn ngã tư công viên nhạc nước Cityland Park Hilss,120 triệu/tháng,140 m²,"Gò Vấp, Hồ Chí Minh",cho-thue-nha-mat-pho
"Căn hộ trệt lớn có gác, độc lập, chính chủ cho thuê 55m2 khu Bình Triệu, Thủ Đức",6 triệu/tháng,55 m²,"Thủ Đức, Hồ Chí Minh",cho-thue-nha-mat-pho
"Cho thuê nhà mặt tiền Lý Thái Tổ, Quận 3, DT: 12x25m, 1 trệt, 2 lầu, DTSD: 900m2",100 triệu/tháng,300 m²,"Quận 3, Hồ Chí Minh",cho-thue-nha-mat-pho
"Cho thuê nhà mặt tiền Nguyễn Văn Mai, Quận 3, DT: 12x25m, 1 trệt, 2 lầu, DTSD: 900m2",80 triệu/tháng,300 m²,"Quận 3, Hồ Chí Minh",cho-thue-nha-mat-pho
"Cho thuê tòa nhà mặt tiền Hòa Hưng, Quận 3, DT: 7.5x20m, 1 hầm 1 trệt 6 lầu TM, DTSD: 1.200m2",50 triệu/tháng,150 m²,"Quận 3, Hồ Chí Minh",cho-thue-nha-mat-pho
"Cho thuê nhà góc 2 mặt tiền đường Trần Cao Vân, Quận 3, DT: 12x25m, 1 trệt, 2 lầu, DTSD: 900m2",100 triệu/tháng,300 m²,"Quận 3, Hồ Chí Minh",cho-thue-nha-mat-pho
"Cho thuê nhà góc 2 mặt tiền Huỳnh Khương Ninh, quận 1, DT: 27x36m, 1 trệt 1 lầu, DTSD: 1.900m2",750 triệu/tháng,972 m²,"Quận 1, Hồ Chí Minh",cho-thue-nha-mat-pho
Tổng hợp các mặt bằng cho thuê phố Phan Chu Trinh. Vị trí đẹp hot,Giá thỏa thuận,480 m²,"Hoàn Kiếm, Hà Nội",cho-thue-nha-mat-pho
"Cho thuê mặt bằng mặt tiền Đặng Dung, Quận 1, DT: 10x20m, 1 trệt, 3 lầu, DTSD: 800m2",90 triệu/tháng,200 m²,"Quận 1, Hồ Chí Minh",cho-thue-nha-mat-pho
