Title,Price,Area,Location,type
"Cho thuê kho 380m2 - 36 triệu/th, đường cont 40F vào ok, PCCC tự động",36 triệu/tháng,400 m²,"Quận 6, Hồ Chí Minh",cho-thue-kho-nha-xuong-dat
"Kho cho thuê mặt tiền đường Nguyễn Thị Trọn. Diện tích 10x28m, có điện thoại 3 pha",10 triệu/tháng,280 m²,"Bình Chánh, Hồ Chí Minh",cho-thue-kho-nha-xuong-dat
"Cho thuê kho xưởng 19.000m2 KCN Sóng Thần, Dĩ An, Bình Dương",935 triệu/tháng,19.000 m²,"Dĩ An, Bình Dương",cho-thue-kho-nha-xuong-dat
"Cho thuê kho xưởng 330m2 gần Nam Cao, Phường Tân Phú, Quận 9",30 triệu/tháng,330 m²,"Quận 9, Hồ Chí Minh",cho-thue-kho-nha-xuong-dat
"Cho thuê kho 1000m2 - 10000m2 KCN Long Hậu, Long Hậu, Cần Giuộc, Long An",115 triệu/tháng,1.000 m²,"Cần Giuộc, Long An",cho-thue-kho-nha-xuong-dat
"Cho thuê kho, DT: 250m2 Mỹ Đình Tân Mỹ giá: 15.5tr","15,5 triệu/tháng",250 m²,"Nam Từ Liêm, Hà Nội",cho-thue-kho-nha-xuong-dat
"Kho xưởng cho thuê Đông Hưng Thuận, Quận 12, DT: 550m2",35 triệu/tháng,550 m²,"Quận 12, Hồ Chí Minh",cho-thue-kho-nha-xuong-dat
"Kho xưởng cho thuê Trung Mỹ Tây, Quận 12, DT: 3500m2, đường container",60 nghìn/m²,3.500 m²,"Quận 12, Hồ Chí Minh",cho-thue-kho-nha-xuong-dat
"Kho xưởng cho thuê 1100m2 giá chỉ 125.000/m2 Long Hậu, đầy đủ tiện ích vào hoạt động ngay",125 nghìn/m²,1.000 m²,"Cần Giuộc, Long An",cho-thue-kho-nha-xuong-dat
"Cho thuê kho 1300, 2500, 2700, 4000 m2, ở Võ Văn Vân, giá 65 tr/1 th",65 triệu/tháng,1.300 m²,"Bình Chánh, Hồ Chí Minh",cho-thue-kho-nha-xuong-dat
Kho xưởng 200m2 góc 2 mặt tiền trong KDC gần hãng xe Toyota Cái Răng,12 triệu/tháng,200 m²,"Cái Răng, Cần Thơ",cho-thue-kho-nha-xuong-dat
"Cho thuê kho xưởng 2000m2 gần KCN Tân Tạo, đường Cont tự do, trạm hạ thế. Giá 85 tr/th",85 triệu/tháng,1.700 m²,"Bình Tân, Hồ Chí Minh",cho-thue-kho-nha-xuong-dat
"Kho xưởng 780m2 trong khu công nghiệp Trà Nóc, có PCCC và trạm điện 3 pha 630kVA",55 nghìn/m²,780 m²,"Bình Thủy, Cần Thơ",cho-thue-kho-nha-xuong-dat
Kho xưởng 580m2 gần công viên Văn Hoá Miền Tây,30 triệu/tháng,580 m²,"Ninh Kiều, Cần Thơ",cho-thue-kho-nha-xuong-dat
"Cho thuê xưởng 4300m2 (XD: 3000m2) mới 100% KCN Đức Hòa. PCCC tự động, trạm hạ thế. Giá 210 triệu",210 triệu/tháng,3.000 m²,"Đức Hòa, Long An",cho-thue-kho-nha-xuong-dat
"Cho thuê xưởng tại Kỳ Sơn - Hòa Bình DT 4500m2, 5000m2",52 nghìn/m²,4.500 m²,"Hòa Bình, Hòa Bình",cho-thue-kho-nha-xuong-dat
"Cho thuê kho 3000m2 (XD 1700m2) gần KCN Tân Đô. PCCC, nền Epoxy, trạm hạ thế. Giá 120 tr/th",120 triệu/tháng,3.000 m²,"Đức Hòa, Long An",cho-thue-kho-nha-xuong-dat
"Cho thuê kho 5000m2 (XD: 3100m2) KCN Tân Đức, có PCCC, trạm hạ thế, văn phòng, giá 150 tr/th",150 triệu/tháng,3.100 m²,"Đức Hòa, Long An",cho-thue-kho-nha-xuong-dat
Cho thuê xưởng giá rẻ 650m2 chỉ 16 triệu/tháng -Long Bình-Biên Hòa-Đồng Nai,16 triệu/tháng,650 m²,"Biên Hòa, Đồng Nai",cho-thue-kho-nha-xuong-dat
Cho thuê xưởng 2000m2 giá chỉ 110 triệu/tháng - Trảng Dài - Biên Hòa - Đồng Nai,110 triệu/tháng,2.000 m²,"Biên Hòa, Đồng Nai",cho-thue-kho-nha-xuong-dat
"Cho thuê kho xưởng đẹp (550m2), xe cont 24/24, Bình Tân",44 triệu/tháng,550 m²,"Bình Tân, Hồ Chí Minh",cho-thue-kho-nha-xuong-dat
Cho thuê kho 145m2 tại Minh Phú Sóc Sơn 60 nghìn/m2,60 nghìn/m²,145 m²,"Sóc Sơn, Hà Nội",cho-thue-kho-nha-xuong-dat
Cho thuê 150m2 tại khu công nghiệp Lại Yên,80 nghìn/m²,150 m²,"Hoài Đức, Hà Nội",cho-thue-kho-nha-xuong-dat
"Cho thuê đất 12x20, mặt tiền Đồng Văn Cống, 2 MT trước sau, P. TML Q. 2",20 triệu/tháng,240 m²,"Quận 2, Hồ Chí Minh",cho-thue-kho-nha-xuong-dat
Cần cho thuê nhà xưởng 1 tầng 320m2 nằm trên trục đường 354 - Chiến Thắng - An Lão - Hải Phòng,15 triệu/tháng,320 m²,"An Lão, Hải Phòng",cho-thue-kho-nha-xuong-dat
"Cho thuê xưởng 12.600m2 trong khu công nghiệp Thạnh Phú, Vĩnh Cửu, Đồng Nai. Ngay đường Đồng Khởi",650 triệu/tháng,12.600 m²,"Vĩnh Cửu, Đồng Nai",cho-thue-kho-nha-xuong-dat
"Cho thuê kho, xưởng Mậu Lương 60m2 gác xép 6tr/th xe công đỗ cửa",6 triệu/tháng,60 m²,"Hà Đông, Hà Nội",cho-thue-kho-nha-xuong-dat
Cho thuê kho từ 400m2 trong khu công nghiệp Thọ Quang và cạnh cảng Tiên Sa Đà Nẵng,24 triệu/tháng,400 m²,"Sơn Trà, Đà Nẵng",cho-thue-kho-nha-xuong-dat
Cho thuê xưởng trong cụm TPM Bình Dương,"77,41 nghìn/m²",6.300 m²,"Tân Uyên, Bình Dương",cho-thue-kho-nha-xuong-dat
Cho thuê xưởng gần vòng xoay TPM Bình Dương,80 triệu/tháng,1.500 m²,"Tân Uyên, Bình Dương",cho-thue-kho-nha-xuong-dat
"Cho thuê xưởng Tân Phước Khánh giáp Bình Chuẩn, Bình Dương",80 triệu/tháng,3.000 m²,"Tân Uyên, Bình Dương",cho-thue-kho-nha-xuong-dat
Cho thuê xưởng Thuận An giá rẻ xưởng đẹp,90 triệu/tháng,2.200 m²,"Thuận An, Bình Dương",cho-thue-kho-nha-xuong-dat
"Cho thuê kho mới 2700m2 gần Gò Đen, Bến Lức. Đường container, Palang 5t, trạm 250kva. Giá 150tr",150 triệu/tháng,2.700 m²,"Bến Lức, Long An",cho-thue-kho-nha-xuong-dat
"Cho thuê xưởng 16.000m2 khu công nghiệp Bầu Xéo Sông Trầu, Trảng Bom, Đồng Nai",750 triệu/tháng,16.000 m²,"Trảng Bom, Đồng Nai",cho-thue-kho-nha-xuong-dat
"Cho thuê kho mới 1500m2 - 4000m2 KCN Hiệp Phước, Nhà Bè. PCCC tự động, nền Epoxy. Giá từ 105tr",105 triệu/tháng,1.500 m²,"Nhà Bè, Hồ Chí Minh",cho-thue-kho-nha-xuong-dat
"Cho thuê nhà xưởng, kho gần TP. HCM, giá ưu đãi, gọi ngay 0906 938 ***",Giá thỏa thuận,3.000 m²,"Cần Giuộc, Long An",cho-thue-kho-nha-xuong-dat
"Cho thuê kho mới 1300m2 ở Bến Lức, giáp Bình Chánh. Có điện 3fa. Giá 45tr",45 triệu/tháng,1.300 m²,"Bến Lức, Long An",cho-thue-kho-nha-xuong-dat
"Cho thuê kho 750m2 gần cầu Tham Lương, KCN Tân Bình. Đường container, có văn phòng. Giá 70tr",70 triệu/tháng,750 m²,"Quận 12, Hồ Chí Minh",cho-thue-kho-nha-xuong-dat
"Cho thuê kho 500m2, đường tải vào tới kho, kho mới đẹp",50 triệu/tháng,500 m²,"Tân Phú, Hồ Chí Minh",cho-thue-kho-nha-xuong-dat
"Cho thuê kho xưởng 2100m2/ tổng 3200m2 - đường Container 40F, trần thạch cao. Nền gạch men sạch sẽ",220 triệu/tháng,2.500 m²,"Tân Phú, Hồ Chí Minh",cho-thue-kho-nha-xuong-dat
Cho thuê xưởng 2500m2 130tr Bến Cát 0907 838 ***,130 triệu/tháng,2.500 m²,"Bến Cát, Bình Dương",cho-thue-kho-nha-xuong-dat
"Cho thuê kho chung full dịch vụ, đóng hàng thương mại ĐT, vận chuyển, thuê theo ngày, tháng, năm",Giá thỏa thuận,1.000 m²,"Bình Tân, Hồ Chí Minh",cho-thue-kho-nha-xuong-dat
"Cho thuê kho chung full dịch vụ, đóng hàng thương mại ĐT",Giá thỏa thuận,5.000 m²,"Bình Tân, Hồ Chí Minh",cho-thue-kho-nha-xuong-dat
Cho thuê nhà xưởng 6.000m2 giá 504 triệu/tháng - An Phước - Long Thành - Đồng Nai,504 triệu/tháng,6.000 m²,"Long Thành, Đồng Nai",cho-thue-kho-nha-xuong-dat
"Cho thuê xưởng Tân Uyên khuôn 6500m2 xưởng 4500m2, đất SKC PCCC tự động nền sơn epoxy tiếp đa nghề",290 triệu/tháng,6.500 m²,"Tân Uyên, Bình Dương",cho-thue-kho-nha-xuong-dat
"Cho thuê kho 800m2, ở Vĩnh Lộc, đường xe tải 5 tấn, vào được, giá 35 tr/th 0937 669 ***",35 triệu/tháng,800 m²,"Bình Chánh, Hồ Chí Minh",cho-thue-kho-nha-xuong-dat
Cho thuê kho xưởng trong khu công nghiệp Hòa Khánh Đà Nẵng DT 680m2 có sẵn PCCC tự động,37 triệu/tháng,680 m²,"Liên Chiểu, Đà Nẵng",cho-thue-kho-nha-xuong-dat
"Cho thuê 120m ngang mặt tiền QL51 ngay trạm dừng Bò Sữa cũ, sâu 40m,70m,200m có cắt lẻ theo nhu cầu",Giá thỏa thuận,1.000 m²,"Biên Hòa, Đồng Nai",cho-thue-kho-nha-xuong-dat
Cho thuê kho xưởng KV Hồng Bàng Hải Phòng 2000m2 PCCC vòng ngoài - V3 Home 0961 442 ***,50 nghìn/m²,2.000 m²,"Hồng Bàng, Hải Phòng",cho-thue-kho-nha-xuong-dat
